ChpVrsNdx,NumWrd,bPilcrow,PText,RText
6938,15,0,"And his father Isaac said unto him, Come near now, and kiss me, my son.","And his father Isaac said unto him, Come near now, and kiss me, my son."
6939,38,0,"And he came near, and kissed him: and he smelled the smell of his raiment, and blessed him, and said, See, the smell of my son is as the smell of a field which the LORD hath blessed:","And he came near, and kissed him: and he smelled the smell of his raiment, and blessed him, and said, See, the smell of my son <i>is</i> as the smell of a field which the L<font size=""-1"">ORD</font> hath blessed:"
6940,21,0,"Therefore God give thee of the dew of heaven, and the fatness of the earth, and plenty of corn and wine:","Therefore God give thee of the dew of heaven, and the fatness of the earth, and plenty of corn and wine:"
6941,38,0,"Let people serve thee, and nations bow down to thee: be lord over thy brethren, and let thy mother's sons bow down to thee: cursed be every one that curseth thee, and blessed be he that blesseth thee.","Let people serve thee, and nations bow down to thee: be lord over thy brethren, and let thy mother's sons bow down to thee: cursed <i>be</i> every one that curseth thee, and blessed <i>be</i> he that blesseth thee."
6942,39,1,"And it came to pass, as soon as Isaac had made an end of blessing Jacob, and Jacob was yet scarce gone out from the presence of Isaac his father, that Esau his brother came in from his hunting.","¶And it came to pass, as soon as Isaac had made an end of blessing Jacob, and Jacob was yet scarce gone out from the presence of Isaac his father, that Esau his brother came in from his hunting."
6943,34,0,"And he also had made savoury meat, and brought it unto his father, and said unto his father, Let my father arise, and eat of his son's venison, that thy soul may bless me.","And he also had made savoury meat, and brought it unto his father, and said unto his father, Let my father arise, and eat of his son's venison, that thy soul may bless me."
6944,20,0,"And Isaac his father said unto him, Who art thou? And he said, I am thy son, thy firstborn Esau.","And Isaac his father said unto him, Who <i>art</i> thou? And he said, I <i>am</i> thy son, thy firstborn Esau."
6945,38,0,"And Isaac trembled very exceedingly, and said, Who? where is he that hath taken venison, and brought it me, and I have eaten of all before thou camest, and have blessed him? yea, and he shall be blessed.","And Isaac trembled very exceedingly, and said, Who? where <i>is</i> he that hath taken venison, and brought <i>it</i> me, and I have eaten of all before thou camest, and have blessed him? yea, <i>and</i> he shall be blessed."
6946,31,0,"And when Esau heard the words of his father, he cried with a great and exceeding bitter cry, and said unto his father, Bless me, even me also, O my father.","And when Esau heard the words of his father, he cried with a great and exceeding bitter cry, and said unto his father, Bless me, <i>even</i> me also, O my father."
6947,14,0,"And he said, Thy brother came with subtilty, and hath taken away thy blessing.","And he said, Thy brother came with subtilty, and hath taken away thy blessing."
6948,42,0,"And he said, Is not he rightly named Jacob? for he hath supplanted me these two times: he took away my birthright; and, behold, now he hath taken away my blessing. And he said, Hast thou not reserved a blessing for me?","And he said, Is not he rightly named Jacob? for he hath supplanted me these two times: he took away my birthright; and, behold, now he hath taken away my blessing. And he said, Hast thou not reserved a blessing for me?"
6949,44,0,"And Isaac answered and said unto Esau, Behold, I have made him thy lord, and all his brethren have I given to him for servants; and with corn and wine have I sustained him: and what shall I do now unto thee, my son?","And Isaac answered and said unto Esau, Behold, I have made him thy lord, and all his brethren have I given to him for servants; and with corn and wine have I sustained him: and what shall I do now unto thee, my son?"
6950,29,0,"And Esau said unto his father, Hast thou but one blessing, my father? bless me, even me also, O my father. And Esau lifted up his voice, and wept.","And Esau said unto his father, Hast thou but one blessing, my father? bless me, <i>even</i> me also, O my father. And Esau lifted up his voice, and wept."
6951,27,0,"And Isaac his father answered and said unto him, Behold, thy dwelling shall be the fatness of the earth, and of the dew of heaven from above;","And Isaac his father answered and said unto him, Behold, thy dwelling shall be the fatness of the earth, and of the dew of heaven from above;"
6952,34,0,"And by thy sword shalt thou live, and shalt serve thy brother; and it shall come to pass when thou shalt have the dominion, that thou shalt break his yoke from off thy neck.","And by thy sword shalt thou live, and shalt serve thy brother; and it shall come to pass when thou shalt have the dominion, that thou shalt break his yoke from off thy neck."
6953,36,1,"And Esau hated Jacob because of the blessing wherewith his father blessed him: and Esau said in his heart, The days of mourning for my father are at hand; then will I slay my brother Jacob.","¶And Esau hated Jacob because of the blessing wherewith his father blessed him: and Esau said in his heart, The days of mourning for my father are at hand; then will I slay my brother Jacob."
6954,39,0,"And these words of Esau her elder son were told to Rebekah: and she sent and called Jacob her younger son, and said unto him, Behold, thy brother Esau, as touching thee, doth comfort himself, purposing to kill thee.","And these words of Esau her elder son were told to Rebekah: and she sent and called Jacob her younger son, and said unto him, Behold, thy brother Esau, as touching thee, doth comfort himself, <i>purposing</i> to kill thee."
6955,17,0,"Now therefore, my son, obey my voice; and arise, flee thou to Laban my brother to Haran;","Now therefore, my son, obey my voice; and arise, flee thou to Laban my brother to Haran;"
6956,13,0,"And tarry with him a few days, until thy brother's fury turn away;","And tarry with him a few days, until thy brother's fury turn away;"
6957,39,0,"Until thy brother's anger turn away from thee, and he forget that which thou hast done to him: then I will send, and fetch thee from thence: why should I be deprived also of you both in one day?","Until thy brother's anger turn away from thee, and he forget <i>that</i> which thou hast done to him: then I will send, and fetch thee from thence: why should I be deprived also of you both in one day?"
6958,45,0,"And Rebekah said to Isaac, I am weary of my life because of the daughters of Heth: if Jacob take a wife of the daughters of Heth, such as these which are of the daughters of the land, what good shall my life do me?","And Rebekah said to Isaac, I am weary of my life because of the daughters of Heth: if Jacob take a wife of the daughters of Heth, such as these <i>which are</i> of the daughters of the land, what good shall my life do me?"
7169,25,0,"And Isaac called Jacob, and blessed him, and charged him, and said unto him, Thou shalt not take a wife of the daughters of Canaan.","And Isaac called Jacob, and blessed him, and charged him, and said unto him, Thou shalt not take a wife of the daughters of Canaan."
7170,27,0,"Arise, go to Padan-aram, to the house of Bethuel thy mother's father; and take thee a wife from thence of the daughters of Laban thy mother's brother.","Arise, go to Padan–aram, to the house of Bethuel thy mother's father; and take thee a wife from thence of the daughters of Laban thy mother's brother."
7171,20,0,"And God Almighty bless thee, and make thee fruitful, and multiply thee, that thou mayest be a multitude of people;","And God Almighty bless thee, and make thee fruitful, and multiply thee, that thou mayest be a multitude of people;"
7172,31,0,"And give thee the blessing of Abraham, to thee, and to thy seed with thee; that thou mayest inherit the land wherein thou art a stranger, which God gave unto Abraham.","And give thee the blessing of Abraham, to thee, and to thy seed with thee; that thou mayest inherit the land wherein thou art a stranger, which God gave unto Abraham."
7173,25,0,"And Isaac sent away Jacob: and he went to Padan-aram unto Laban, son of Bethuel the Syrian, the brother of Rebekah, Jacob's and Esau's mother.","And Isaac sent away Jacob: and he went to Padan–aram unto Laban, son of Bethuel the Syrian, the brother of Rebekah, Jacob's and Esau's mother."
7174,44,1,"When Esau saw that Isaac had blessed Jacob, and sent him away to Padan-aram, to take him a wife from thence; and that as he blessed him he gave him a charge, saying, Thou shalt not take a wife of the daughters of Canaan;","¶When Esau saw that Isaac had blessed Jacob, and sent him away to Padan–aram, to take him a wife from thence; and that as he blessed him he gave him a charge, saying, Thou shalt not take a wife of the daughters of Canaan;"
7175,14,0,"And that Jacob obeyed his father and his mother, and was gone to Padan-aram;","And that Jacob obeyed his father and his mother, and was gone to Padan–aram;"
7176,13,0,"And Esau seeing that the daughters of Canaan pleased not Isaac his father;","And Esau seeing that the daughters of Canaan pleased not Isaac his father;"
7177,28,0,"Then went Esau unto Ishmael, and took unto the wives which he had Mahalath the daughter of Ishmael Abraham's son, the sister of Nebajoth, to be his wife.","Then went Esau unto Ishmael, and took unto the wives which he had Mahalath the daughter of Ishmael Abraham's son, the sister of Nebajoth, to be his wife."
7178,10,1,"And Jacob went out from Beer-sheba, and went toward Haran.","¶And Jacob went out from Beer–sheba, and went toward Haran."
7179,40,0,"And he lighted upon a certain place, and tarried there all night, because the sun was set; and he took of the stones of that place, and put them for his pillows, and lay down in that place to sleep.","And he lighted upon a certain place, and tarried there all night, because the sun was set; and he took of the stones of that place, and put <i>them for</i> his pillows, and lay down in that place to sleep."
7180,31,0,"And he dreamed, and behold a ladder set up on the earth, and the top of it reached to heaven: and behold the angels of God ascending and descending on it.","And he dreamed, and behold a ladder set up on the earth, and the top of it reached to heaven: and behold the angels of God ascending and descending on it."
7181,38,0,"And, behold, the LORD stood above it, and said, I am the LORD God of Abraham thy father, and the God of Isaac: the land whereon thou liest, to thee will I give it, and to thy seed;","And, behold, the L<font size=""-1"">ORD</font> stood above it, and said, I <i>am</i> the L<font size=""-1"">ORD</font> God of Abraham thy father, and the God of Isaac: the land whereon thou liest, to thee will I give it, and to thy seed;"
7182,47,0,"And thy seed shall be as the dust of the earth, and thou shalt spread abroad to the west, and to the east, and to the north, and to the south: and in thee and in thy seed shall all the families of the earth be blessed.","And thy seed shall be as the dust of the earth, and thou shalt spread abroad to the west, and to the east, and to the north, and to the south: and in thee and in thy seed shall all the families of the earth be blessed."
7183,42,0,"And, behold, I am with thee, and will keep thee in all places whither thou goest, and will bring thee again into this land; for I will not leave thee, until I have done that which I have spoken to thee of.","And, behold, I <i>am</i> with thee, and will keep thee in all <i>places</i> whither thou goest, and will bring thee again into this land; for I will not leave thee, until I have done <i>that</i> which I have spoken to thee of."
7184,22,1,"And Jacob awaked out of his sleep, and he said, Surely the LORD is in this place; and I knew it not.","¶And Jacob awaked out of his sleep, and he said, Surely the L<font size=""-1"">ORD</font> is in this place; and I knew <i>it</i> not."
7185,27,0,"And he was afraid, and said, How dreadful is this place! this is none other but the house of God, and this is the gate of heaven.","And he was afraid, and said, How dreadful <i>is</i> this place! this <i>is</i> none other but the house of God, and this <i>is</i> the gate of heaven."
7186,34,0,"And Jacob rose up early in the morning, and took the stone that he had put for his pillows, and set it up for a pillar, and poured oil upon the top of it.","And Jacob rose up early in the morning, and took the stone that he had put <i>for</i> his pillows, and set it up <i>for</i> a pillar, and poured oil upon the top of it."
7187,21,0,"And he called the name of that place Beth-el: but the name of that city was called Luz at the first.","And he called the name of that place Beth–el: but the name of that city <i>was called</i> Luz at the first."
7188,34,0,"And Jacob vowed a vow, saying, If God will be with me, and will keep me in this way that I go, and will give me bread to eat, and raiment to put on,","And Jacob vowed a vow, saying, If God will be with me, and will keep me in this way that I go, and will give me bread to eat, and raiment to put on,"
7189,18,0,"So that I come again to my father's house in peace; then shall the LORD be my God:","So that I come again to my father's house in peace; then shall the L<font size=""-1"">ORD</font> be my God:"
7190,30,0,"And this stone, which I have set for a pillar, shall be God's house: and of all that thou shalt give me I will surely give the tenth unto thee.","And this stone, which I have set <i>for</i> a pillar, shall be God's house: and of all that thou shalt give me I will surely give the tenth unto thee."
7425,17,0,"Then Jacob went on his journey, and came into the land of the people of the east.","Then Jacob went on his journey, and came into the land of the people of the east."
7426,39,0,"And he looked, and behold a well in the field, and, lo, there were three flocks of sheep lying by it; for out of that well they watered the flocks: and a great stone was upon the well's mouth.","And he looked, and behold a well in the field, and, lo, there <i>were</i> three flocks of sheep lying by it; for out of that well they watered the flocks: and a great stone <i>was</i> upon the well's mouth."
7427,32,0,"And thither were all the flocks gathered: and they rolled the stone from the well's mouth, and watered the sheep, and put the stone again upon the well's mouth in his place.","And thither were all the flocks gathered: and they rolled the stone from the well's mouth, and watered the sheep, and put the stone again upon the well's mouth in his place."
7428,17,0,"And Jacob said unto them, My brethren, whence be ye? And they said, Of Haran are we.","And Jacob said unto them, My brethren, whence <i>be</i> ye? And they said, Of Haran <i>are</i> we."
7429,18,0,"And he said unto them, Know ye Laban the son of Nahor? And they said, We know him.","And he said unto them, Know ye Laban the son of Nahor? And they said, We know <i>him</i>."
7430,23,0,"And he said unto them, Is he well? And they said, He is well: and, behold, Rachel his daughter cometh with the sheep.","And he said unto them, <i>Is</i> he well? And they said, <i>He is</i> well: and, behold, Rachel his daughter cometh with the sheep."
7431,29,0,"And he said, Lo, it is yet high day, neither is it time that the cattle should be gathered together: water ye the sheep, and go and feed them.","And he said, Lo, <i>it is</i> yet high day, neither <i>is it</i> time that the cattle should be gathered together: water ye the sheep, and go <i>and</i> feed <i>them</i>."
7432,27,0,"And they said, We cannot, until all the flocks be gathered together, and till they roll the stone from the well's mouth; then we water the sheep.","And they said, We cannot, until all the flocks be gathered together, and <i>till</i> they roll the stone from the well's mouth; then we water the sheep."
7433,17,1,"And while he yet spake with them, Rachel came with her father's sheep: for she kept them.","¶And while he yet spake with them, Rachel came with her father's sheep: for she kept them."
7434,45,0,"And it came to pass, when Jacob saw Rachel the daughter of Laban his mother's brother, and the sheep of Laban his mother's brother, that Jacob went near, and rolled the stone from the well's mouth, and watered the flock of Laban his mother's brother.","And it came to pass, when Jacob saw Rachel the daughter of Laban his mother's brother, and the sheep of Laban his mother's brother, that Jacob went near, and rolled the stone from the well's mouth, and watered the flock of Laban his mother's brother."
7435,11,0,"And Jacob kissed Rachel, and lifted up his voice, and wept.","And Jacob kissed Rachel, and lifted up his voice, and wept."
7436,23,0,"And Jacob told Rachel that he was her father's brother, and that he was Rebekah's son: and she ran and told her father.","And Jacob told Rachel that he <i>was</i> her father's brother, and that he <i>was</i> Rebekah's son: and she ran and told her father."
7437,40,0,"And it came to pass, when Laban heard the tidings of Jacob his sister's son, that he ran to meet him, and embraced him, and kissed him, and brought him to his house. And he told Laban all these things.","And it came to pass, when Laban heard the tidings of Jacob his sister's son, that he ran to meet him, and embraced him, and kissed him, and brought him to his house. And he told Laban all these things."
7438,23,0,"And Laban said to him, Surely thou art my bone and my flesh. And he abode with him the space of a month.","And Laban said to him, Surely thou <i>art</i> my bone and my flesh. And he abode with him the space of a month."
7439,24,1,"And Laban said unto Jacob, Because thou art my brother, shouldest thou therefore serve me for nought? tell me, what shall thy wages be?","¶And Laban said unto Jacob, Because thou <i>art</i> my brother, shouldest thou therefore serve me for nought? tell me, what <i>shall</i> thy wages <i>be</i>?"
7440,20,0,"And Laban had two daughters: the name of the elder was Leah, and the name of the younger was Rachel.","And Laban had two daughters: the name of the elder <i>was</i> Leah, and the name of the younger <i>was</i> Rachel."
7441,11,0,"Leah was tender eyed; but Rachel was beautiful and well favoured.","Leah <i>was</i> tender eyed; but Rachel was beautiful and well favoured."
7442,17,0,"And Jacob loved Rachel; and said, I will serve thee seven years for Rachel thy younger daughter.","And Jacob loved Rachel; and said, I will serve thee seven years for Rachel thy younger daughter."
7443,24,0,"And Laban said, It is better that I give her to thee, than that I should give her to another man: abide with me.","And Laban said, <i>It is</i> better that I give her to thee, than that I should give her to another man: abide with me."
7444,23,0,"And Jacob served seven years for Rachel; and they seemed unto him but a few days, for the love he had to her.","And Jacob served seven years for Rachel; and they seemed unto him <i>but</i> a few days, for the love he had to her."
7445,21,1,"And Jacob said unto Laban, Give me my wife, for my days are fulfilled, that I may go in unto her.","¶And Jacob said unto Laban, Give <i>me</i> my wife, for my days are fulfilled, that I may go in unto her."
7446,14,0,"And Laban gathered together all the men of the place, and made a feast.","And Laban gathered together all the men of the place, and made a feast."
7447,25,0,"And it came to pass in the evening, that he took Leah his daughter, and brought her to him; and he went in unto her.","And it came to pass in the evening, that he took Leah his daughter, and brought her to him; and he went in unto her."
7448,13,0,"And Laban gave unto his daughter Leah Zilpah his maid for an handmaid.","And Laban gave unto his daughter Leah Zilpah his maid <i>for</i> an handmaid."
7449,40,0,"And it came to pass, that in the morning, behold, it was Leah: and he said to Laban, What is this thou hast done unto me? did not I serve with thee for Rachel? wherefore then hast thou beguiled me?","And it came to pass, that in the morning, behold, it <i>was</i> Leah: and he said to Laban, What <i>is</i> this thou hast done unto me? did not I serve with thee for Rachel? wherefore then hast thou beguiled me?"
7450,19,0,"And Laban said, It must not be so done in our country, to give the younger before the firstborn.","And Laban said, It must not be so done in our country, to give the younger before the firstborn."
7451,23,0,"Fulfil her week, and we will give thee this also for the service which thou shalt serve with me yet seven other years.","Fulfil her week, and we will give thee this also for the service which thou shalt serve with me yet seven other years."
7452,18,0,"And Jacob did so, and fulfilled her week: and he gave him Rachel his daughter to wife also.","And Jacob did so, and fulfilled her week: and he gave him Rachel his daughter to wife also."
7453,14,0,"And Laban gave to Rachel his daughter Bilhah his handmaid to be her maid.","And Laban gave to Rachel his daughter Bilhah his handmaid to be her maid."
7454,23,0,"And he went in also unto Rachel, and he loved also Rachel more than Leah, and served with him yet seven other years.","And he went in also unto Rachel, and he loved also Rachel more than Leah, and served with him yet seven other years."
7455,17,1,"And when the LORD saw that Leah was hated, he opened her womb: but Rachel was barren.","¶And when the L<font size=""-1"">ORD</font> saw that Leah <i>was</i> hated, he opened her womb: but Rachel <i>was</i> barren."
7456,31,0,"And Leah conceived, and bare a son, and she called his name Reuben: for she said, Surely the LORD hath looked upon my affliction; now therefore my husband will love me.","And Leah conceived, and bare a son, and she called his name Reuben: for she said, Surely the L<font size=""-1"">ORD</font> hath looked upon my affliction; now therefore my husband will love me."
7457,33,0,"And she conceived again, and bare a son; and said, Because the LORD hath heard that I was hated, he hath therefore given me this son also: and she called his name Simeon.","And she conceived again, and bare a son; and said, Because the L<font size=""-1"">ORD</font> hath heard that I <i>was</i> hated, he hath therefore given me this <i>son</i> also: and she called his name Simeon."
7458,33,0,"And she conceived again, and bare a son; and said, Now this time will my husband be joined unto me, because I have born him three sons: therefore was his name called Levi.","And she conceived again, and bare a son; and said, Now this time will my husband be joined unto me, because I have born him three sons: therefore was his name called Levi."
7459,26,0,"And she conceived again, and bare a son: and she said, Now will I praise the LORD: therefore she called his name Judah; and left bearing.","And she conceived again, and bare a son: and she said, Now will I praise the L<font size=""-1"">ORD</font>: therefore she called his name Judah; and left bearing."
7681,25,0,"And when Rachel saw that she bare Jacob no children, Rachel envied her sister; and said unto Jacob, Give me children, or else I die.","And when Rachel saw that she bare Jacob no children, Rachel envied her sister; and said unto Jacob, Give me children, or else I die."
7682,25,0,"And Jacob's anger was kindled against Rachel: and he said, Am I in God's stead, who hath withheld from thee the fruit of the womb?","And Jacob's anger was kindled against Rachel: and he said, <i>Am</i> I in God's stead, who hath withheld from thee the fruit of the womb?"
7683,26,0,"And she said, Behold my maid Bilhah, go in unto her; and she shall bear upon my knees, that I may also have children by her.","And she said, Behold my maid Bilhah, go in unto her; and she shall bear upon my knees, that I may also have children by her."
7684,15,0,"And she gave him Bilhah her handmaid to wife: and Jacob went in unto her.","And she gave him Bilhah her handmaid to wife: and Jacob went in unto her."
7685,8,0,"And Bilhah conceived, and bare Jacob a son.","And Bilhah conceived, and bare Jacob a son."
7686,25,0,"And Rachel said, God hath judged me, and hath also heard my voice, and hath given me a son: therefore called she his name Dan.","And Rachel said, God hath judged me, and hath also heard my voice, and hath given me a son: therefore called she his name Dan."
7687,12,0,"And Bilhah Rachel's maid conceived again, and bare Jacob a second son.","And Bilhah Rachel's maid conceived again, and bare Jacob a second son."
7688,22,0,"And Rachel said, With great wrestlings have I wrestled with my sister, and I have prevailed: and she called his name Naphtali.","And Rachel said, With great wrestlings have I wrestled with my sister, and I have prevailed: and she called his name Naphtali."
7689,19,0,"When Leah saw that she had left bearing, she took Zilpah her maid, and gave her Jacob to wife.","When Leah saw that she had left bearing, she took Zilpah her maid, and gave her Jacob to wife."
7690,8,0,"And Zilpah Leah's maid bare Jacob a son.","And Zilpah Leah's maid bare Jacob a son."
7691,12,0,"And Leah said, A troop cometh: and she called his name Gad.","And Leah said, A troop cometh: and she called his name Gad."
7692,9,0,"And Zilpah Leah's maid bare Jacob a second son.","And Zilpah Leah's maid bare Jacob a second son."
7693,19,0,"And Leah said, Happy am I, for the daughters will call me blessed: and she called his name Asher.","And Leah said, Happy am I, for the daughters will call me blessed: and she called his name Asher."
