ChpVrsNdx,NumWrd,bPilcrow,PText,RText,Footnote
4623,43,0,"Every thing that openeth the matrix in all flesh, which they bring unto the LORD, whether it be of men or beasts, shall be thine: nevertheless the firstborn of man shalt thou surely redeem, and the firstling of unclean beasts shalt thou redeem.","Every thing that openeth the matrix in all flesh, which they bring unto the L<font size=""-1"">ORD</font>, <i>whether it be</i> of men or beasts, shall be thine: nevertheless the firstborn of man shalt thou surely redeem, and the firstling of unclean beasts shalt thou redeem.",""
4624,34,0,"And those that are to be redeemed from a month old shalt thou redeem, according to thine estimation, for the money of five shekels, after the shekel of the sanctuary, which is twenty gerahs.","And those that are to be redeemed from a month old shalt thou redeem, according to thine estimation, for the money of five shekels, after the shekel of the sanctuary, which <i>is</i> twenty gerahs.",""
4625,51,0,"But the firstling of a cow, or the firstling of a sheep, or the firstling of a goat, thou shalt not redeem; they are holy: thou shalt sprinkle their blood upon the altar, and shalt burn their fat for an offering made by fire, for a sweet savour unto the LORD.","But the firstling of a cow, or the firstling of a sheep, or the firstling of a goat, thou shalt not redeem; they <i>are</i> holy: thou shalt sprinkle their blood upon the altar, and shalt burn their fat <i>for</i> an offering made by fire, for a sweet savour unto the L<font size=""-1"">ORD</font>.",""
4626,19,0,"And the flesh of them shall be thine, as the wave breast and as the right shoulder are thine.","And the flesh of them shall be thine, as the wave breast and as the right shoulder are thine.",""
4627,53,0,"All the heave offerings of the holy things, which the children of Israel offer unto the LORD, have I given thee, and thy sons and thy daughters with thee, by a statute for ever: it is a covenant of salt for ever before the LORD unto thee and to thy seed with thee.","All the heave offerings of the holy things, which the children of Israel offer unto the L<font size=""-1"">ORD</font>, have I given thee, and thy sons and thy daughters with thee, by a statute for ever: it <i>is</i> a covenant of salt for ever before the L<font size=""-1"">ORD</font> unto thee and to thy seed with thee.",""
4628,34,1,"And the LORD spake unto Aaron, Thou shalt have no inheritance in their land, neither shalt thou have any part among them: I am thy part and thine inheritance among the children of Israel.","¶And the L<font size=""-1"">ORD</font> spake unto Aaron, Thou shalt have no inheritance in their land, neither shalt thou have any part among them: I <i>am</i> thy part and thine inheritance among the children of Israel.",""
4629,32,0,"And, behold, I have given the children of Levi all the tenth in Israel for an inheritance, for their service which they serve, even the service of the tabernacle of the congregation.","And, behold, I have given the children of Levi all the tenth in Israel for an inheritance, for their service which they serve, <i>even</i> the service of the tabernacle of the congregation.",""
4630,20,0,"Neither must the children of Israel henceforth come nigh the tabernacle of the congregation, lest they bear sin, and die.","Neither must the children of Israel henceforth come nigh the tabernacle of the congregation, lest they bear sin, and die.",""
4631,39,0,"But the Levites shall do the service of the tabernacle of the congregation, and they shall bear their iniquity: it shall be a statute for ever throughout your generations, that among the children of Israel they have no inheritance.","But the Levites shall do the service of the tabernacle of the congregation, and they shall bear their iniquity: <i>it shall be</i> a statute for ever throughout your generations, that among the children of Israel they have no inheritance.",""
4632,42,0,"But the tithes of the children of Israel, which they offer as an heave offering unto the LORD, I have given to the Levites to inherit: therefore I have said unto them, Among the children of Israel they shall have no inheritance.","But the tithes of the children of Israel, which they offer <i>as</i> an heave offering unto the L<font size=""-1"">ORD</font>, I have given to the Levites to inherit: therefore I have said unto them, Among the children of Israel they shall have no inheritance.",""
4633,7,1,"And the LORD spake unto Moses, saying,","¶And the L<font size=""-1"">ORD</font> spake unto Moses, saying,",""
4634,49,0,"Thus speak unto the Levites, and say unto them, When ye take of the children of Israel the tithes which I have given you from them for your inheritance, then ye shall offer up an heave offering of it for the LORD, even a tenth part of the tithe.","Thus speak unto the Levites, and say unto them, When ye take of the children of Israel the tithes which I have given you from them for your inheritance, then ye shall offer up an heave offering of it for the L<font size=""-1"">ORD</font>, <i>even</i> a tenth <i>part</i> of the tithe.",""
4635,26,0,"And this your heave offering shall be reckoned unto you, as though it were the corn of the threshingfloor, and as the fulness of the winepress.","And <i>this</i> your heave offering shall be reckoned unto you, as though <i>it were</i> the corn of the threshingfloor, and as the fulness of the winepress.",""
4636,36,0,"Thus ye also shall offer an heave offering unto the LORD of all your tithes, which ye receive of the children of Israel; and ye shall give thereof the LORD'S heave offering to Aaron the priest.","Thus ye also shall offer an heave offering unto the L<font size=""-1"">ORD</font> of all your tithes, which ye receive of the children of Israel; and ye shall give thereof the L<font size=""-1"">ORD'S</font> heave offering to Aaron the priest.",""
4637,27,0,"Out of all your gifts ye shall offer every heave offering of the LORD, of all the best thereof, even the hallowed part thereof out of it.","Out of all your gifts ye shall offer every heave offering of the L<font size=""-1"">ORD</font>, of all the best thereof, <i>even</i> the hallowed part thereof out of it.",""
4638,36,0,"Therefore thou shalt say unto them, When ye have heaved the best thereof from it, then it shall be counted unto the Levites as the increase of the threshingfloor, and as the increase of the winepress.","Therefore thou shalt say unto them, When ye have heaved the best thereof from it, then it shall be counted unto the Levites as the increase of the threshingfloor, and as the increase of the winepress.",""
4639,26,0,"And ye shall eat it in every place, ye and your households: for it is your reward for your service in the tabernacle of the congregation.","And ye shall eat it in every place, ye and your households: for it <i>is</i> your reward for your service in the tabernacle of the congregation.",""
4640,35,0,"And ye shall bear no sin by reason of it, when ye have heaved from it the best of it: neither shall ye pollute the holy things of the children of Israel, lest ye die.","And ye shall bear no sin by reason of it, when ye have heaved from it the best of it: neither shall ye pollute the holy things of the children of Israel, lest ye die.",""
4865,10,0,"And the LORD spake unto Moses and unto Aaron, saying,","And the L<font size=""-1"">ORD</font> spake unto Moses and unto Aaron, saying,",""
4866,38,0,"This is the ordinance of the law which the LORD hath commanded, saying, Speak unto the children of Israel, that they bring thee a red heifer without spot, wherein is no blemish, and upon which never came yoke:","This <i>is</i> the ordinance of the law which the L<font size=""-1"">ORD</font> hath commanded, saying, Speak unto the children of Israel, that they bring thee a red heifer without spot, wherein <i>is</i> no blemish, <i>and</i> upon which never came yoke:",""
4867,26,0,"And ye shall give her unto Eleazar the priest, that he may bring her forth without the camp, and one shall slay her before his face:","And ye shall give her unto Eleazar the priest, that he may bring her forth without the camp, and <i>one</i> shall slay her before his face:",""
4868,26,0,"And Eleazar the priest shall take of her blood with his finger, and sprinkle of her blood directly before the tabernacle of the congregation seven times:","And Eleazar the priest shall take of her blood with his finger, and sprinkle of her blood directly before the tabernacle of the congregation seven times:",""
4869,23,0,"And one shall burn the heifer in his sight; her skin, and her flesh, and her blood, with her dung, shall he burn:","And <i>one</i> shall burn the heifer in his sight; her skin, and her flesh, and her blood, with her dung, shall he burn:",""
4870,23,0,"And the priest shall take cedar wood, and hyssop, and scarlet, and cast it into the midst of the burning of the heifer.","And the priest shall take cedar wood, and hyssop, and scarlet, and cast <i>it</i> into the midst of the burning of the heifer.",""
4871,32,0,"Then the priest shall wash his clothes, and he shall bathe his flesh in water, and afterward he shall come into the camp, and the priest shall be unclean until the even.","Then the priest shall wash his clothes, and he shall bathe his flesh in water, and afterward he shall come into the camp, and the priest shall be unclean until the even.",""
4872,24,0,"And he that burneth her shall wash his clothes in water, and bathe his flesh in water, and shall be unclean until the even.","And he that burneth her shall wash his clothes in water, and bathe his flesh in water, and shall be unclean until the even.",""
4873,49,0,"And a man that is clean shall gather up the ashes of the heifer, and lay them up without the camp in a clean place, and it shall be kept for the congregation of the children of Israel for a water of separation: it is a purification for sin.","And a man <i>that is</i> clean shall gather up the ashes of the heifer, and lay <i>them</i> up without the camp in a clean place, and it shall be kept for the congregation of the children of Israel for a water of separation: it <i>is</i> a purification for sin.",""
4874,41,0,"And he that gathereth the ashes of the heifer shall wash his clothes, and be unclean until the even: and it shall be unto the children of Israel, and unto the stranger that sojourneth among them, for a statute for ever.","And he that gathereth the ashes of the heifer shall wash his clothes, and be unclean until the even: and it shall be unto the children of Israel, and unto the stranger that sojourneth among them, for a statute for ever.",""
4875,14,1,"He that toucheth the dead body of any man shall be unclean seven days.","¶He that toucheth the dead body of any man shall be unclean seven days.",""
4876,37,0,"He shall purify himself with it on the third day, and on the seventh day he shall be clean: but if he purify not himself the third day, then the seventh day he shall not be clean.","He shall purify himself with it on the third day, and on the seventh day he shall be clean: but if he purify not himself the third day, then the seventh day he shall not be clean.",""
4877,50,0,"Whosoever toucheth the dead body of any man that is dead, and purifieth not himself, defileth the tabernacle of the LORD; and that soul shall be cut off from Israel: because the water of separation was not sprinkled upon him, he shall be unclean; his uncleanness is yet upon him.","Whosoever toucheth the dead body of any man that is dead, and purifieth not himself, defileth the tabernacle of the L<font size=""-1"">ORD</font>; and that soul shall be cut off from Israel: because the water of separation was not sprinkled upon him, he shall be unclean; his uncleanness <i>is</i> yet upon him.",""
4878,29,0,"This is the law, when a man dieth in a tent: all that come into the tent, and all that is in the tent, shall be unclean seven days.","This <i>is</i> the law, when a man dieth in a tent: all that come into the tent, and all that <i>is</i> in the tent, shall be unclean seven days.",""
4879,13,0,"And every open vessel, which hath no covering bound upon it, is unclean.","And every open vessel, which hath no covering bound upon it, <i>is</i> unclean.",""
4880,32,0,"And whosoever toucheth one that is slain with a sword in the open fields, or a dead body, or a bone of a man, or a grave, shall be unclean seven days.","And whosoever toucheth one that is slain with a sword in the open fields, or a dead body, or a bone of a man, or a grave, shall be unclean seven days.",""
4881,29,0,"And for an unclean person they shall take of the ashes of the burnt heifer of purification for sin, and running water shall be put thereto in a vessel:","And for an unclean <i>person</i> they shall take of the ashes of the burnt heifer of purification for sin, and running water shall be put thereto in a vessel:",""
4882,47,0,"And a clean person shall take hyssop, and dip it in the water, and sprinkle it upon the tent, and upon all the vessels, and upon the persons that were there, and upon him that touched a bone, or one slain, or one dead, or a grave:","And a clean person shall take hyssop, and dip <i>it</i> in the water, and sprinkle <i>it</i> upon the tent, and upon all the vessels, and upon the persons that were there, and upon him that touched a bone, or one slain, or one dead, or a grave:",""
4883,42,0,"And the clean person shall sprinkle upon the unclean on the third day, and on the seventh day: and on the seventh day he shall purify himself, and wash his clothes, and bathe himself in water, and shall be clean at even.","And the clean <i>person</i> shall sprinkle upon the unclean on the third day, and on the seventh day: and on the seventh day he shall purify himself, and wash his clothes, and bathe himself in water, and shall be clean at even.",""
4884,44,0,"But the man that shall be unclean, and shall not purify himself, that soul shall be cut off from among the congregation, because he hath defiled the sanctuary of the LORD: the water of separation hath not been sprinkled upon him; he is unclean.","But the man that shall be unclean, and shall not purify himself, that soul shall be cut off from among the congregation, because he hath defiled the sanctuary of the L<font size=""-1"">ORD</font>: the water of separation hath not been sprinkled upon him; he <i>is</i> unclean.",""
4885,34,0,"And it shall be a perpetual statute unto them, that he that sprinkleth the water of separation shall wash his clothes; and he that toucheth the water of separation shall be unclean until even.","And it shall be a perpetual statute unto them, that he that sprinkleth the water of separation shall wash his clothes; and he that toucheth the water of separation shall be unclean until even.",""
4886,20,0,"And whatsoever the unclean person toucheth shall be unclean; and the soul that toucheth it shall be unclean until even.","And whatsoever the unclean <i>person</i> toucheth shall be unclean; and the soul that toucheth <i>it</i> shall be unclean until even.",""
5121,33,0,"Then came the children of Israel, even the whole congregation, into the desert of Zin in the first month: and the people abode in Kadesh; and Miriam died there, and was buried there.","Then came the children of Israel, <i>even</i> the whole congregation, into the desert of Zin in the first month: and the people abode in Kadesh; and Miriam died there, and was buried there.",""
5122,18,0,"And there was no water for the congregation: and they gathered themselves together against Moses and against Aaron.","And there was no water for the congregation: and they gathered themselves together against Moses and against Aaron.",""
5123,22,0,"And the people chode with Moses, and spake, saying, Would God that we had died when our brethren died before the LORD!","And the people chode with Moses, and spake, saying, Would God that we had died when our brethren died before the L<font size=""-1"">ORD</font>!",""
5124,22,0,"And why have ye brought up the congregation of the LORD into this wilderness, that we and our cattle should die there?","And why have ye brought up the congregation of the L<font size=""-1"">ORD</font> into this wilderness, that we and our cattle should die there?",""
5125,42,0,"And wherefore have ye made us to come up out of Egypt, to bring us in unto this evil place? it is no place of seed, or of figs, or of vines, or of pomegranates; neither is there any water to drink.","And wherefore have ye made us to come up out of Egypt, to bring us in unto this evil place? it <i>is</i> no place of seed, or of figs, or of vines, or of pomegranates; neither <i>is</i> there any water to drink.",""
5126,35,0,"And Moses and Aaron went from the presence of the assembly unto the door of the tabernacle of the congregation, and they fell upon their faces: and the glory of the LORD appeared unto them.","And Moses and Aaron went from the presence of the assembly unto the door of the tabernacle of the congregation, and they fell upon their faces: and the glory of the L<font size=""-1"">ORD</font> appeared unto them.",""
5127,7,1,"And the LORD spake unto Moses, saying,","¶And the L<font size=""-1"">ORD</font> spake unto Moses, saying,",""
5128,52,0,"Take the rod, and gather thou the assembly together, thou, and Aaron thy brother, and speak ye unto the rock before their eyes; and it shall give forth his water, and thou shalt bring forth to them water out of the rock: so thou shalt give the congregation and their beasts drink.","Take the rod, and gather thou the assembly together, thou, and Aaron thy brother, and speak ye unto the rock before their eyes; and it shall give forth his water, and thou shalt bring forth to them water out of the rock: so thou shalt give the congregation and their beasts drink.",""
5129,13,0,"And Moses took the rod from before the LORD, as he commanded him.","And Moses took the rod from before the L<font size=""-1"">ORD</font>, as he commanded him.",""
5130,29,0,"And Moses and Aaron gathered the congregation together before the rock, and he said unto them, Hear now, ye rebels; must we fetch you water out of this rock?","And Moses and Aaron gathered the congregation together before the rock, and he said unto them, Hear now, ye rebels; must we fetch you water out of this rock?",""
5131,29,0,"And Moses lifted up his hand, and with his rod he smote the rock twice: and the water came out abundantly, and the congregation drank, and their beasts also.","And Moses lifted up his hand, and with his rod he smote the rock twice: and the water came out abundantly, and the congregation drank, and their beasts <i>also</i>.",""
5132,39,1,"And the LORD spake unto Moses and Aaron, Because ye believed me not, to sanctify me in the eyes of the children of Israel, therefore ye shall not bring this congregation into the land which I have given them.","¶And the L<font size=""-1"">ORD</font> spake unto Moses and Aaron, Because ye believed me not, to sanctify me in the eyes of the children of Israel, therefore ye shall not bring this congregation into the land which I have given them.",""
5133,21,0,"This is the water of Meribah; because the children of Israel strove with the LORD, and he was sanctified in them.","This <i>is</i> the water of Meribah; because the children of Israel strove with the L<font size=""-1"">ORD</font>, and he was sanctified in them.",""
5134,25,1,"And Moses sent messengers from Kadesh unto the king of Edom, Thus saith thy brother Israel, Thou knowest all the travail that hath befallen us:","¶And Moses sent messengers from Kadesh unto the king of Edom, Thus saith thy brother Israel, Thou knowest all the travail that hath befallen us:",""
5135,24,0,"How our fathers went down into Egypt, and we have dwelt in Egypt a long time; and the Egyptians vexed us, and our fathers:","How our fathers went down into Egypt, and we have dwelt in Egypt a long time; and the Egyptians vexed us, and our fathers:",""
5136,37,0,"And when we cried unto the LORD, he heard our voice, and sent an angel, and hath brought us forth out of Egypt: and, behold, we are in Kadesh, a city in the uttermost of thy border:","And when we cried unto the L<font size=""-1"">ORD</font>, he heard our voice, and sent an angel, and hath brought us forth out of Egypt: and, behold, we <i>are</i> in Kadesh, a city in the uttermost of thy border:",""
5137,56,0,"Let us pass, I pray thee, through thy country: we will not pass through the fields, or through the vineyards, neither will we drink of the water of the wells: we will go by the king's high way, we will not turn to the right hand nor to the left, until we have passed thy borders.","Let us pass, I pray thee, through thy country: we will not pass through the fields, or through the vineyards, neither will we drink <i>of</i> the water of the wells: we will go by the king's <i>high</i> way, we will not turn to the right hand nor to the left, until we have passed thy borders.",""
5138,20,0,"And Edom said unto him, Thou shalt not pass by me, lest I come out against thee with the sword.","And Edom said unto him, Thou shalt not pass by me, lest I come out against thee with the sword.",""
5139,44,0,"And the children of Israel said unto him, We will go by the high way: and if I and my cattle drink of thy water, then I will pay for it: I will only, without doing any thing else, go through on my feet.","And the children of Israel said unto him, We will go by the high way: and if I and my cattle drink of thy water, then I will pay for it: I will only, without <i>doing</i> any thing <i>else</i>, go through on my feet.",""
5140,22,0,"And he said, Thou shalt not go through. And Edom came out against him with much people, and with a strong hand.","And he said, Thou shalt not go through. And Edom came out against him with much people, and with a strong hand.",""
5141,16,0,"Thus Edom refused to give Israel passage through his border: wherefore Israel turned away from him.","Thus Edom refused to give Israel passage through his border: wherefore Israel turned away from him.",""
5142,17,1,"And the children of Israel, even the whole congregation, journeyed from Kadesh, and came unto mount Hor.","¶And the children of Israel, <i>even</i> the whole congregation, journeyed from Kadesh, and came unto mount Hor.",""
5143,20,0,"And the LORD spake unto Moses and Aaron in mount Hor, by the coast of the land of Edom, saying,","And the L<font size=""-1"">ORD</font> spake unto Moses and Aaron in mount Hor, by the coast of the land of Edom, saying,",""
5144,35,0,"Aaron shall be gathered unto his people: for he shall not enter into the land which I have given unto the children of Israel, because ye rebelled against my word at the water of Meribah.","Aaron shall be gathered unto his people: for he shall not enter into the land which I have given unto the children of Israel, because ye rebelled against my word at the water of Meribah.",""
5145,13,0,"Take Aaron and Eleazar his son, and bring them up unto mount Hor:","Take Aaron and Eleazar his son, and bring them up unto mount Hor:",""
5146,25,0,"And strip Aaron of his garments, and put them upon Eleazar his son: and Aaron shall be gathered unto his people, and shall die there.","And strip Aaron of his garments, and put them upon Eleazar his son: and Aaron shall be gathered <i>unto his people</i>, and shall die there.",""
5147,21,0,"And Moses did as the LORD commanded: and they went up into mount Hor in the sight of all the congregation.","And Moses did as the L<font size=""-1"">ORD</font> commanded: and they went up into mount Hor in the sight of all the congregation.",""
5148,33,0,"And Moses stripped Aaron of his garments, and put them upon Eleazar his son; and Aaron died there in the top of the mount: and Moses and Eleazar came down from the mount.","And Moses stripped Aaron of his garments, and put them upon Eleazar his son; and Aaron died there in the top of the mount: and Moses and Eleazar came down from the mount.",""
5149,22,0,"And when all the congregation saw that Aaron was dead, they mourned for Aaron thirty days, even all the house of Israel.","And when all the congregation saw that Aaron was dead, they mourned for Aaron thirty days, <i>even</i> all the house of Israel.",""
5377,33,0,"And when king Arad the Canaanite, which dwelt in the south, heard tell that Israel came by the way of the spies; then he fought against Israel, and took some of them prisoners.","And <i>when</i> king Arad the Canaanite, which dwelt in the south, heard tell that Israel came by the way of the spies; then he fought against Israel, and took <i>some</i> of them prisoners.",""
5378,27,0,"And Israel vowed a vow unto the LORD, and said, If thou wilt indeed deliver this people into my hand, then I will utterly destroy their cities.","And Israel vowed a vow unto the L<font size=""-1"">ORD</font>, and said, If thou wilt indeed deliver this people into my hand, then I will utterly destroy their cities.",""
5379,31,0,"And the LORD hearkened to the voice of Israel, and delivered up the Canaanites; and they utterly destroyed them and their cities: and he called the name of the place Hormah.","And the L<font size=""-1"">ORD</font> hearkened to the voice of Israel, and delivered up the Canaanites; and they utterly destroyed them and their cities: and he called the name of the place Hormah.",""
5380,32,1,"And they journeyed from mount Hor by the way of the Red sea, to compass the land of Edom: and the soul of the people was much discouraged because of the way.","¶And they journeyed from mount Hor by the way of the Red sea, to compass the land of Edom: and the soul of the people was much discouraged because of the way.",""
