ChpVrsNdx,NumWrd,bPilcrow,PText,RText
9735,17,0,"And Er, Judah's firstborn, was wicked in the sight of the LORD; and the LORD slew him.","And Er, Judah's firstborn, was wicked in the sight of the L<font size=""-1"">ORD</font>; and the L<font size=""-1"">ORD</font> slew him."
9736,21,0,"And Judah said unto Onan, Go in unto thy brother's wife, and marry her, and raise up seed to thy brother.","And Judah said unto Onan, Go in unto thy brother's wife, and marry her, and raise up seed to thy brother."
9737,39,0,"And Onan knew that the seed should not be his; and it came to pass, when he went in unto his brother's wife, that he spilled it on the ground, lest that he should give seed to his brother.","And Onan knew that the seed should not be his; and it came to pass, when he went in unto his brother's wife, that he spilled <i>it</i> on the ground, lest that he should give seed to his brother."
9738,14,0,"And the thing which he did displeased the LORD: wherefore he slew him also.","And the thing which he did displeased the L<font size=""-1"">ORD</font>: wherefore he slew him also."
9739,43,0,"Then said Judah to Tamar his daughter in law, Remain a widow at thy father's house, till Shelah my son be grown: for he said, Lest peradventure he die also, as his brethren did. And Tamar went and dwelt in her father's house.","Then said Judah to Tamar his daughter in law, Remain a widow at thy father's house, till Shelah my son be grown: for he said, Lest peradventure he die also, as his brethren <i>did</i>. And Tamar went and dwelt in her father's house."
9740,31,1,"And in process of time the daughter of Shuah Judah's wife died; and Judah was comforted, and went up unto his sheepshearers to Timnath, he and his friend Hirah the Adullamite.","¶And in process of time the daughter of Shuah Judah's wife died; and Judah was comforted, and went up unto his sheepshearers to Timnath, he and his friend Hirah the Adullamite."
9741,19,0,"And it was told Tamar, saying, Behold thy father in law goeth up to Timnath to shear his sheep.","And it was told Tamar, saying, Behold thy father in law goeth up to Timnath to shear his sheep."
9742,47,0,"And she put her widow's garments off from her, and covered her with a vail, and wrapped herself, and sat in an open place, which is by the way to Timnath; for she saw that Shelah was grown, and she was not given unto him to wife.","And she put her widow's garments off from her, and covered her with a vail, and wrapped herself, and sat in an open place, which <i>is</i> by the way to Timnath; for she saw that Shelah was grown, and she was not given unto him to wife."
9743,17,0,"When Judah saw her, he thought her to be an harlot; because she had covered her face.","When Judah saw her, he thought her <i>to be</i> an harlot; because she had covered her face."
9744,47,0,"And he turned unto her by the way, and said, Go to, I pray thee, let me come in unto thee; (for he knew not that she was his daughter in law.) And she said, What wilt thou give me, that thou mayest come in unto me?","And he turned unto her by the way, and said, Go to, I pray thee, let me come in unto thee; (for he knew not that she <i>was</i> his daughter in law.) And she said, What wilt thou give me, that thou mayest come in unto me?"
9745,25,0,"And he said, I will send thee a kid from the flock. And she said, Wilt thou give me a pledge, till thou send it?","And he said, I will send <i>thee</i> a kid from the flock. And she said, Wilt thou give <i>me</i> a pledge, till thou send <i>it</i>?"
9746,40,0,"And he said, What pledge shall I give thee? And she said, Thy signet, and thy bracelets, and thy staff that is in thine hand. And he gave it her, and came in unto her, and she conceived by him.","And he said, What pledge shall I give thee? And she said, Thy signet, and thy bracelets, and thy staff that <i>is</i> in thine hand. And he gave <i>it</i> her, and came in unto her, and she conceived by him."
9747,21,0,"And she arose, and went away, and laid by her vail from her, and put on the garments of her widowhood.","And she arose, and went away, and laid by her vail from her, and put on the garments of her widowhood."
9748,26,0,"And Judah sent the kid by the hand of his friend the Adullamite, to receive his pledge from the woman's hand: but he found her not.","And Judah sent the kid by the hand of his friend the Adullamite, to receive <i>his</i> pledge from the woman's hand: but he found her not."
9749,30,0,"Then he asked the men of that place, saying, Where is the harlot, that was openly by the way side? And they said, There was no harlot in this place.","Then he asked the men of that place, saying, Where <i>is</i> the harlot, that <i>was</i> openly by the way side? And they said, There was no harlot in this <i>place</i>."
9750,27,0,"And he returned to Judah, and said, I cannot find her; and also the men of the place said, that there was no harlot in this place.","And he returned to Judah, and said, I cannot find her; and also the men of the place said, <i>that</i> there was no harlot in this <i>place</i>."
9751,24,0,"And Judah said, Let her take it to her, lest we be shamed: behold, I sent this kid, and thou hast not found her.","And Judah said, Let her take <i>it</i> to her, lest we be shamed: behold, I sent this kid, and thou hast not found her."
9752,44,1,"And it came to pass about three months after, that it was told Judah, saying, Tamar thy daughter in law hath played the harlot; and also, behold, she is with child by whoredom. And Judah said, Bring her forth, and let her be burnt.","¶And it came to pass about three months after, that it was told Judah, saying, Tamar thy daughter in law hath played the harlot; and also, behold, she <i>is</i> with child by whoredom. And Judah said, Bring her forth, and let her be burnt."
9753,39,0,"When she was brought forth, she sent to her father in law, saying, By the man, whose these are, am I with child: and she said, Discern, I pray thee, whose are these, the signet, and bracelets, and staff.","When she <i>was</i> brought forth, she sent to her father in law, saying, By the man, whose these <i>are, am</i> I with child: and she said, Discern, I pray thee, whose <i>are</i> these, the signet, and bracelets, and staff."
9754,30,0,"And Judah acknowledged them, and said, She hath been more righteous than I; because that I gave her not to Shelah my son. And he knew her again no more.","And Judah acknowledged <i>them</i>, and said, She hath been more righteous than I; because that I gave her not to Shelah my son. And he knew her again no more."
9755,18,1,"And it came to pass in the time of her travail, that, behold, twins were in her womb.","¶And it came to pass in the time of her travail, that, behold, twins <i>were</i> in her womb."
9756,32,0,"And it came to pass, when she travailed, that the one put out his hand: and the midwife took and bound upon his hand a scarlet thread, saying, This came out first.","And it came to pass, when she travailed, that <i>the one</i> put out <i>his</i> hand: and the midwife took and bound upon his hand a scarlet thread, saying, This came out first."
9757,36,0,"And it came to pass, as he drew back his hand, that, behold, his brother came out: and she said, How hast thou broken forth? this breach be upon thee: therefore his name was called Pharez.","And it came to pass, as he drew back his hand, that, behold, his brother came out: and she said, How hast thou broken forth? <i>this</i> breach <i>be</i> upon thee: therefore his name was called Pharez."
9758,20,0,"And afterward came out his brother, that had the scarlet thread upon his hand: and his name was called Zarah.","And afterward came out his brother, that had the scarlet thread upon his hand: and his name was called Zarah."
9985,33,0,"And Joseph was brought down to Egypt; and Potiphar, an officer of Pharaoh, captain of the guard, an Egyptian, bought him of the hands of the Ishmeelites, which had brought him down thither.","And Joseph was brought down to Egypt; and Potiphar, an officer of Pharaoh, captain of the guard, an Egyptian, bought him of the hands of the Ishmeelites, which had brought him down thither."
9986,23,0,"And the LORD was with Joseph, and he was a prosperous man; and he was in the house of his master the Egyptian.","And the L<font size=""-1"">ORD</font> was with Joseph, and he was a prosperous man; and he was in the house of his master the Egyptian."
9987,24,0,"And his master saw that the LORD was with him, and that the LORD made all that he did to prosper in his hand.","And his master saw that the L<font size=""-1"">ORD</font> <i>was</i> with him, and that the L<font size=""-1"">ORD</font> made all that he did to prosper in his hand."
9988,29,0,"And Joseph found grace in his sight, and he served him: and he made him overseer over his house, and all that he had he put into his hand.","And Joseph found grace in his sight, and he served him: and he made him overseer over his house, and all <i>that</i> he had he put into his hand."
9989,52,0,"And it came to pass from the time that he had made him overseer in his house, and over all that he had, that the LORD blessed the Egyptian's house for Joseph's sake; and the blessing of the LORD was upon all that he had in the house, and in the field.","And it came to pass from the time <i>that</i> he had made him overseer in his house, and over all that he had, that the L<font size=""-1"">ORD</font> blessed the Egyptian's house for Joseph's sake; and the blessing of the L<font size=""-1"">ORD</font> was upon all that he had in the house, and in the field."
9990,33,0,"And he left all that he had in Joseph's hand; and he knew not ought he had, save the bread which he did eat. And Joseph was a goodly person, and well favoured.","And he left all that he had in Joseph's hand; and he knew not ought he had, save the bread which he did eat. And Joseph was <i>a</i> goodly <i>person</i>, and well favoured."
9991,23,1,"And it came to pass after these things, that his master's wife cast her eyes upon Joseph; and she said, Lie with me.","¶And it came to pass after these things, that his master's wife cast her eyes upon Joseph; and she said, Lie with me."
9992,32,0,"But he refused, and said unto his master's wife, Behold, my master wotteth not what is with me in the house, and he hath committed all that he hath to my hand;","But he refused, and said unto his master's wife, Behold, my master wotteth not what <i>is</i> with me in the house, and he hath committed all that he hath to my hand;"
9993,37,0,"There is none greater in this house than I; neither hath he kept back any thing from me but thee, because thou art his wife: how then can I do this great wickedness, and sin against God?","<i>There is</i> none greater in this house than I; neither hath he kept back any thing from me but thee, because thou <i>art</i> his wife: how then can I do this great wickedness, and sin against God?"
9994,28,0,"And it came to pass, as she spake to Joseph day by day, that he hearkened not unto her, to lie by her, or to be with her.","And it came to pass, as she spake to Joseph day by day, that he hearkened not unto her, to lie by her, <i>or</i> to be with her."
9995,30,0,"And it came to pass about this time, that Joseph went into the house to do his business; and there was none of the men of the house there within.","And it came to pass about this time, that <i>Joseph</i> went into the house to do his business; and <i>there was</i> none of the men of the house there within."
9996,25,0,"And she caught him by his garment, saying, Lie with me: and he left his garment in her hand, and fled, and got him out.","And she caught him by his garment, saying, Lie with me: and he left his garment in her hand, and fled, and got him out."
9997,21,1,"And it came to pass, when she saw that he had left his garment in her hand, and was fled forth,","¶And it came to pass, when she saw that he had left his garment in her hand, and was fled forth,"
9998,42,0,"That she called unto the men of her house, and spake unto them, saying, See, he hath brought in an Hebrew unto us to mock us; he came in unto me to lie with me, and I cried with a loud voice:","That she called unto the men of her house, and spake unto them, saying, See, he hath brought in an Hebrew unto us to mock us; he came in unto me to lie with me, and I cried with a loud voice:"
9999,29,0,"And it came to pass, when he heard that I lifted up my voice and cried, that he left his garment with me, and fled, and got him out.","And it came to pass, when he heard that I lifted up my voice and cried, that he left his garment with me, and fled, and got him out."
10000,13,0,"And she laid up his garment by her, until his lord came home.","And she laid up his garment by her, until his lord came home."
10001,26,0,"And she spake unto him according to these words, saying, The Hebrew servant, which thou hast brought unto us, came in unto me to mock me:","And she spake unto him according to these words, saying, The Hebrew servant, which thou hast brought unto us, came in unto me to mock me:"
10002,23,0,"And it came to pass, as I lifted up my voice and cried, that he left his garment with me, and fled out.","And it came to pass, as I lifted up my voice and cried, that he left his garment with me, and fled out."
10003,33,1,"And it came to pass, when his master heard the words of his wife, which she spake unto him, saying, After this manner did thy servant to me; that his wrath was kindled.","¶And it came to pass, when his master heard the words of his wife, which she spake unto him, saying, After this manner did thy servant to me; that his wrath was kindled."
10004,26,0,"And Joseph's master took him, and put him into the prison, a place where the king's prisoners were bound: and he was there in the prison.","And Joseph's master took him, and put him into the prison, a place where the king's prisoners <i>were</i> bound: and he was there in the prison."
10005,23,1,"But the LORD was with Joseph, and shewed him mercy, and gave him favour in the sight of the keeper of the prison.","¶But the L<font size=""-1"">ORD</font> was with Joseph, and shewed him mercy, and gave him favour in the sight of the keeper of the prison."
10006,29,0,"And the keeper of the prison committed to Joseph's hand all the prisoners that were in the prison; and whatsoever they did there, he was the doer of it.","And the keeper of the prison committed to Joseph's hand all the prisoners that <i>were</i> in the prison; and whatsoever they did there, he was the doer <i>of it</i>."
10007,32,0,"The keeper of the prison looked not to any thing that was under his hand; because the LORD was with him, and that which he did, the LORD made it to prosper.","The keeper of the prison looked not to any thing <i>that was</i> under his hand; because the L<font size=""-1"">ORD</font> was with him, and <i>that</i> which he did, the L<font size=""-1"">ORD</font> made <i>it</i> to prosper."
10241,27,0,"And it came to pass after these things, that the butler of the king of Egypt and his baker had offended their lord the king of Egypt.","And it came to pass after these things, <i>that</i> the butler of the king of Egypt and <i>his</i> baker had offended their lord the king of Egypt."
10242,22,0,"And Pharaoh was wroth against two of his officers, against the chief of the butlers, and against the chief of the bakers.","And Pharaoh was wroth against two <i>of</i> his officers, against the chief of the butlers, and against the chief of the bakers."
10243,24,0,"And he put them in ward in the house of the captain of the guard, into the prison, the place where Joseph was bound.","And he put them in ward in the house of the captain of the guard, into the prison, the place where Joseph <i>was</i> bound."
10244,21,0,"And the captain of the guard charged Joseph with them, and he served them: and they continued a season in ward.","And the captain of the guard charged Joseph with them, and he served them: and they continued a season in ward."
10245,40,1,"And they dreamed a dream both of them, each man his dream in one night, each man according to the interpretation of his dream, the butler and the baker of the king of Egypt, which were bound in the prison.","¶And they dreamed a dream both of them, each man his dream in one night, each man according to the interpretation of his dream, the butler and the baker of the king of Egypt, which <i>were</i> bound in the prison."
10246,18,0,"And Joseph came in unto them in the morning, and looked upon them, and, behold, they were sad.","And Joseph came in unto them in the morning, and looked upon them, and, behold, they <i>were</i> sad."
10247,24,0,"And he asked Pharaoh's officers that were with him in the ward of his lord's house, saying, Wherefore look ye so sadly to day?","And he asked Pharaoh's officers that <i>were</i> with him in the ward of his lord's house, saying, Wherefore look ye <i>so</i> sadly to day?"
10248,34,0,"And they said unto him, We have dreamed a dream, and there is no interpreter of it. And Joseph said unto them, Do not interpretations belong to God? tell me them, I pray you.","And they said unto him, We have dreamed a dream, and <i>there is</i> no interpreter of it. And Joseph said unto them, <i>Do</i> not interpretations <i>belong</i> to God? tell me <i>them</i>, I pray you."
10249,22,0,"And the chief butler told his dream to Joseph, and said to him, In my dream, behold, a vine was before me;","And the chief butler told his dream to Joseph, and said to him, In my dream, behold, a vine <i>was</i> before me;"
10250,27,0,"And in the vine were three branches: and it was as though it budded, and her blossoms shot forth; and the clusters thereof brought forth ripe grapes:","And in the vine <i>were</i> three branches: and it <i>was</i> as though it budded, <i>and</i> her blossoms shot forth; and the clusters thereof brought forth ripe grapes:"
10251,26,0,"And Pharaoh's cup was in my hand: and I took the grapes, and pressed them into Pharaoh's cup, and I gave the cup into Pharaoh's hand.","And Pharaoh's cup <i>was</i> in my hand: and I took the grapes, and pressed them into Pharaoh's cup, and I gave the cup into Pharaoh's hand."
10252,17,0,"And Joseph said unto him, This is the interpretation of it: The three branches are three days:","And Joseph said unto him, This <i>is</i> the interpretation of it: The three branches <i>are</i> three days:"
10253,34,0,"Yet within three days shall Pharaoh lift up thine head, and restore thee unto thy place: and thou shalt deliver Pharaoh's cup into his hand, after the former manner when thou wast his butler.","Yet within three days shall Pharaoh lift up thine head, and restore thee unto thy place: and thou shalt deliver Pharaoh's cup into his hand, after the former manner when thou wast his butler."
10254,33,0,"But think on me when it shall be well with thee, and shew kindness, I pray thee, unto me, and make mention of me unto Pharaoh, and bring me out of this house:","But think on me when it shall be well with thee, and shew kindness, I pray thee, unto me, and make mention of me unto Pharaoh, and bring me out of this house:"
10255,28,0,"For indeed I was stolen away out of the land of the Hebrews: and here also have I done nothing that they should put me into the dungeon.","For indeed I was stolen away out of the land of the Hebrews: and here also have I done nothing that they should put me into the dungeon."
10256,30,0,"When the chief baker saw that the interpretation was good, he said unto Joseph, I also was in my dream, and, behold, I had three white baskets on my head:","When the chief baker saw that the interpretation was good, he said unto Joseph, I also <i>was</i> in my dream, and, behold, <i>I had</i> three white baskets on my head:"
10257,27,0,"And in the uppermost basket there was of all manner of bakemeats for Pharaoh; and the birds did eat them out of the basket upon my head.","And in the uppermost basket <i>there was</i> of all manner of bakemeats for Pharaoh; and the birds did eat them out of the basket upon my head."
10258,16,0,"And Joseph answered and said, This is the interpretation thereof: The three baskets are three days:","And Joseph answered and said, This <i>is</i> the interpretation thereof: The three baskets <i>are</i> three days:"
10259,30,0,"Yet within three days shall Pharaoh lift up thy head from off thee, and shall hang thee on a tree; and the birds shall eat thy flesh from off thee.","Yet within three days shall Pharaoh lift up thy head from off thee, and shall hang thee on a tree; and the birds shall eat thy flesh from off thee."
10260,39,1,"And it came to pass the third day, which was Pharaoh's birthday, that he made a feast unto all his servants: and he lifted up the head of the chief butler and of the chief baker among his servants.","¶And it came to pass the third day, <i>which was</i> Pharaoh's birthday, that he made a feast unto all his servants: and he lifted up the head of the chief butler and of the chief baker among his servants."
10261,18,0,"And he restored the chief butler unto his butlership again; and he gave the cup into Pharaoh's hand:","And he restored the chief butler unto his butlership again; and he gave the cup into Pharaoh's hand:"
10262,12,0,"But he hanged the chief baker: as Joseph had interpreted to them.","But he hanged the chief baker: as Joseph had interpreted to them."
10263,11,0,"Yet did not the chief butler remember Joseph, but forgat him.","Yet did not the chief butler remember Joseph, but forgat him."
10497,22,0,"And it came to pass at the end of two full years, that Pharaoh dreamed: and, behold, he stood by the river.","And it came to pass at the end of two full years, that Pharaoh dreamed: and, behold, he stood by the river."
10498,21,0,"And, behold, there came up out of the river seven well favoured kine and fatfleshed; and they fed in a meadow.","And, behold, there came up out of the river seven well favoured kine and fatfleshed; and they fed in a meadow."
10499,29,0,"And, behold, seven other kine came up after them out of the river, ill favoured and leanfleshed; and stood by the other kine upon the brink of the river.","And, behold, seven other kine came up after them out of the river, ill favoured and leanfleshed; and stood by the <i>other</i> kine upon the brink of the river."
10500,20,0,"And the ill favoured and leanfleshed kine did eat up the seven well favoured and fat kine. So Pharaoh awoke.","And the ill favoured and leanfleshed kine did eat up the seven well favoured and fat kine. So Pharaoh awoke."
10501,22,0,"And he slept and dreamed the second time: and, behold, seven ears of corn came up upon one stalk, rank and good.","And he slept and dreamed the second time: and, behold, seven ears of corn came up upon one stalk, rank and good."
10502,15,0,"And, behold, seven thin ears and blasted with the east wind sprung up after them.","And, behold, seven thin ears and blasted with the east wind sprung up after them."
10503,21,0,"And the seven thin ears devoured the seven rank and full ears. And Pharaoh awoke, and, behold, it was a dream.","And the seven thin ears devoured the seven rank and full ears. And Pharaoh awoke, and, behold, <i>it was</i> a dream."
10504,46,0,"And it came to pass in the morning that his spirit was troubled; and he sent and called for all the magicians of Egypt, and all the wise men thereof: and Pharaoh told them his dream; but there was none that could interpret them unto Pharaoh.","And it came to pass in the morning that his spirit was troubled; and he sent and called for all the magicians of Egypt, and all the wise men thereof: and Pharaoh told them his dream; but <i>there was</i> none that could interpret them unto Pharaoh."
10505,15,1,"Then spake the chief butler unto Pharaoh, saying, I do remember my faults this day:","¶Then spake the chief butler unto Pharaoh, saying, I do remember my faults this day:"
10506,24,0,"Pharaoh was wroth with his servants, and put me in ward in the captain of the guard's house, both me and the chief baker:","Pharaoh was wroth with his servants, and put me in ward in the captain of the guard's house, <i>both</i> me and the chief baker:"
10507,22,0,"And we dreamed a dream in one night, I and he; we dreamed each man according to the interpretation of his dream.","And we dreamed a dream in one night, I and he; we dreamed each man according to the interpretation of his dream."
10508,39,0,"And there was there with us a young man, an Hebrew, servant to the captain of the guard; and we told him, and he interpreted to us our dreams; to each man according to his dream he did interpret.","And <i>there was</i> there with us a young man, an Hebrew, servant to the captain of the guard; and we told him, and he interpreted to us our dreams; to each man according to his dream he did interpret."
10509,23,0,"And it came to pass, as he interpreted to us, so it was; me he restored unto mine office, and him he hanged.","And it came to pass, as he interpreted to us, so it was; me he restored unto mine office, and him he hanged."
10510,28,1,"Then Pharaoh sent and called Joseph, and they brought him hastily out of the dungeon: and he shaved himself, and changed his raiment, and came in unto Pharaoh.","¶Then Pharaoh sent and called Joseph, and they brought him hastily out of the dungeon: and he shaved <i>himself</i>, and changed his raiment, and came in unto Pharaoh."
10511,34,0,"And Pharaoh said unto Joseph, I have dreamed a dream, and there is none that can interpret it: and I have heard say of thee, that thou canst understand a dream to interpret it.","And Pharaoh said unto Joseph, I have dreamed a dream, and <i>there is</i> none that can interpret it: and I have heard say of thee, <i>that</i> thou canst understand a dream to interpret it."
