ChpVrsNdx,NumWrd,bPilcrow,PText,RText
3342,41,1,"Now Elisha was fallen sick of his sickness whereof he died. And Joash the king of Israel came down unto him, and wept over his face, and said, O my father, my father, the chariot of Israel, and the horsemen thereof.","¶Now Elisha was fallen sick of his sickness whereof he died. And Joash the king of Israel came down unto him, and wept over his face, and said, O my father, my father, the chariot of Israel, and the horsemen thereof."
3343,17,0,"And Elisha said unto him, Take bow and arrows. And he took unto him bow and arrows.","And Elisha said unto him, Take bow and arrows. And he took unto him bow and arrows."
3344,30,0,"And he said to the king of Israel, Put thine hand upon the bow. And he put his hand upon it: and Elisha put his hands upon the king's hands.","And he said to the king of Israel, Put thine hand upon the bow. And he put his hand <i>upon it</i>: and Elisha put his hands upon the king's hands."
3345,47,0,"And he said, Open the window eastward. And he opened it. Then Elisha said, Shoot. And he shot. And he said, The arrow of the LORD'S deliverance, and the arrow of deliverance from Syria: for thou shalt smite the Syrians in Aphek, till thou have consumed them.","And he said, Open the window eastward. And he opened <i>it</i>. Then Elisha said, Shoot. And he shot. And he said, The arrow of the L<font size=""-1"">ORD'S</font> deliverance, and the arrow of deliverance from Syria: for thou shalt smite the Syrians in Aphek, till thou have consumed <i>them</i>."
3346,28,0,"And he said, Take the arrows. And he took them. And he said unto the king of Israel, Smite upon the ground. And he smote thrice, and stayed.","And he said, Take the arrows. And he took <i>them</i>. And he said unto the king of Israel, Smite upon the ground. And he smote thrice, and stayed."
3347,37,0,"And the man of God was wroth with him, and said, Thou shouldest have smitten five or six times; then hadst thou smitten Syria till thou hadst consumed it: whereas now thou shalt smite Syria but thrice.","And the man of God was wroth with him, and said, Thou shouldest have smitten five or six times; then hadst thou smitten Syria till thou hadst consumed <i>it</i>: whereas now thou shalt smite Syria <i>but</i> thrice."
3348,23,1,"And Elisha died, and they buried him. And the bands of the Moabites invaded the land at the coming in of the year.","¶And Elisha died, and they buried him. And the bands of the Moabites invaded the land at the coming in of the year."
3349,50,0,"And it came to pass, as they were burying a man, that, behold, they spied a band of men; and they cast the man into the sepulchre of Elisha: and when the man was let down, and touched the bones of Elisha, he revived, and stood up on his feet.","And it came to pass, as they were burying a man, that, behold, they spied a band <i>of men</i>; and they cast the man into the sepulchre of Elisha: and when the man was let down, and touched the bones of Elisha, he revived, and stood up on his feet."
3350,12,1,"But Hazael king of Syria oppressed Israel all the days of Jehoahaz.","¶But Hazael king of Syria oppressed Israel all the days of Jehoahaz."
3351,40,0,"And the LORD was gracious unto them, and had compassion on them, and had respect unto them, because of his covenant with Abraham, Isaac, and Jacob, and would not destroy them, neither cast he them from his presence as yet.","And the L<font size=""-1"">ORD</font> was gracious unto them, and had compassion on them, and had respect unto them, because of his covenant with Abraham, Isaac, and Jacob, and would not destroy them, neither cast he them from his presence as yet."
3352,14,0,"So Hazael king of Syria died; and Ben-hadad his son reigned in his stead.","So Hazael king of Syria died; and Ben–hadad his son reigned in his stead."
3353,46,0,"And Jehoash the son of Jehoahaz took again out of the hand of Ben-hadad the son of Hazael the cities, which he had taken out of the hand of Jehoahaz his father by war. Three times did Joash beat him, and recovered the cities of Israel.","And Jehoash the son of Jehoahaz took again out of the hand of Ben–hadad the son of Hazael the cities, which he had taken out of the hand of Jehoahaz his father by war. Three times did Joash beat him, and recovered the cities of Israel."
3585,21,0,"In the second year of Joash son of Jehoahaz king of Israel reigned Amaziah the son of Joash king of Judah.","In the second year of Joash son of Jehoahaz king of Israel reigned Amaziah the son of Joash king of Judah."
3586,28,0,"He was twenty and five years old when he began to reign, and reigned twenty and nine years in Jerusalem. And his mother's name was Jehoaddan of Jerusalem.","He was twenty and five years old when he began to reign, and reigned twenty and nine years in Jerusalem. And his mother's name <i>was</i> Jehoaddan of Jerusalem."
3587,30,0,"And he did that which was right in the sight of the LORD, yet not like David his father: he did according to all things as Joash his father did.","And he did <i>that which was</i> right in the sight of the L<font size=""-1"">ORD</font>, yet not like David his father: he did according to all things as Joash his father did."
3588,21,0,"Howbeit the high places were not taken away: as yet the people did sacrifice and burnt incense on the high places.","Howbeit the high places were not taken away: as yet the people did sacrifice and burnt incense on the high places."
3589,27,1,"And it came to pass, as soon as the kingdom was confirmed in his hand, that he slew his servants which had slain the king his father.","¶And it came to pass, as soon as the kingdom was confirmed in his hand, that he slew his servants which had slain the king his father."
3590,61,0,"But the children of the murderers he slew not: according unto that which is written in the book of the law of Moses, wherein the LORD commanded, saying, The fathers shall not be put to death for the children, nor the children be put to death for the fathers; but every man shall be put to death for his own sin.","But the children of the murderers he slew not: according unto that which is written in the book of the law of Moses, wherein the L<font size=""-1"">ORD</font> commanded, saying, The fathers shall not be put to death for the children, nor the children be put to death for the fathers; but every man shall be put to death for his own sin."
3591,26,0,"He slew of Edom in the valley of salt ten thousand, and took Selah by war, and called the name of it Joktheel unto this day.","He slew of Edom in the valley of salt ten thousand, and took Selah by war, and called the name of it Joktheel unto this day."
3592,26,1,"Then Amaziah sent messengers to Jehoash, the son of Jehoahaz son of Jehu, king of Israel, saying, Come, let us look one another in the face.","¶Then Amaziah sent messengers to Jehoash, the son of Jehoahaz son of Jehu, king of Israel, saying, Come, let us look one another in the face."
3593,52,0,"And Jehoash the king of Israel sent to Amaziah king of Judah, saying, The thistle that was in Lebanon sent to the cedar that was in Lebanon, saying, Give thy daughter to my son to wife: and there passed by a wild beast that was in Lebanon, and trode down the thistle.","And Jehoash the king of Israel sent to Amaziah king of Judah, saying, The thistle that <i>was</i> in Lebanon sent to the cedar that <i>was</i> in Lebanon, saying, Give thy daughter to my son to wife: and there passed by a wild beast that <i>was</i> in Lebanon, and trode down the thistle."
3594,37,0,"Thou hast indeed smitten Edom, and thine heart hath lifted thee up: glory of this, and tarry at home: for why shouldest thou meddle to thy hurt, that thou shouldest fall, even thou, and Judah with thee?","Thou hast indeed smitten Edom, and thine heart hath lifted thee up: glory <i>of this</i>, and tarry at home: for why shouldest thou meddle to <i>thy</i> hurt, that thou shouldest fall, <i>even</i> thou, and Judah with thee?"
3595,31,0,"But Amaziah would not hear. Therefore Jehoash king of Israel went up; and he and Amaziah king of Judah looked one another in the face at Beth-shemesh, which belongeth to Judah.","But Amaziah would not hear. Therefore Jehoash king of Israel went up; and he and Amaziah king of Judah looked one another in the face at Beth–shemesh, which <i>belongeth</i> to Judah."
3596,17,0,"And Judah was put to the worse before Israel; and they fled every man to their tents.","And Judah was put to the worse before Israel; and they fled every man to their tents."
3597,43,0,"And Jehoash king of Israel took Amaziah king of Judah, the son of Jehoash the son of Ahaziah, at Beth-shemesh, and came to Jerusalem, and brake down the wall of Jerusalem from the gate of Ephraim unto the corner gate, four hundred cubits.","And Jehoash king of Israel took Amaziah king of Judah, the son of Jehoash the son of Ahaziah, at Beth–shemesh, and came to Jerusalem, and brake down the wall of Jerusalem from the gate of Ephraim unto the corner gate, four hundred cubits."
3598,35,0,"And he took all the gold and silver, and all the vessels that were found in the house of the LORD, and in the treasures of the king's house, and hostages, and returned to Samaria.","And he took all the gold and silver, and all the vessels that were found in the house of the L<font size=""-1"">ORD</font>, and in the treasures of the king's house, and hostages, and returned to Samaria."
3599,38,1,"Now the rest of the acts of Jehoash which he did, and his might, and how he fought with Amaziah king of Judah, are they not written in the book of the chronicles of the kings of Israel?","¶Now the rest of the acts of Jehoash which he did, and his might, and how he fought with Amaziah king of Judah, <i>are</i> they not written in the book of the chronicles of the kings of Israel?"
3600,24,0,"And Jehoash slept with his fathers, and was buried in Samaria with the kings of Israel; and Jeroboam his son reigned in his stead.","And Jehoash slept with his fathers, and was buried in Samaria with the kings of Israel; and Jeroboam his son reigned in his stead."
3601,23,1,"And Amaziah the son of Joash king of Judah lived after the death of Jehoash son of Jehoahaz king of Israel fifteen years.","¶And Amaziah the son of Joash king of Judah lived after the death of Jehoash son of Jehoahaz king of Israel fifteen years."
3602,23,0,"And the rest of the acts of Amaziah, are they not written in the book of the chronicles of the kings of Judah?","And the rest of the acts of Amaziah, <i>are</i> they not written in the book of the chronicles of the kings of Judah?"
3603,25,0,"Now they made a conspiracy against him in Jerusalem: and he fled to Lachish; but they sent after him to Lachish, and slew him there.","Now they made a conspiracy against him in Jerusalem: and he fled to Lachish; but they sent after him to Lachish, and slew him there."
3604,20,0,"And they brought him on horses: and he was buried at Jerusalem with his fathers in the city of David.","And they brought him on horses: and he was buried at Jerusalem with his fathers in the city of David."
3605,22,1,"And all the people of Judah took Azariah, which was sixteen years old, and made him king instead of his father Amaziah.","¶And all the people of Judah took Azariah, which <i>was</i> sixteen years old, and made him king instead of his father Amaziah."
3606,16,0,"He built Elath, and restored it to Judah, after that the king slept with his fathers.","He built Elath, and restored it to Judah, after that the king slept with his fathers."
3607,32,1,"In the fifteenth year of Amaziah the son of Joash king of Judah Jeroboam the son of Joash king of Israel began to reign in Samaria, and reigned forty and one years.","¶In the fifteenth year of Amaziah the son of Joash king of Judah Jeroboam the son of Joash king of Israel began to reign in Samaria, <i>and reigned</i> forty and one years."
3608,31,0,"And he did that which was evil in the sight of the LORD: he departed not from all the sins of Jeroboam the son of Nebat, who made Israel to sin.","And he did <i>that which was</i> evil in the sight of the L<font size=""-1"">ORD</font>: he departed not from all the sins of Jeroboam the son of Nebat, who made Israel to sin."
3609,47,0,"He restored the coast of Israel from the entering of Hamath unto the sea of the plain, according to the word of the LORD God of Israel, which he spake by the hand of his servant Jonah, the son of Amittai, the prophet, which was of Gath-hepher.","He restored the coast of Israel from the entering of Hamath unto the sea of the plain, according to the word of the L<font size=""-1"">ORD</font> God of Israel, which he spake by the hand of his servant Jonah, the son of Amittai, the prophet, which <i>was</i> of Gath–hepher."
3610,28,0,"For the LORD saw the affliction of Israel, that it was very bitter: for there was not any shut up, nor any left, nor any helper for Israel.","For the L<font size=""-1"">ORD</font> saw the affliction of Israel, <i>that it was</i> very bitter: for <i>there was</i> not any shut up, nor any left, nor any helper for Israel."
3611,30,0,"And the LORD said not that he would blot out the name of Israel from under heaven: but he saved them by the hand of Jeroboam the son of Joash.","And the L<font size=""-1"">ORD</font> said not that he would blot out the name of Israel from under heaven: but he saved them by the hand of Jeroboam the son of Joash."
3612,47,1,"Now the rest of the acts of Jeroboam, and all that he did, and his might, how he warred, and how he recovered Damascus, and Hamath, which belonged to Judah, for Israel, are they not written in the book of the chronicles of the kings of Israel?","¶Now the rest of the acts of Jeroboam, and all that he did, and his might, how he warred, and how he recovered Damascus, and Hamath, <i>which belonged</i> to Judah, for Israel, are they not written in the book of the chronicles of the kings of Israel?"
3613,20,0,"And Jeroboam slept with his fathers, even with the kings of Israel; and Zachariah his son reigned in his stead.","And Jeroboam slept with his fathers, <i>even</i> with the kings of Israel; and Zachariah his son reigned in his stead."
3841,21,0,"In the twenty and seventh year of Jeroboam king of Israel began Azariah son of Amaziah king of Judah to reign.","In the twenty and seventh year of Jeroboam king of Israel began Azariah son of Amaziah king of Judah to reign."
3842,27,0,"Sixteen years old was he when he began to reign, and he reigned two and fifty years in Jerusalem. And his mother's name was Jecholiah of Jerusalem.","Sixteen years old was he when he began to reign, and he reigned two and fifty years in Jerusalem. And his mother's name <i>was</i> Jecholiah of Jerusalem."
3843,22,0,"And he did that which was right in the sight of the LORD, according to all that his father Amaziah had done;","And he did <i>that which was</i> right in the sight of the L<font size=""-1"">ORD</font>, according to all that his father Amaziah had done;"
3844,19,0,"Save that the high places were not removed: the people sacrificed and burnt incense still on the high places.","Save that the high places were not removed: the people sacrificed and burnt incense still on the high places."
3845,39,1,"And the LORD smote the king, so that he was a leper unto the day of his death, and dwelt in a several house. And Jotham the king's son was over the house, judging the people of the land.","¶And the L<font size=""-1"">ORD</font> smote the king, so that he was a leper unto the day of his death, and dwelt in a several house. And Jotham the king's son <i>was</i> over the house, judging the people of the land."
3846,28,0,"And the rest of the acts of Azariah, and all that he did, are they not written in the book of the chronicles of the kings of Judah?","And the rest of the acts of Azariah, and all that he did, <i>are</i> they not written in the book of the chronicles of the kings of Judah?"
3847,26,0,"So Azariah slept with his fathers; and they buried him with his fathers in the city of David: and Jotham his son reigned in his stead.","So Azariah slept with his fathers; and they buried him with his fathers in the city of David: and Jotham his son reigned in his stead."
3848,24,1,"In the thirty and eighth year of Azariah king of Judah did Zachariah the son of Jeroboam reign over Israel in Samaria six months.","¶In the thirty and eighth year of Azariah king of Judah did Zachariah the son of Jeroboam reign over Israel in Samaria six months."
3849,35,0,"And he did that which was evil in the sight of the LORD, as his fathers had done: he departed not from the sins of Jeroboam the son of Nebat, who made Israel to sin.","And he did <i>that which was</i> evil in the sight of the L<font size=""-1"">ORD</font>, as his fathers had done: he departed not from the sins of Jeroboam the son of Nebat, who made Israel to sin."
3850,23,0,"And Shallum the son of Jabesh conspired against him, and smote him before the people, and slew him, and reigned in his stead.","And Shallum the son of Jabesh conspired against him, and smote him before the people, and slew him, and reigned in his stead."
3851,23,0,"And the rest of the acts of Zachariah, behold, they are written in the book of the chronicles of the kings of Israel.","And the rest of the acts of Zachariah, behold, they <i>are</i> written in the book of the chronicles of the kings of Israel."
3852,32,0,"This was the word of the LORD which he spake unto Jehu, saying, Thy sons shall sit on the throne of Israel unto the fourth generation. And so it came to pass.","This <i>was</i> the word of the L<font size=""-1"">ORD</font> which he spake unto Jehu, saying, Thy sons shall sit on the throne of Israel unto the fourth <i>generation</i>. And so it came to pass."
3853,27,1,"Shallum the son of Jabesh began to reign in the nine and thirtieth year of Uzziah king of Judah; and he reigned a full month in Samaria.","¶Shallum the son of Jabesh began to reign in the nine and thirtieth year of Uzziah king of Judah; and he reigned a full month in Samaria."
3854,31,0,"For Menahem the son of Gadi went up from Tirzah, and came to Samaria, and smote Shallum the son of Jabesh in Samaria, and slew him, and reigned in his stead.","For Menahem the son of Gadi went up from Tirzah, and came to Samaria, and smote Shallum the son of Jabesh in Samaria, and slew him, and reigned in his stead."
3855,29,0,"And the rest of the acts of Shallum, and his conspiracy which he made, behold, they are written in the book of the chronicles of the kings of Israel.","And the rest of the acts of Shallum, and his conspiracy which he made, behold, they <i>are</i> written in the book of the chronicles of the kings of Israel."
3856,37,1,"Then Menahem smote Tiphsah, and all that were therein, and the coasts thereof from Tirzah: because they opened not to him, therefore he smote it; and all the women therein that were with child he ripped up.","¶Then Menahem smote Tiphsah, and all that <i>were</i> therein, and the coasts thereof from Tirzah: because they opened not <i>to him</i>, therefore he smote <i>it; and</i> all the women therein that were with child he ripped up."
3857,27,0,"In the nine and thirtieth year of Azariah king of Judah began Menahem the son of Gadi to reign over Israel, and reigned ten years in Samaria.","In the nine and thirtieth year of Azariah king of Judah began Menahem the son of Gadi to reign over Israel, <i>and reigned</i> ten years in Samaria."
3858,33,0,"And he did that which was evil in the sight of the LORD: he departed not all his days from the sins of Jeroboam the son of Nebat, who made Israel to sin.","And he did <i>that which was</i> evil in the sight of the L<font size=""-1"">ORD</font>: he departed not all his days from the sins of Jeroboam the son of Nebat, who made Israel to sin."
3859,33,0,"And Pul the king of Assyria came against the land: and Menahem gave Pul a thousand talents of silver, that his hand might be with him to confirm the kingdom in his hand.","<i>And</i> Pul the king of Assyria came against the land: and Menahem gave Pul a thousand talents of silver, that his hand might be with him to confirm the kingdom in his hand."
3860,43,0,"And Menahem exacted the money of Israel, even of all the mighty men of wealth, of each man fifty shekels of silver, to give to the king of Assyria. So the king of Assyria turned back, and stayed not there in the land.","And Menahem exacted the money of Israel, <i>even</i> of all the mighty men of wealth, of each man fifty shekels of silver, to give to the king of Assyria. So the king of Assyria turned back, and stayed not there in the land."
3861,28,1,"And the rest of the acts of Menahem, and all that he did, are they not written in the book of the chronicles of the kings of Israel?","¶And the rest of the acts of Menahem, and all that he did, <i>are</i> they not written in the book of the chronicles of the kings of Israel?"
3862,14,0,"And Menahem slept with his fathers; and Pekahiah his son reigned in his stead.","And Menahem slept with his fathers; and Pekahiah his son reigned in his stead."
3863,25,1,"In the fiftieth year of Azariah king of Judah Pekahiah the son of Menahem began to reign over Israel in Samaria, and reigned two years.","¶In the fiftieth year of Azariah king of Judah Pekahiah the son of Menahem began to reign over Israel in Samaria, <i>and reigned</i> two years."
3864,30,0,"And he did that which was evil in the sight of the LORD: he departed not from the sins of Jeroboam the son of Nebat, who made Israel to sin.","And he did <i>that which was</i> evil in the sight of the L<font size=""-1"">ORD</font>: he departed not from the sins of Jeroboam the son of Nebat, who made Israel to sin."
3865,46,0,"But Pekah the son of Remaliah, a captain of his, conspired against him, and smote him in Samaria, in the palace of the king's house, with Argob and Arieh, and with him fifty men of the Gileadites: and he killed him, and reigned in his room.","But Pekah the son of Remaliah, a captain of his, conspired against him, and smote him in Samaria, in the palace of the king's house, with Argob and Arieh, and with him fifty men of the Gileadites: and he killed him, and reigned in his room."
3866,28,0,"And the rest of the acts of Pekahiah, and all that he did, behold, they are written in the book of the chronicles of the kings of Israel.","And the rest of the acts of Pekahiah, and all that he did, behold, they <i>are</i> written in the book of the chronicles of the kings of Israel."
3867,27,1,"In the two and fiftieth year of Azariah king of Judah Pekah the son of Remaliah began to reign over Israel in Samaria, and reigned twenty years.","¶In the two and fiftieth year of Azariah king of Judah Pekah the son of Remaliah began to reign over Israel in Samaria, <i>and reigned</i> twenty years."
3868,30,0,"And he did that which was evil in the sight of the LORD: he departed not from the sins of Jeroboam the son of Nebat, who made Israel to sin.","And he did <i>that which was</i> evil in the sight of the L<font size=""-1"">ORD</font>: he departed not from the sins of Jeroboam the son of Nebat, who made Israel to sin."
3869,39,0,"In the days of Pekah king of Israel came Tiglath-pileser king of Assyria, and took Ijon, and Abel-beth-maachah, and Janoah, and Kedesh, and Hazor, and Gilead, and Galilee, all the land of Naphtali, and carried them captive to Assyria.","In the days of Pekah king of Israel came Tiglath–pileser king of Assyria, and took Ijon, and Abel–beth–maachah, and Janoah, and Kedesh, and Hazor, and Gilead, and Galilee, all the land of Naphtali, and carried them captive to Assyria."
3870,36,0,"And Hoshea the son of Elah made a conspiracy against Pekah the son of Remaliah, and smote him, and slew him, and reigned in his stead, in the twentieth year of Jotham the son of Uzziah.","And Hoshea the son of Elah made a conspiracy against Pekah the son of Remaliah, and smote him, and slew him, and reigned in his stead, in the twentieth year of Jotham the son of Uzziah."
3871,28,0,"And the rest of the acts of Pekah, and all that he did, behold, they are written in the book of the chronicles of the kings of Israel.","And the rest of the acts of Pekah, and all that he did, behold, they <i>are</i> written in the book of the chronicles of the kings of Israel."
3872,24,1,"In the second year of Pekah the son of Remaliah king of Israel began Jotham the son of Uzziah king of Judah to reign.","¶In the second year of Pekah the son of Remaliah king of Israel began Jotham the son of Uzziah king of Judah to reign."
3873,29,0,"Five and twenty years old was he when he began to reign, and he reigned sixteen years in Jerusalem. And his mother's name was Jerusha, the daughter of Zadok.","Five and twenty years old was he when he began to reign, and he reigned sixteen years in Jerusalem. And his mother's name <i>was</i> Jerusha, the daughter of Zadok."
3874,24,0,"And he did that which was right in the sight of the LORD: he did according to all that his father Uzziah had done.","And he did <i>that which was</i> right in the sight of the L<font size=""-1"">ORD</font>: he did according to all that his father Uzziah had done."
3875,29,1,"Howbeit the high places were not removed: the people sacrificed and burned incense still in the high places. He built the higher gate of the house of the LORD.","¶Howbeit the high places were not removed: the people sacrificed and burned incense still in the high places. He built the higher gate of the house of the L<font size=""-1"">ORD</font>."
3876,28,1,"Now the rest of the acts of Jotham, and all that he did, are they not written in the book of the chronicles of the kings of Judah?","¶Now the rest of the acts of Jotham, and all that he did, <i>are</i> they not written in the book of the chronicles of the kings of Judah?"
