ChpVrsNdx,NumWrd,bPilcrow,PText,RText
1538,32,0,"Let us go, we pray thee, unto Jordan, and take thence every man a beam, and let us make us a place there, where we may dwell. And he answered, Go ye.","Let us go, we pray thee, unto Jordan, and take thence every man a beam, and let us make us a place there, where we may dwell. And he answered, Go ye."
1539,19,0,"And one said, Be content, I pray thee, and go with thy servants. And he answered, I will go.","And one said, Be content, I pray thee, and go with thy servants. And he answered, I will go."
1540,15,0,"So he went with them. And when they came to Jordan, they cut down wood.","So he went with them. And when they came to Jordan, they cut down wood."
1541,25,0,"But as one was felling a beam, the axe head fell into the water: and he cried, and said, Alas, master! for it was borrowed.","But as one was felling a beam, the axe head fell into the water: and he cried, and said, Alas, master! for it was borrowed."
1542,31,0,"And the man of God said, Where fell it? And he shewed him the place. And he cut down a stick, and cast it in thither; and the iron did swim.","And the man of God said, Where fell it? And he shewed him the place. And he cut down a stick, and cast <i>it</i> in thither; and the iron did swim."
1543,17,0,"Therefore said he, Take it up to thee. And he put out his hand, and took it.","Therefore said he, Take <i>it</i> up to thee. And he put out his hand, and took it."
1544,25,1,"Then the king of Syria warred against Israel, and took counsel with his servants, saying, In such and such a place shall be my camp.","¶Then the king of Syria warred against Israel, and took counsel with his servants, saying, In such and such a place <i>shall be</i> my camp."
1545,27,0,"And the man of God sent unto the king of Israel, saying, Beware that thou pass not such a place; for thither the Syrians are come down.","And the man of God sent unto the king of Israel, saying, Beware that thou pass not such a place; for thither the Syrians are come down."
1546,28,0,"And the king of Israel sent to the place which the man of God told him and warned him of, and saved himself there, not once nor twice.","And the king of Israel sent to the place which the man of God told him and warned him of, and saved himself there, not once nor twice."
1547,37,0,"Therefore the heart of the king of Syria was sore troubled for this thing; and he called his servants, and said unto them, Will ye not shew me which of us is for the king of Israel?","Therefore the heart of the king of Syria was sore troubled for this thing; and he called his servants, and said unto them, Will ye not shew me which of us <i>is</i> for the king of Israel?"
1548,32,0,"And one of his servants said, None, my lord, O king: but Elisha, the prophet that is in Israel, telleth the king of Israel the words that thou speakest in thy bedchamber.","And one of his servants said, None, my lord, O king: but Elisha, the prophet that <i>is</i> in Israel, telleth the king of Israel the words that thou speakest in thy bedchamber."
1549,27,1,"And he said, Go and spy where he is, that I may send and fetch him. And it was told him, saying, Behold, he is in Dothan.","¶And he said, Go and spy where he <i>is</i>, that I may send and fetch him. And it was told him, saying, Behold, <i>he is</i> in Dothan."
1550,21,0,"Therefore sent he thither horses, and chariots, and a great host: and they came by night, and compassed the city about.","Therefore sent he thither horses, and chariots, and a great host: and they came by night, and compassed the city about."
1551,39,0,"And when the servant of the man of God was risen early, and gone forth, behold, an host compassed the city both with horses and chariots. And his servant said unto him, Alas, my master! how shall we do?","And when the servant of the man of God was risen early, and gone forth, behold, an host compassed the city both with horses and chariots. And his servant said unto him, Alas, my master! how shall we do?"
1552,19,0,"And he answered, Fear not: for they that be with us are more than they that be with them.","And he answered, Fear not: for they that <i>be</i> with us <i>are</i> more than they that <i>be</i> with them."
1553,44,0,"And Elisha prayed, and said, LORD, I pray thee, open his eyes, that he may see. And the LORD opened the eyes of the young man; and he saw: and, behold, the mountain was full of horses and chariots of fire round about Elisha.","And Elisha prayed, and said, L<font size=""-1"">ORD</font>, I pray thee, open his eyes, that he may see. And the L<font size=""-1"">ORD</font> opened the eyes of the young man; and he saw: and, behold, the mountain <i>was</i> full of horses and chariots of fire round about Elisha."
1554,34,0,"And when they came down to him, Elisha prayed unto the LORD, and said, Smite this people, I pray thee, with blindness. And he smote them with blindness according to the word of Elisha.","And when they came down to him, Elisha prayed unto the L<font size=""-1"">ORD</font>, and said, Smite this people, I pray thee, with blindness. And he smote them with blindness according to the word of Elisha."
1555,34,1,"And Elisha said unto them, This is not the way, neither is this the city: follow me, and I will bring you to the man whom ye seek. But he led them to Samaria.","¶And Elisha said unto them, This <i>is</i> not the way, neither <i>is</i> this the city: follow me, and I will bring you to the man whom ye seek. But he led them to Samaria."
1556,43,0,"And it came to pass, when they were come into Samaria, that Elisha said, LORD, open the eyes of these men, that they may see. And the LORD opened their eyes, and they saw; and, behold, they were in the midst of Samaria.","And it came to pass, when they were come into Samaria, that Elisha said, L<font size=""-1"">ORD</font>, open the eyes of these <i>men</i>, that they may see. And the L<font size=""-1"">ORD</font> opened their eyes, and they saw; and, behold, <i>they were</i> in the midst of Samaria."
1557,22,0,"And the king of Israel said unto Elisha, when he saw them, My father, shall I smite them? shall I smite them?","And the king of Israel said unto Elisha, when he saw them, My father, shall I smite <i>them</i>? shall I smite <i>them</i>?"
1558,41,0,"And he answered, Thou shalt not smite them: wouldest thou smite those whom thou hast taken captive with thy sword and with thy bow? set bread and water before them, that they may eat and drink, and go to their master.","And he answered, Thou shalt not smite <i>them</i>: wouldest thou smite those whom thou hast taken captive with thy sword and with thy bow? set bread and water before them, that they may eat and drink, and go to their master."
1559,37,0,"And he prepared great provision for them: and when they had eaten and drunk, he sent them away, and they went to their master. So the bands of Syria came no more into the land of Israel.","And he prepared great provision for them: and when they had eaten and drunk, he sent them away, and they went to their master. So the bands of Syria came no more into the land of Israel."
1560,22,1,"And it came to pass after this, that Ben-hadad king of Syria gathered all his host, and went up, and besieged Samaria.","¶And it came to pass after this, that Ben–hadad king of Syria gathered all his host, and went up, and besieged Samaria."
1561,39,0,"And there was a great famine in Samaria: and, behold, they besieged it, until an ass's head was sold for fourscore pieces of silver, and the fourth part of a cab of dove's dung for five pieces of silver.","And there was a great famine in Samaria: and, behold, they besieged it, until an ass's head was <i>sold</i> for fourscore <i>pieces</i> of silver, and the fourth part of a cab of dove's dung for five <i>pieces</i> of silver."
1562,24,0,"And as the king of Israel was passing by upon the wall, there cried a woman unto him, saying, Help, my lord, O king.","And as the king of Israel was passing by upon the wall, there cried a woman unto him, saying, Help, my lord, O king."
1563,24,0,"And he said, If the LORD do not help thee, whence shall I help thee? out of the barnfloor, or out of the winepress?","And he said, If the L<font size=""-1"">ORD</font> do not help thee, whence shall I help thee? out of the barnfloor, or out of the winepress?"
1564,35,0,"And the king said unto her, What aileth thee? And she answered, This woman said unto me, Give thy son, that we may eat him to day, and we will eat my son to morrow.","And the king said unto her, What aileth thee? And she answered, This woman said unto me, Give thy son, that we may eat him to day, and we will eat my son to morrow."
1565,32,0,"So we boiled my son, and did eat him: and I said unto her on the next day, Give thy son, that we may eat him: and she hath hid her son.","So we boiled my son, and did eat him: and I said unto her on the next day, Give thy son, that we may eat him: and she hath hid her son."
1566,39,1,"And it came to pass, when the king heard the words of the woman, that he rent his clothes; and he passed by upon the wall, and the people looked, and, behold, he had sackcloth within upon his flesh.","¶And it came to pass, when the king heard the words of the woman, that he rent his clothes; and he passed by upon the wall, and the people looked, and, behold, <i>he had</i> sackcloth within upon his flesh."
1567,26,0,"Then he said, God do so and more also to me, if the head of Elisha the son of Shaphat shall stand on him this day.","Then he said, God do so and more also to me, if the head of Elisha the son of Shaphat shall stand on him this day."
1568,73,0,"But Elisha sat in his house, and the elders sat with him; and the king sent a man from before him: but ere the messenger came to him, he said to the elders, See ye how this son of a murderer hath sent to take away mine head? look, when the messenger cometh, shut the door, and hold him fast at the door: is not the sound of his master's feet behind him?","But Elisha sat in his house, and the elders sat with him; and <i>the king</i> sent a man from before him: but ere the messenger came to him, he said to the elders, See ye how this son of a murderer hath sent to take away mine head? look, when the messenger cometh, shut the door, and hold him fast at the door: <i>is</i> not the sound of his master's feet behind him?"
1569,33,0,"And while he yet talked with them, behold, the messenger came down unto him: and he said, Behold, this evil is of the LORD; what should I wait for the LORD any longer?","And while he yet talked with them, behold, the messenger came down unto him: and he said, Behold, this evil <i>is</i> of the L<font size=""-1"">ORD</font>; what should I wait for the L<font size=""-1"">ORD</font> any longer?"
1793,43,0,"Then Elisha said, Hear ye the word of the LORD; Thus saith the LORD, To morrow about this time shall a measure of fine flour be sold for a shekel, and two measures of barley for a shekel, in the gate of Samaria.","Then Elisha said, Hear ye the word of the L<font size=""-1"">ORD</font>; Thus saith the L<font size=""-1"">ORD</font>, To morrow about this time <i>shall</i> a measure of fine flour <i>be sold</i> for a shekel, and two measures of barley for a shekel, in the gate of Samaria."
1794,45,0,"Then a lord on whose hand the king leaned answered the man of God, and said, Behold, if the LORD would make windows in heaven, might this thing be? And he said, Behold, thou shalt see it with thine eyes, but shalt not eat thereof.","Then a lord on whose hand the king leaned answered the man of God, and said, Behold, <i>if</i> the L<font size=""-1"">ORD</font> would make windows in heaven, might this thing be? And he said, Behold, thou shalt see <i>it</i> with thine eyes, but shalt not eat thereof."
1795,26,1,"And there were four leprous men at the entering in of the gate: and they said one to another, Why sit we here until we die?","¶And there were four leprous men at the entering in of the gate: and they said one to another, Why sit we here until we die?"
1796,60,0,"If we say, We will enter into the city, then the famine is in the city, and we shall die there: and if we sit still here, we die also. Now therefore come, and let us fall unto the host of the Syrians: if they save us alive, we shall live; and if they kill us, we shall but die.","If we say, We will enter into the city, then the famine <i>is</i> in the city, and we shall die there: and if we sit still here, we die also. Now therefore come, and let us fall unto the host of the Syrians: if they save us alive, we shall live; and if they kill us, we shall but die."
1797,35,0,"And they rose up in the twilight, to go unto the camp of the Syrians: and when they were come to the uttermost part of the camp of Syria, behold, there was no man there.","And they rose up in the twilight, to go unto the camp of the Syrians: and when they were come to the uttermost part of the camp of Syria, behold, <i>there was</i> no man there."
1798,58,0,"For the Lord had made the host of the Syrians to hear a noise of chariots, and a noise of horses, even the noise of a great host: and they said one to another, Lo, the king of Israel hath hired against us the kings of the Hittites, and the kings of the Egyptians, to come upon us.","For the Lord had made the host of the Syrians to hear a noise of chariots, and a noise of horses, <i>even</i> the noise of a great host: and they said one to another, Lo, the king of Israel hath hired against us the kings of the Hittites, and the kings of the Egyptians, to come upon us."
1799,29,0,"Wherefore they arose and fled in the twilight, and left their tents, and their horses, and their asses, even the camp as it was, and fled for their life.","Wherefore they arose and fled in the twilight, and left their tents, and their horses, and their asses, even the camp as it <i>was</i>, and fled for their life."
1800,52,0,"And when these lepers came to the uttermost part of the camp, they went into one tent, and did eat and drink, and carried thence silver, and gold, and raiment, and went and hid it; and came again, and entered into another tent, and carried thence also, and went and hid it.","And when these lepers came to the uttermost part of the camp, they went into one tent, and did eat and drink, and carried thence silver, and gold, and raiment, and went and hid <i>it</i>; and came again, and entered into another tent, and carried thence <i>also</i>, and went and hid <i>it</i>."
1801,48,0,"Then they said one to another, We do not well: this day is a day of good tidings, and we hold our peace: if we tarry till the morning light, some mischief will come upon us: now therefore come, that we may go and tell the king's household.","Then they said one to another, We do not well: this day <i>is</i> a day of good tidings, and we hold our peace: if we tarry till the morning light, some mischief will come upon us: now therefore come, that we may go and tell the king's household."
1802,47,0,"So they came and called unto the porter of the city: and they told them, saying, We came to the camp of the Syrians, and, behold, there was no man there, neither voice of man, but horses tied, and asses tied, and the tents as they were.","So they came and called unto the porter of the city: and they told them, saying, We came to the camp of the Syrians, and, behold, <i>there was</i> no man there, neither voice of man, but horses tied, and asses tied, and the tents as they <i>were</i>."
1803,14,0,"And he called the porters; and they told it to the king's house within.","And he called the porters; and they told <i>it</i> to the king's house within."
1804,62,1,"And the king arose in the night, and said unto his servants, I will now shew you what the Syrians have done to us. They know that we be hungry; therefore are they gone out of the camp to hide themselves in the field, saying, When they come out of the city, we shall catch them alive, and get into the city.","¶And the king arose in the night, and said unto his servants, I will now shew you what the Syrians have done to us. They know that we <i>be</i> hungry; therefore are they gone out of the camp to hide themselves in the field, saying, When they come out of the city, we shall catch them alive, and get into the city."
1805,62,0,"And one of his servants answered and said, Let some take, I pray thee, five of the horses that remain, which are left in the city, (behold, they are as all the multitude of Israel that are left in it: behold, I say, they are even as all the multitude of the Israelites that are consumed:) and let us send and see.","And one of his servants answered and said, Let <i>some</i> take, I pray thee, five of the horses that remain, which are left in the city, (behold, they <i>are</i> as all the multitude of Israel that are left in it: behold, <i>I say</i>, they <i>are</i> even as all the multitude of the Israelites that are consumed:) and let us send and see."
1806,20,0,"They took therefore two chariot horses; and the king sent after the host of the Syrians, saying, Go and see.","They took therefore two chariot horses; and the king sent after the host of the Syrians, saying, Go and see."
1807,35,0,"And they went after them unto Jordan: and, lo, all the way was full of garments and vessels, which the Syrians had cast away in their haste. And the messengers returned, and told the king.","And they went after them unto Jordan: and, lo, all the way <i>was</i> full of garments and vessels, which the Syrians had cast away in their haste. And the messengers returned, and told the king."
1808,38,0,"And the people went out, and spoiled the tents of the Syrians. So a measure of fine flour was sold for a shekel, and two measures of barley for a shekel, according to the word of the LORD.","And the people went out, and spoiled the tents of the Syrians. So a measure of fine flour was <i>sold</i> for a shekel, and two measures of barley for a shekel, according to the word of the L<font size=""-1"">ORD</font>."
1809,46,1,"And the king appointed the lord on whose hand he leaned to have the charge of the gate: and the people trode upon him in the gate, and he died, as the man of God had said, who spake when the king came down to him.","¶And the king appointed the lord on whose hand he leaned to have the charge of the gate: and the people trode upon him in the gate, and he died, as the man of God had said, who spake when the king came down to him."
1810,44,0,"And it came to pass as the man of God had spoken to the king, saying, Two measures of barley for a shekel, and a measure of fine flour for a shekel, shall be to morrow about this time in the gate of Samaria:","And it came to pass as the man of God had spoken to the king, saying, Two measures of barley for a shekel, and a measure of fine flour for a shekel, shall be to morrow about this time in the gate of Samaria:"
1811,41,0,"And that lord answered the man of God, and said, Now, behold, if the LORD should make windows in heaven, might such a thing be? And he said, Behold, thou shalt see it with thine eyes, but shalt not eat thereof.","And that lord answered the man of God, and said, Now, behold, <i>if</i> the L<font size=""-1"">ORD</font> should make windows in heaven, might such a thing be? And he said, Behold, thou shalt see it with thine eyes, but shalt not eat thereof."
1812,19,0,"And so it fell out unto him: for the people trode upon him in the gate, and he died.","And so it fell out unto him: for the people trode upon him in the gate, and he died."
2049,45,0,"Then spake Elisha unto the woman, whose son he had restored to life, saying, Arise, and go thou and thine household, and sojourn wheresoever thou canst sojourn: for the LORD hath called for a famine; and it shall also come upon the land seven years.","Then spake Elisha unto the woman, whose son he had restored to life, saying, Arise, and go thou and thine household, and sojourn wheresoever thou canst sojourn: for the L<font size=""-1"">ORD</font> hath called for a famine; and it shall also come upon the land seven years."
2050,30,0,"And the woman arose, and did after the saying of the man of God: and she went with her household, and sojourned in the land of the Philistines seven years.","And the woman arose, and did after the saying of the man of God: and she went with her household, and sojourned in the land of the Philistines seven years."
2051,37,0,"And it came to pass at the seven years' end, that the woman returned out of the land of the Philistines: and she went forth to cry unto the king for her house and for her land.","And it came to pass at the seven years' end, that the woman returned out of the land of the Philistines: and she went forth to cry unto the king for her house and for her land."
2052,27,0,"And the king talked with Gehazi the servant of the man of God, saying, Tell me, I pray thee, all the great things that Elisha hath done.","And the king talked with Gehazi the servant of the man of God, saying, Tell me, I pray thee, all the great things that Elisha hath done."
2053,63,0,"And it came to pass, as he was telling the king how he had restored a dead body to life, that, behold, the woman, whose son he had restored to life, cried to the king for her house and for her land. And Gehazi said, My lord, O king, this is the woman, and this is her son, whom Elisha restored to life.","And it came to pass, as he was telling the king how he had restored a dead body to life, that, behold, the woman, whose son he had restored to life, cried to the king for her house and for her land. And Gehazi said, My lord, O king, this <i>is</i> the woman, and this <i>is</i> her son, whom Elisha restored to life."
2054,43,0,"And when the king asked the woman, she told him. So the king appointed unto her a certain officer, saying, Restore all that was hers, and all the fruits of the field since the day that she left the land, even until now.","And when the king asked the woman, she told him. So the king appointed unto her a certain officer, saying, Restore all that <i>was</i> hers, and all the fruits of the field since the day that she left the land, even until now."
2055,26,1,"And Elisha came to Damascus; and Ben-hadad the king of Syria was sick; and it was told him, saying, The man of God is come hither.","¶And Elisha came to Damascus; and Ben–hadad the king of Syria was sick; and it was told him, saying, The man of God is come hither."
2056,33,0,"And the king said unto Hazael, Take a present in thine hand, and go, meet the man of God, and enquire of the LORD by him, saying, Shall I recover of this disease?","And the king said unto Hazael, Take a present in thine hand, and go, meet the man of God, and enquire of the L<font size=""-1"">ORD</font> by him, saying, Shall I recover of this disease?"
2057,48,0,"So Hazael went to meet him, and took a present with him, even of every good thing of Damascus, forty camels' burden, and came and stood before him, and said, Thy son Ben-hadad king of Syria hath sent me to thee, saying, Shall I recover of this disease?","So Hazael went to meet him, and took a present with him, even of every good thing of Damascus, forty camels' burden, and came and stood before him, and said, Thy son Ben–hadad king of Syria hath sent me to thee, saying, Shall I recover of this disease?"
2058,24,0,"And Elisha said unto him, Go, say unto him, Thou mayest certainly recover: howbeit the LORD hath shewed me that he shall surely die.","And Elisha said unto him, Go, say unto him, Thou mayest certainly recover: howbeit the L<font size=""-1"">ORD</font> hath shewed me that he shall surely die."
2059,16,0,"And he settled his countenance stedfastly, until he was ashamed: and the man of God wept.","And he settled his countenance stedfastly, until he was ashamed: and the man of God wept."
2060,54,0,"And Hazael said, Why weepeth my lord? And he answered, Because I know the evil that thou wilt do unto the children of Israel: their strong holds wilt thou set on fire, and their young men wilt thou slay with the sword, and wilt dash their children, and rip up their women with child.","And Hazael said, Why weepeth my lord? And he answered, Because I know the evil that thou wilt do unto the children of Israel: their strong holds wilt thou set on fire, and their young men wilt thou slay with the sword, and wilt dash their children, and rip up their women with child."
2061,32,0,"And Hazael said, But what, is thy servant a dog, that he should do this great thing? And Elisha answered, The LORD hath shewed me that thou shalt be king over Syria.","And Hazael said, But what, <i>is</i> thy servant a dog, that he should do this great thing? And Elisha answered, The L<font size=""-1"">ORD</font> hath shewed me that thou <i>shalt be</i> king over Syria."
2062,30,0,"So he departed from Elisha, and came to his master; who said to him, What said Elisha to thee? And he answered, He told me that thou shouldest surely recover.","So he departed from Elisha, and came to his master; who said to him, What said Elisha to thee? And he answered, He told me <i>that</i> thou shouldest surely recover."
2063,35,0,"And it came to pass on the morrow, that he took a thick cloth, and dipped it in water, and spread it on his face, so that he died: and Hazael reigned in his stead.","And it came to pass on the morrow, that he took a thick cloth, and dipped <i>it</i> in water, and spread <i>it</i> on his face, so that he died: and Hazael reigned in his stead."
2064,31,1,"And in the fifth year of Joram the son of Ahab king of Israel, Jehoshaphat being then king of Judah, Jehoram the son of Jehoshaphat king of Judah began to reign.","¶And in the fifth year of Joram the son of Ahab king of Israel, Jehoshaphat <i>being</i> then king of Judah, Jehoram the son of Jehoshaphat king of Judah began to reign."
