ChpVrsNdx,NumWrd,bPilcrow,PText,RText,Footnote
3105,27,0,"And the Egyptians were urgent upon the people, that they might send them out of the land in haste; for they said, We be all dead men.","And the Egyptians were urgent upon the people, that they might send them out of the land in haste; for they said, We <i>be</i> all dead <i>men</i>.",""
3106,21,0,"And the people took their dough before it was leavened, their kneadingtroughs being bound up in their clothes upon their shoulders.","And the people took their dough before it was leavened, their kneadingtroughs being bound up in their clothes upon their shoulders.",""
3107,27,0,"And the children of Israel did according to the word of Moses; and they borrowed of the Egyptians jewels of silver, and jewels of gold, and raiment:","And the children of Israel did according to the word of Moses; and they borrowed of the Egyptians jewels of silver, and jewels of gold, and raiment:",""
3108,29,0,"And the LORD gave the people favour in the sight of the Egyptians, so that they lent unto them such things as they required. And they spoiled the Egyptians.","And the L<font size=""-1"">ORD</font> gave the people favour in the sight of the Egyptians, so that they lent unto them <i>such things as they required</i>. And they spoiled the Egyptians.",""
3109,21,1,"And the children of Israel journeyed from Rameses to Succoth, about six hundred thousand on foot that were men, beside children.","¶And the children of Israel journeyed from Rameses to Succoth, about six hundred thousand on foot <i>that were</i> men, beside children.",""
3110,17,0,"And a mixed multitude went up also with them; and flocks, and herds, even very much cattle.","And a mixed multitude went up also with them; and flocks, and herds, <i>even</i> very much cattle.",""
3111,39,0,"And they baked unleavened cakes of the dough which they brought forth out of Egypt, for it was not leavened; because they were thrust out of Egypt, and could not tarry, neither had they prepared for themselves any victual.","And they baked unleavened cakes of the dough which they brought forth out of Egypt, for it was not leavened; because they were thrust out of Egypt, and could not tarry, neither had they prepared for themselves any victual.",""
3112,18,1,"Now the sojourning of the children of Israel, who dwelt in Egypt, was four hundred and thirty years.","¶Now the sojourning of the children of Israel, who dwelt in Egypt, <i>was</i> four hundred and thirty years.",""
3113,37,0,"And it came to pass at the end of the four hundred and thirty years, even the selfsame day it came to pass, that all the hosts of the LORD went out from the land of Egypt.","And it came to pass at the end of the four hundred and thirty years, even the selfsame day it came to pass, that all the hosts of the L<font size=""-1"">ORD</font> went out from the land of Egypt.",""
3114,39,0,"It is a night to be much observed unto the LORD for bringing them out from the land of Egypt: this is that night of the LORD to be observed of all the children of Israel in their generations.","It <i>is</i> a night to be much observed unto the L<font size=""-1"">ORD</font> for bringing them out from the land of Egypt: this <i>is</i> that night of the L<font size=""-1"">ORD</font> to be observed of all the children of Israel in their generations.",""
3115,21,1,"And the LORD said unto Moses and Aaron, This is the ordinance of the passover: There shall no stranger eat thereof:","¶And the L<font size=""-1"">ORD</font> said unto Moses and Aaron, This <i>is</i> the ordinance of the passover: There shall no stranger eat thereof:",""
3116,19,0,"But every man's servant that is bought for money, when thou hast circumcised him, then shall he eat thereof.","But every man's servant that is bought for money, when thou hast circumcised him, then shall he eat thereof.",""
3117,10,0,"A foreigner and an hired servant shall not eat thereof.","A foreigner and an hired servant shall not eat thereof.",""
3118,28,0,"In one house shall it be eaten; thou shalt not carry forth ought of the flesh abroad out of the house; neither shall ye break a bone thereof.","In one house shall it be eaten; thou shalt not carry forth ought of the flesh abroad out of the house; neither shall ye break a bone thereof.",""
3119,8,0,"All the congregation of Israel shall keep it.","All the congregation of Israel shall keep it.",""
3120,50,0,"And when a stranger shall sojourn with thee, and will keep the passover to the LORD, let all his males be circumcised, and then let him come near and keep it; and he shall be as one that is born in the land: for no uncircumcised person shall eat thereof.","And when a stranger shall sojourn with thee, and will keep the passover to the L<font size=""-1"">ORD</font>, let all his males be circumcised, and then let him come near and keep it; and he shall be as one that is born in the land: for no uncircumcised person shall eat thereof.",""
3121,17,0,"One law shall be to him that is homeborn, and unto the stranger that sojourneth among you.","One law shall be to him that is homeborn, and unto the stranger that sojourneth among you.",""
3122,17,0,"Thus did all the children of Israel; as the LORD commanded Moses and Aaron, so did they.","Thus did all the children of Israel; as the L<font size=""-1"">ORD</font> commanded Moses and Aaron, so did they.",""
3123,26,0,"And it came to pass the selfsame day, that the LORD did bring the children of Israel out of the land of Egypt by their armies.","And it came to pass the selfsame day, <i>that</i> the L<font size=""-1"">ORD</font> did bring the children of Israel out of the land of Egypt by their armies.",""
3329,7,0,"And the LORD spake unto Moses, saying,","And the L<font size=""-1"">ORD</font> spake unto Moses, saying,",""
3330,24,0,"Sanctify unto me all the firstborn, whatsoever openeth the womb among the children of Israel, both of man and of beast: it is mine.","Sanctify unto me all the firstborn, whatsoever openeth the womb among the children of Israel, <i>both</i> of man and of beast: it <i>is</i> mine.",""
3331,42,1,"And Moses said unto the people, Remember this day, in which ye came out from Egypt, out of the house of bondage; for by strength of hand the LORD brought you out from this place: there shall no leavened bread be eaten.","¶And Moses said unto the people, Remember this day, in which ye came out from Egypt, out of the house of bondage; for by strength of hand the L<font size=""-1"">ORD</font> brought you out from this <i>place</i>: there shall no leavened bread be eaten.",""
3332,9,0,"This day came ye out in the month Abib.","This day came ye out in the month Abib.",""
3333,53,1,"And it shall be when the LORD shall bring thee into the land of the Canaanites, and the Hittites, and the Amorites, and the Hivites, and the Jebusites, which he sware unto thy fathers to give thee, a land flowing with milk and honey, that thou shalt keep this service in this month.","¶And it shall be when the L<font size=""-1"">ORD</font> shall bring thee into the land of the Canaanites, and the Hittites, and the Amorites, and the Hivites, and the Jebusites, which he sware unto thy fathers to give thee, a land flowing with milk and honey, that thou shalt keep this service in this month.",""
3334,19,0,"Seven days thou shalt eat unleavened bread, and in the seventh day shall be a feast to the LORD.","Seven days thou shalt eat unleavened bread, and in the seventh day <i>shall be</i> a feast to the L<font size=""-1"">ORD</font>.",""
3335,29,0,"Unleavened bread shall be eaten seven days; and there shall no leavened bread be seen with thee, neither shall there be leaven seen with thee in all thy quarters.","Unleavened bread shall be eaten seven days; and there shall no leavened bread be seen with thee, neither shall there be leaven seen with thee in all thy quarters.",""
3336,29,1,"And thou shalt shew thy son in that day, saying, This is done because of that which the LORD did unto me when I came forth out of Egypt.","¶And thou shalt shew thy son in that day, saying, <i>This is done</i> because of that <i>which</i> the L<font size=""-1"">ORD</font> did unto me when I came forth out of Egypt.",""
3337,41,0,"And it shall be for a sign unto thee upon thine hand, and for a memorial between thine eyes, that the LORD'S law may be in thy mouth: for with a strong hand hath the LORD brought thee out of Egypt.","And it shall be for a sign unto thee upon thine hand, and for a memorial between thine eyes, that the L<font size=""-1"">ORD'S</font> law may be in thy mouth: for with a strong hand hath the L<font size=""-1"">ORD</font> brought thee out of Egypt.",""
3338,13,0,"Thou shalt therefore keep this ordinance in his season from year to year.","Thou shalt therefore keep this ordinance in his season from year to year.",""
3339,30,1,"And it shall be when the LORD shall bring thee into the land of the Canaanites, as he sware unto thee and to thy fathers, and shall give it thee,","¶And it shall be when the L<font size=""-1"">ORD</font> shall bring thee into the land of the Canaanites, as he sware unto thee and to thy fathers, and shall give it thee,",""
3340,30,0,"That thou shalt set apart unto the LORD all that openeth the matrix, and every firstling that cometh of a beast which thou hast; the males shall be the LORD'S.","That thou shalt set apart unto the L<font size=""-1"">ORD</font> all that openeth the matrix, and every firstling that cometh of a beast which thou hast; the males <i>shall be</i> the L<font size=""-1"">ORD'S</font>.",""
3341,37,0,"And every firstling of an ass thou shalt redeem with a lamb; and if thou wilt not redeem it, then thou shalt break his neck: and all the firstborn of man among thy children shalt thou redeem.","And every firstling of an ass thou shalt redeem with a lamb; and if thou wilt not redeem it, then thou shalt break his neck: and all the firstborn of man among thy children shalt thou redeem.",""
3342,39,1,"And it shall be when thy son asketh thee in time to come, saying, What is this? that thou shalt say unto him, By strength of hand the LORD brought us out from Egypt, from the house of bondage:","¶And it shall be when thy son asketh thee in time to come, saying, What <i>is</i> this? that thou shalt say unto him, By strength of hand the L<font size=""-1"">ORD</font> brought us out from Egypt, from the house of bondage:",""
3343,56,0,"And it came to pass, when Pharaoh would hardly let us go, that the LORD slew all the firstborn in the land of Egypt, both the firstborn of man, and the firstborn of beast: therefore I sacrifice to the LORD all that openeth the matrix, being males; but all the firstborn of my children I redeem.","And it came to pass, when Pharaoh would hardly let us go, that the L<font size=""-1"">ORD</font> slew all the firstborn in the land of Egypt, both the firstborn of man, and the firstborn of beast: therefore I sacrifice to the L<font size=""-1"">ORD</font> all that openeth the matrix, being males; but all the firstborn of my children I redeem.",""
3344,29,0,"And it shall be for a token upon thine hand, and for frontlets between thine eyes: for by strength of hand the LORD brought us forth out of Egypt.","And it shall be for a token upon thine hand, and for frontlets between thine eyes: for by strength of hand the L<font size=""-1"">ORD</font> brought us forth out of Egypt.",""
3345,47,1,"And it came to pass, when Pharaoh had let the people go, that God led them not through the way of the land of the Philistines, although that was near; for God said, Lest peradventure the people repent when they see war, and they return to Egypt:","¶And it came to pass, when Pharaoh had let the people go, that God led them not <i>through</i> the way of the land of the Philistines, although that <i>was</i> near; for God said, Lest peradventure the people repent when they see war, and they return to Egypt:",""
3346,30,0,"But God led the people about, through the way of the wilderness of the Red sea: and the children of Israel went up harnessed out of the land of Egypt.","But God led the people about, <i>through</i> the way of the wilderness of the Red sea: and the children of Israel went up harnessed out of the land of Egypt.",""
3347,35,0,"And Moses took the bones of Joseph with him: for he had straitly sworn the children of Israel, saying, God will surely visit you; and ye shall carry up my bones away hence with you.","And Moses took the bones of Joseph with him: for he had straitly sworn the children of Israel, saying, God will surely visit you; and ye shall carry up my bones away hence with you.",""
3348,17,1,"And they took their journey from Succoth, and encamped in Etham, in the edge of the wilderness.","¶And they took their journey from Succoth, and encamped in Etham, in the edge of the wilderness.",""
3349,37,0,"And the LORD went before them by day in a pillar of a cloud, to lead them the way; and by night in a pillar of fire, to give them light; to go by day and night:","And the L<font size=""-1"">ORD</font> went before them by day in a pillar of a cloud, to lead them the way; and by night in a pillar of fire, to give them light; to go by day and night:",""
3350,22,0,"He took not away the pillar of the cloud by day, nor the pillar of fire by night, from before the people.","He took not away the pillar of the cloud by day, nor the pillar of fire by night, <i>from</i> before the people.",""
3585,7,0,"And the LORD spake unto Moses, saying,","And the L<font size=""-1"">ORD</font> spake unto Moses, saying,",""
3586,29,0,"Speak unto the children of Israel, that they turn and encamp before Pi-hahiroth, between Migdol and the sea, over against Baal-zephon: before it shall ye encamp by the sea.","Speak unto the children of Israel, that they turn and encamp before Pi–hahiroth, between Migdol and the sea, over against Baal–zephon: before it shall ye encamp by the sea.",""
3587,21,0,"For Pharaoh will say of the children of Israel, They are entangled in the land, the wilderness hath shut them in.","For Pharaoh will say of the children of Israel, They <i>are</i> entangled in the land, the wilderness hath shut them in.",""
3588,38,0,"And I will harden Pharaoh's heart, that he shall follow after them; and I will be honoured upon Pharaoh, and upon all his host; that the Egyptians may know that I am the LORD. And they did so.","And I will harden Pharaoh's heart, that he shall follow after them; and I will be honoured upon Pharaoh, and upon all his host; that the Egyptians may know that I <i>am</i> the L<font size=""-1"">ORD</font>. And they did so.",""
3589,43,1,"And it was told the king of Egypt that the people fled: and the heart of Pharaoh and of his servants was turned against the people, and they said, Why have we done this, that we have let Israel go from serving us?","¶And it was told the king of Egypt that the people fled: and the heart of Pharaoh and of his servants was turned against the people, and they said, Why have we done this, that we have let Israel go from serving us?",""
3590,12,0,"And he made ready his chariot, and took his people with him:","And he made ready his chariot, and took his people with him:",""
3591,20,0,"And he took six hundred chosen chariots, and all the chariots of Egypt, and captains over every one of them.","And he took six hundred chosen chariots, and all the chariots of Egypt, and captains over every one of them.",""
3592,30,0,"And the LORD hardened the heart of Pharaoh king of Egypt, and he pursued after the children of Israel: and the children of Israel went out with an high hand.","And the L<font size=""-1"">ORD</font> hardened the heart of Pharaoh king of Egypt, and he pursued after the children of Israel: and the children of Israel went out with an high hand.",""
3593,30,0,"But the Egyptians pursued after them, all the horses and chariots of Pharaoh, and his horsemen, and his army, and overtook them encamping by the sea, beside Pi-hahiroth, before Baal-zephon.","But the Egyptians pursued after them, all the horses <i>and</i> chariots of Pharaoh, and his horsemen, and his army, and overtook them encamping by the sea, beside Pi–hahiroth, before Baal–zephon.",""
3594,35,1,"And when Pharaoh drew nigh, the children of Israel lifted up their eyes, and, behold, the Egyptians marched after them; and they were sore afraid: and the children of Israel cried out unto the LORD.","¶And when Pharaoh drew nigh, the children of Israel lifted up their eyes, and, behold, the Egyptians marched after them; and they were sore afraid: and the children of Israel cried out unto the L<font size=""-1"">ORD</font>.",""
3595,36,0,"And they said unto Moses, Because there were no graves in Egypt, hast thou taken us away to die in the wilderness? wherefore hast thou dealt thus with us, to carry us forth out of Egypt?","And they said unto Moses, Because <i>there were</i> no graves in Egypt, hast thou taken us away to die in the wilderness? wherefore hast thou dealt thus with us, to carry us forth out of Egypt?",""
3596,41,0,"Is not this the word that we did tell thee in Egypt, saying, Let us alone, that we may serve the Egyptians? For it had been better for us to serve the Egyptians, than that we should die in the wilderness.","<i>Is</i> not this the word that we did tell thee in Egypt, saying, Let us alone, that we may serve the Egyptians? For <i>it had been</i> better for us to serve the Egyptians, than that we should die in the wilderness.",""
3597,44,1,"And Moses said unto the people, Fear ye not, stand still, and see the salvation of the LORD, which he will shew to you to day: for the Egyptians whom ye have seen to day, ye shall see them again no more for ever.","¶And Moses said unto the people, Fear ye not, stand still, and see the salvation of the L<font size=""-1"">ORD</font>, which he will shew to you to day: for the Egyptians whom ye have seen to day, ye shall see them again no more for ever.",""
3598,12,0,"The LORD shall fight for you, and ye shall hold your peace.","The L<font size=""-1"">ORD</font> shall fight for you, and ye shall hold your peace.",""
3599,21,1,"And the LORD said unto Moses, Wherefore criest thou unto me? speak unto the children of Israel, that they go forward:","¶And the L<font size=""-1"">ORD</font> said unto Moses, Wherefore criest thou unto me? speak unto the children of Israel, that they go forward:",""
3600,33,0,"But lift thou up thy rod, and stretch out thine hand over the sea, and divide it: and the children of Israel shall go on dry ground through the midst of the sea.","But lift thou up thy rod, and stretch out thine hand over the sea, and divide it: and the children of Israel shall go on dry <i>ground</i> through the midst of the sea.",""
3601,36,0,"And I, behold, I will harden the hearts of the Egyptians, and they shall follow them: and I will get me honour upon Pharaoh, and upon all his host, upon his chariots, and upon his horsemen.","And I, behold, I will harden the hearts of the Egyptians, and they shall follow them: and I will get me honour upon Pharaoh, and upon all his host, upon his chariots, and upon his horsemen.",""
3602,25,0,"And the Egyptians shall know that I am the LORD, when I have gotten me honour upon Pharaoh, upon his chariots, and upon his horsemen.","And the Egyptians shall know that I <i>am</i> the L<font size=""-1"">ORD</font>, when I have gotten me honour upon Pharaoh, upon his chariots, and upon his horsemen.",""
3603,32,1,"And the angel of God, which went before the camp of Israel, removed and went behind them; and the pillar of the cloud went from before their face, and stood behind them:","¶And the angel of God, which went before the camp of Israel, removed and went behind them; and the pillar of the cloud went from before their face, and stood behind them:",""
3604,43,0,"And it came between the camp of the Egyptians and the camp of Israel; and it was a cloud and darkness to them, but it gave light by night to these: so that the one came not near the other all the night.","And it came between the camp of the Egyptians and the camp of Israel; and it was a cloud and darkness <i>to them</i>, but it gave light by night <i>to these</i>: so that the one came not near the other all the night.",""
3605,37,1,"And Moses stretched out his hand over the sea; and the LORD caused the sea to go back by a strong east wind all that night, and made the sea dry land, and the waters were divided.","¶And Moses stretched out his hand over the sea; and the L<font size=""-1"">ORD</font> caused the sea to go <i>back</i> by a strong east wind all that night, and made the sea dry <i>land</i>, and the waters were divided.",""
3606,32,0,"And the children of Israel went into the midst of the sea upon the dry ground: and the waters were a wall unto them on their right hand, and on their left.","And the children of Israel went into the midst of the sea upon the dry <i>ground</i>: and the waters <i>were</i> a wall unto them on their right hand, and on their left.",""
3607,24,1,"And the Egyptians pursued, and went in after them to the midst of the sea, even all Pharaoh's horses, his chariots, and his horsemen.","¶And the Egyptians pursued, and went in after them to the midst of the sea, <i>even</i> all Pharaoh's horses, his chariots, and his horsemen.",""
3608,35,0,"And it came to pass, that in the morning watch the LORD looked unto the host of the Egyptians through the pillar of fire and of the cloud, and troubled the host of the Egyptians,","And it came to pass, that in the morning watch the L<font size=""-1"">ORD</font> looked unto the host of the Egyptians through the pillar of fire and of the cloud, and troubled the host of the Egyptians,",""
3609,33,0,"And took off their chariot wheels, that they drave them heavily: so that the Egyptians said, Let us flee from the face of Israel; for the LORD fighteth for them against the Egyptians.","And took off their chariot wheels, that they drave them heavily: so that the Egyptians said, Let us flee from the face of Israel; for the L<font size=""-1"">ORD</font> fighteth for them against the Egyptians.",""
3610,29,1,"And the LORD said unto Moses, Stretch out thine hand over the sea, that the waters may come again upon the Egyptians, upon their chariots, and upon their horsemen.","¶And the L<font size=""-1"">ORD</font> said unto Moses, Stretch out thine hand over the sea, that the waters may come again upon the Egyptians, upon their chariots, and upon their horsemen.",""
3611,38,0,"And Moses stretched forth his hand over the sea, and the sea returned to his strength when the morning appeared; and the Egyptians fled against it; and the LORD overthrew the Egyptians in the midst of the sea.","And Moses stretched forth his hand over the sea, and the sea returned to his strength when the morning appeared; and the Egyptians fled against it; and the L<font size=""-1"">ORD</font> overthrew the Egyptians in the midst of the sea.",""
3612,33,0,"And the waters returned, and covered the chariots, and the horsemen, and all the host of Pharaoh that came into the sea after them; there remained not so much as one of them.","And the waters returned, and covered the chariots, and the horsemen, <i>and</i> all the host of Pharaoh that came into the sea after them; there remained not so much as one of them.",""
3613,31,0,"But the children of Israel walked upon dry land in the midst of the sea; and the waters were a wall unto them on their right hand, and on their left.","But the children of Israel walked upon dry <i>land</i> in the midst of the sea; and the waters <i>were</i> a wall unto them on their right hand, and on their left.",""
3614,24,0,"Thus the LORD saved Israel that day out of the hand of the Egyptians; and Israel saw the Egyptians dead upon the sea shore.","Thus the L<font size=""-1"">ORD</font> saved Israel that day out of the hand of the Egyptians; and Israel saw the Egyptians dead upon the sea shore.",""
3615,27,0,"And Israel saw that great work which the LORD did upon the Egyptians: and the people feared the LORD, and believed the LORD, and his servant Moses.","And Israel saw that great work which the L<font size=""-1"">ORD</font> did upon the Egyptians: and the people feared the L<font size=""-1"">ORD</font>, and believed the L<font size=""-1"">ORD</font>, and his servant Moses.",""
3841,38,0,"Then sang Moses and the children of Israel this song unto the LORD, and spake, saying, I will sing unto the LORD, for he hath triumphed gloriously: the horse and his rider hath he thrown into the sea.","Then sang Moses and the children of Israel this song unto the L<font size=""-1"">ORD</font>, and spake, saying, I will sing unto the L<font size=""-1"">ORD</font>, for he hath triumphed gloriously: the horse and his rider hath he thrown into the sea.",""
3842,32,0,"The LORD is my strength and song, and he is become my salvation: he is my God, and I will prepare him an habitation; my father's God, and I will exalt him.","The L<font size=""-1"">ORD</font> <i>is</i> my strength and song, and he is become my salvation: he <i>is</i> my God, and I will prepare him an habitation; my father's God, and I will exalt him.",""
3843,12,0,"The LORD is a man of war: the LORD is his name.","The L<font size=""-1"">ORD</font> <i>is</i> a man of war: the L<font size=""-1"">ORD</font> <i>is</i> his name.",""
3844,21,0,"Pharaoh's chariots and his host hath he cast into the sea: his chosen captains also are drowned in the Red sea.","Pharaoh's chariots and his host hath he cast into the sea: his chosen captains also are drowned in the Red sea.",""
3845,13,0,"The depths have covered them: they sank into the bottom as a stone.","The depths have covered them: they sank into the bottom as a stone.",""
