ChpVrsNdx,NumWrd,bPilcrow,PText,RText,Footnote
5390,25,0,"But if a man come presumptuously upon his neighbour, to slay him with guile; thou shalt take him from mine altar, that he may die.","But if a man come presumptuously upon his neighbour, to slay him with guile; thou shalt take him from mine altar, that he may die.",""
5391,15,1,"And he that smiteth his father, or his mother, shall be surely put to death.","¶And he that smiteth his father, or his mother, shall be surely put to death.",""
5392,24,1,"And he that stealeth a man, and selleth him, or if he be found in his hand, he shall surely be put to death.","¶And he that stealeth a man, and selleth him, or if he be found in his hand, he shall surely be put to death.",""
5393,15,1,"And he that curseth his father, or his mother, shall surely be put to death.","¶And he that curseth his father, or his mother, shall surely be put to death.",""
5394,24,1,"And if men strive together, and one smite another with a stone, or with his fist, and he die not, but keepeth his bed:","¶And if men strive together, and one smite another with a stone, or with <i>his</i> fist, and he die not, but keepeth <i>his</i> bed:",""
5395,36,0,"If he rise again, and walk abroad upon his staff, then shall he that smote him be quit: only he shall pay for the loss of his time, and shall cause him to be thoroughly healed.","If he rise again, and walk abroad upon his staff, then shall he that smote <i>him</i> be quit: only he shall pay <i>for</i> the loss of his time, and shall cause <i>him</i> to be thoroughly healed.",""
5396,24,1,"And if a man smite his servant, or his maid, with a rod, and he die under his hand; he shall be surely punished.","¶And if a man smite his servant, or his maid, with a rod, and he die under his hand; he shall be surely punished.",""
5397,18,0,"Notwithstanding, if he continue a day or two, he shall not be punished: for he is his money.","Notwithstanding, if he continue a day or two, he shall not be punished: for he <i>is</i> his money.",""
5398,43,1,"If men strive, and hurt a woman with child, so that her fruit depart from her, and yet no mischief follow: he shall be surely punished, according as the woman's husband will lay upon him; and he shall pay as the judges determine.","¶If men strive, and hurt a woman with child, so that her fruit depart <i>from her</i>, and yet no mischief follow: he shall be surely punished, according as the woman's husband will lay upon him; and he shall pay as the judges <i>determine</i>.",""
5399,12,0,"And if any mischief follow, then thou shalt give life for life,","And if <i>any</i> mischief follow, then thou shalt give life for life,",""
5400,12,0,"Eye for eye, tooth for tooth, hand for hand, foot for foot,","Eye for eye, tooth for tooth, hand for hand, foot for foot,",""
5401,9,0,"Burning for burning, wound for wound, stripe for stripe.","Burning for burning, wound for wound, stripe for stripe.",""
5402,29,1,"And if a man smite the eye of his servant, or the eye of his maid, that it perish; he shall let him go free for his eye's sake.","¶And if a man smite the eye of his servant, or the eye of his maid, that it perish; he shall let him go free for his eye's sake.",""
5403,22,0,"And if he smite out his manservant's tooth, or his maidservant's tooth; he shall let him go free for his tooth's sake.","And if he smite out his manservant's tooth, or his maidservant's tooth; he shall let him go free for his tooth's sake.",""
5404,35,1,"If an ox gore a man or a woman, that they die: then the ox shall be surely stoned, and his flesh shall not be eaten; but the owner of the ox shall be quit.","¶If an ox gore a man or a woman, that they die: then the ox shall be surely stoned, and his flesh shall not be eaten; but the owner of the ox <i>shall be</i> quit.",""
5405,53,0,"But if the ox were wont to push with his horn in time past, and it hath been testified to his owner, and he hath not kept him in, but that he hath killed a man or a woman; the ox shall be stoned, and his owner also shall be put to death.","But if the ox were wont to push with his horn in time past, and it hath been testified to his owner, and he hath not kept him in, but that he hath killed a man or a woman; the ox shall be stoned, and his owner also shall be put to death.",""
5406,25,0,"If there be laid on him a sum of money, then he shall give for the ransom of his life whatsoever is laid upon him.","If there be laid on him a sum of money, then he shall give for the ransom of his life whatsoever is laid upon him.",""
5407,21,0,"Whether he have gored a son, or have gored a daughter, according to this judgment shall it be done unto him.","Whether he have gored a son, or have gored a daughter, according to this judgment shall it be done unto him.",""
5408,26,0,"If the ox shall push a manservant or a maidservant; he shall give unto their master thirty shekels of silver, and the ox shall be stoned.","If the ox shall push a manservant or a maidservant; he shall give unto their master thirty shekels of silver, and the ox shall be stoned.",""
5409,28,1,"And if a man shall open a pit, or if a man shall dig a pit, and not cover it, and an ox or an ass fall therein;","¶And if a man shall open a pit, or if a man shall dig a pit, and not cover it, and an ox or an ass fall therein;",""
5410,24,0,"The owner of the pit shall make it good, and give money unto the owner of them; and the dead beast shall be his.","The owner of the pit shall make <i>it</i> good, <i>and</i> give money unto the owner of them; and the dead <i>beast</i> shall be his.",""
5411,31,1,"And if one man's ox hurt another's, that he die; then they shall sell the live ox, and divide the money of it; and the dead ox also they shall divide.","¶And if one man's ox hurt another's, that he die; then they shall sell the live ox, and divide the money of it; and the dead <i>ox</i> also they shall divide.",""
5412,37,0,"Or if it be known that the ox hath used to push in time past, and his owner hath not kept him in; he shall surely pay ox for ox; and the dead shall be his own.","Or if it be known that the ox hath used to push in time past, and his owner hath not kept him in; he shall surely pay ox for ox; and the dead shall be his own.",""
5633,30,0,"If a man shall steal an ox, or a sheep, and kill it, or sell it; he shall restore five oxen for an ox, and four sheep for a sheep.","If a man shall steal an ox, or a sheep, and kill it, or sell it; he shall restore five oxen for an ox, and four sheep for a sheep.",""
5634,21,1,"If a thief be found breaking up, and be smitten that he die, there shall no blood be shed for him.","¶If a thief be found breaking up, and be smitten that he die, <i>there shall</i> no blood <i>be shed</i> for him.",""
5635,32,0,"If the sun be risen upon him, there shall be blood shed for him; for he should make full restitution; if he have nothing, then he shall be sold for his theft.","If the sun be risen upon him, <i>there shall be</i> blood <i>shed</i> for him; <i>for</i> he should make full restitution; if he have nothing, then he shall be sold for his theft.",""
5636,22,0,"If the theft be certainly found in his hand alive, whether it be ox, or ass, or sheep; he shall restore double.","If the theft be certainly found in his hand alive, whether it be ox, or ass, or sheep; he shall restore double.",""
5637,44,1,"If a man shall cause a field or vineyard to be eaten, and shall put in his beast, and shall feed in another man's field; of the best of his own field, and of the best of his own vineyard, shall he make restitution.","¶If a man shall cause a field or vineyard to be eaten, and shall put in his beast, and shall feed in another man's field; of the best of his own field, and of the best of his own vineyard, shall he make restitution.",""
5638,33,1,"If fire break out, and catch in thorns, so that the stacks of corn, or the standing corn, or the field, be consumed therewith; he that kindled the fire shall surely make restitution.","¶If fire break out, and catch in thorns, so that the stacks of corn, or the standing corn, or the field, be consumed <i>therewith</i>; he that kindled the fire shall surely make restitution.",""
5639,31,1,"If a man shall deliver unto his neighbour money or stuff to keep, and it be stolen out of the man's house; if the thief be found, let him pay double.","¶If a man shall deliver unto his neighbour money or stuff to keep, and it be stolen out of the man's house; if the thief be found, let him pay double.",""
5640,30,0,"If the thief be not found, then the master of the house shall be brought unto the judges, to see whether he have put his hand unto his neighbour's goods.","If the thief be not found, then the master of the house shall be brought unto the judges, <i>to see</i> whether he have put his hand unto his neighbour's goods.",""
5641,52,0,"For all manner of trespass, whether it be for ox, for ass, for sheep, for raiment, or for any manner of lost thing, which another challengeth to be his, the cause of both parties shall come before the judges; and whom the judges shall condemn, he shall pay double unto his neighbour.","For all manner of trespass, <i>whether it be</i> for ox, for ass, for sheep, for raiment, <i>or</i> for any manner of lost thing, which <i>another</i> challengeth to be his, the cause of both parties shall come before the judges; <i>and</i> whom the judges shall condemn, he shall pay double unto his neighbour.",""
5642,33,0,"If a man deliver unto his neighbour an ass, or an ox, or a sheep, or any beast, to keep; and it die, or be hurt, or driven away, no man seeing it:","If a man deliver unto his neighbour an ass, or an ox, or a sheep, or any beast, to keep; and it die, or be hurt, or driven away, no man seeing <i>it</i>:",""
5643,37,0,"Then shall an oath of the LORD be between them both, that he hath not put his hand unto his neighbour's goods; and the owner of it shall accept thereof, and he shall not make it good.","<i>Then</i> shall an oath of the L<font size=""-1"">ORD</font> be between them both, that he hath not put his hand unto his neighbour's goods; and the owner of it shall accept <i>thereof</i>, and he shall not make <i>it</i> good.",""
5644,15,0,"And if it be stolen from him, he shall make restitution unto the owner thereof.","And if it be stolen from him, he shall make restitution unto the owner thereof.",""
5645,23,0,"If it be torn in pieces, then let him bring it for witness, and he shall not make good that which was torn.","If it be torn in pieces, <i>then</i> let him bring it <i>for</i> witness, <i>and</i> he shall not make good that which was torn.",""
5646,28,1,"And if a man borrow ought of his neighbour, and it be hurt, or die, the owner thereof being not with it, he shall surely make it good.","¶And if a man borrow <i>ought</i> of his neighbour, and it be hurt, or die, the owner thereof <i>being</i> not with it, he shall surely make <i>it</i> good.",""
5647,25,0,"But if the owner thereof be with it, he shall not make it good: if it be an hired thing, it came for his hire.","<i>But</i> if the owner thereof <i>be</i> with it, he shall not make <i>it</i> good: if it <i>be</i> an hired <i>thing</i>, it came for his hire.",""
5648,24,1,"And if a man entice a maid that is not betrothed, and lie with her, he shall surely endow her to be his wife.","¶And if a man entice a maid that is not betrothed, and lie with her, he shall surely endow her to be his wife.",""
5649,20,0,"If her father utterly refuse to give her unto him, he shall pay money according to the dowry of virgins.","If her father utterly refuse to give her unto him, he shall pay money according to the dowry of virgins.",""
5650,8,1,"Thou shalt not suffer a witch to live.","¶Thou shalt not suffer a witch to live.",""
5651,11,1,"Whosoever lieth with a beast shall surely be put to death.","¶Whosoever lieth with a beast shall surely be put to death.",""
5652,16,1,"He that sacrificeth unto any god, save unto the LORD only, he shall be utterly destroyed.","¶He that sacrificeth unto <i>any</i> god, save unto the L<font size=""-1"">ORD</font> only, he shall be utterly destroyed.",""
5653,18,1,"Thou shalt neither vex a stranger, nor oppress him: for ye were strangers in the land of Egypt.","¶Thou shalt neither vex a stranger, nor oppress him: for ye were strangers in the land of Egypt.",""
5654,9,1,"Ye shall not afflict any widow, or fatherless child.","¶Ye shall not afflict any widow, or fatherless child.",""
5655,20,0,"If thou afflict them in any wise, and they cry at all unto me, I will surely hear their cry;","If thou afflict them in any wise, and they cry at all unto me, I will surely hear their cry;",""
5656,24,0,"And my wrath shall wax hot, and I will kill you with the sword; and your wives shall be widows, and your children fatherless.","And my wrath shall wax hot, and I will kill you with the sword; and your wives shall be widows, and your children fatherless.",""
5657,30,1,"If thou lend money to any of my people that is poor by thee, thou shalt not be to him as an usurer, neither shalt thou lay upon him usury.","¶If thou lend money to <i>any of</i> my people <i>that is</i> poor by thee, thou shalt not be to him as an usurer, neither shalt thou lay upon him usury.",""
5658,22,0,"If thou at all take thy neighbour's raiment to pledge, thou shalt deliver it unto him by that the sun goeth down:","If thou at all take thy neighbour's raiment to pledge, thou shalt deliver it unto him by that the sun goeth down:",""
5659,36,0,"For that is his covering only, it is his raiment for his skin: wherein shall he sleep? and it shall come to pass, when he crieth unto me, that I will hear; for I am gracious.","For that <i>is</i> his covering only, it <i>is</i> his raiment for his skin: wherein shall he sleep? and it shall come to pass, when he crieth unto me, that I will hear; for I <i>am</i> gracious.",""
5660,13,1,"Thou shalt not revile the gods, nor curse the ruler of thy people.","¶Thou shalt not revile the gods, nor curse the ruler of thy people.",""
5661,26,1,"Thou shalt not delay to offer the first of thy ripe fruits, and of thy liquors: the firstborn of thy sons shalt thou give unto me.","¶Thou shalt not delay <i>to offer</i> the first of thy ripe fruits, and of thy liquors: the firstborn of thy sons shalt thou give unto me.",""
5662,28,0,"Likewise shalt thou do with thine oxen, and with thy sheep: seven days it shall be with his dam; on the eighth day thou shalt give it me.","Likewise shalt thou do with thine oxen, <i>and</i> with thy sheep: seven days it shall be with his dam; on the eighth day thou shalt give it me.",""
5663,29,1,"And ye shall be holy men unto me: neither shall ye eat any flesh that is torn of beasts in the field; ye shall cast it to the dogs.","¶And ye shall be holy men unto me: neither shall ye eat <i>any</i> flesh <i>that is</i> torn of beasts in the field; ye shall cast it to the dogs.",""
5889,19,0,"Thou shalt not raise a false report: put not thine hand with the wicked to be an unrighteous witness.","Thou shalt not raise a false report: put not thine hand with the wicked to be an unrighteous witness.",""
5890,23,1,"Thou shalt not follow a multitude to do evil; neither shalt thou speak in a cause to decline after many to wrest judgment:","¶Thou shalt not follow a multitude to <i>do</i> evil; neither shalt thou speak in a cause to decline after many to wrest <i>judgment</i>:",""
5891,10,1,"Neither shalt thou countenance a poor man in his cause.","¶Neither shalt thou countenance a poor man in his cause.",""
5892,20,1,"If thou meet thine enemy's ox or his ass going astray, thou shalt surely bring it back to him again.","¶If thou meet thine enemy's ox or his ass going astray, thou shalt surely bring it back to him again.",""
5893,26,0,"If thou see the ass of him that hateth thee lying under his burden, and wouldest forbear to help him, thou shalt surely help with him.","If thou see the ass of him that hateth thee lying under his burden, and wouldest forbear to help him, thou shalt surely help with him.",""
5894,12,0,"Thou shalt not wrest the judgment of thy poor in his cause.","Thou shalt not wrest the judgment of thy poor in his cause.",""
5895,22,0,"Keep thee far from a false matter; and the innocent and righteous slay thou not: for I will not justify the wicked.","Keep thee far from a false matter; and the innocent and righteous slay thou not: for I will not justify the wicked.",""
5896,19,1,"And thou shalt take no gift: for the gift blindeth the wise, and perverteth the words of the righteous.","¶And thou shalt take no gift: for the gift blindeth the wise, and perverteth the words of the righteous.",""
5897,24,1,"Also thou shalt not oppress a stranger: for ye know the heart of a stranger, seeing ye were strangers in the land of Egypt.","¶Also thou shalt not oppress a stranger: for ye know the heart of a stranger, seeing ye were strangers in the land of Egypt.",""
5898,15,1,"And six years thou shalt sow thy land, and shalt gather in the fruits thereof:","¶And six years thou shalt sow thy land, and shalt gather in the fruits thereof:",""
5899,44,0,"But the seventh year thou shalt let it rest and lie still; that the poor of thy people may eat: and what they leave the beasts of the field shall eat. In like manner thou shalt deal with thy vineyard, and with thy oliveyard.","But the seventh <i>year</i> thou shalt let it rest and lie still; that the poor of thy people may eat: and what they leave the beasts of the field shall eat. In like manner thou shalt deal with thy vineyard, <i>and</i> with thy oliveyard.",""
5900,35,0,"Six days thou shalt do thy work, and on the seventh day thou shalt rest: that thine ox and thine ass may rest, and the son of thy handmaid, and the stranger, may be refreshed.","Six days thou shalt do thy work, and on the seventh day thou shalt rest: that thine ox and thine ass may rest, and the son of thy handmaid, and the stranger, may be refreshed.",""
5901,31,0,"And in all things that I have said unto you be circumspect: and make no mention of the name of other gods, neither let it be heard out of thy mouth.","And in all <i>things</i> that I have said unto you be circumspect: and make no mention of the name of other gods, neither let it be heard out of thy mouth.",""
5902,12,1,"Three times thou shalt keep a feast unto me in the year.","¶Three times thou shalt keep a feast unto me in the year.",""
5903,42,0,"Thou shalt keep the feast of unleavened bread: (thou shalt eat unleavened bread seven days, as I commanded thee, in the time appointed of the month Abib; for in it thou camest out from Egypt: and none shall appear before me empty:)","Thou shalt keep the feast of unleavened bread: (thou shalt eat unleavened bread seven days, as I commanded thee, in the time appointed of the month Abib; for in it thou camest out from Egypt: and none shall appear before me empty:)",""
5904,41,0,"And the feast of harvest, the firstfruits of thy labours, which thou hast sown in the field: and the feast of ingathering, which is in the end of the year, when thou hast gathered in thy labours out of the field.","And the feast of harvest, the firstfruits of thy labours, which thou hast sown in the field: and the feast of ingathering, <i>which is</i> in the end of the year, when thou hast gathered in thy labours out of the field.",""
5905,14,0,"Three times in the year all thy males shall appear before the Lord GOD.","Three times in the year all thy males shall appear before the Lord G<font size=""-1"">OD</font>.",""
5906,23,0,"Thou shalt not offer the blood of my sacrifice with leavened bread; neither shall the fat of my sacrifice remain until the morning.","Thou shalt not offer the blood of my sacrifice with leavened bread; neither shall the fat of my sacrifice remain until the morning.",""
5907,29,0,"The first of the firstfruits of thy land thou shalt bring into the house of the LORD thy God. Thou shalt not seethe a kid in his mother's milk.","The first of the firstfruits of thy land thou shalt bring into the house of the L<font size=""-1"">ORD</font> thy God. Thou shalt not seethe a kid in his mother's milk.",""
5908,24,1,"Behold, I send an Angel before thee, to keep thee in the way, and to bring thee into the place which I have prepared.","¶Behold, I send an Angel before thee, to keep thee in the way, and to bring thee into the place which I have prepared.",""
5909,23,0,"Beware of him, and obey his voice, provoke him not; for he will not pardon your transgressions: for my name is in him.","Beware of him, and obey his voice, provoke him not; for he will not pardon your transgressions: for my name <i>is</i> in him.",""
5910,29,0,"But if thou shalt indeed obey his voice, and do all that I speak; then I will be an enemy unto thine enemies, and an adversary unto thine adversaries.","But if thou shalt indeed obey his voice, and do all that I speak; then I will be an enemy unto thine enemies, and an adversary unto thine adversaries.",""
5911,34,0,"For mine Angel shall go before thee, and bring thee in unto the Amorites, and the Hittites, and the Perizzites, and the Canaanites, the Hivites, and the Jebusites: and I will cut them off.","For mine Angel shall go before thee, and bring thee in unto the Amorites, and the Hittites, and the Perizzites, and the Canaanites, the Hivites, and the Jebusites: and I will cut them off.",""
5912,28,0,"Thou shalt not bow down to their gods, nor serve them, nor do after their works: but thou shalt utterly overthrow them, and quite break down their images.","Thou shalt not bow down to their gods, nor serve them, nor do after their works: but thou shalt utterly overthrow them, and quite break down their images.",""
5913,28,0,"And ye shall serve the LORD your God, and he shall bless thy bread, and thy water; and I will take sickness away from the midst of thee.","And ye shall serve the L<font size=""-1"">ORD</font> your God, and he shall bless thy bread, and thy water; and I will take sickness away from the midst of thee.",""
5914,20,1,"There shall nothing cast their young, nor be barren, in thy land: the number of thy days I will fulfil.","¶There shall nothing cast their young, nor be barren, in thy land: the number of thy days I will fulfil.",""
5915,30,0,"I will send my fear before thee, and will destroy all the people to whom thou shalt come, and I will make all thine enemies turn their backs unto thee.","I will send my fear before thee, and will destroy all the people to whom thou shalt come, and I will make all thine enemies turn their backs unto thee.",""
5916,21,0,"And I will send hornets before thee, which shall drive out the Hivite, the Canaanite, and the Hittite, from before thee.","And I will send hornets before thee, which shall drive out the Hivite, the Canaanite, and the Hittite, from before thee.",""
5917,26,0,"I will not drive them out from before thee in one year; lest the land become desolate, and the beast of the field multiply against thee.","I will not drive them out from before thee in one year; lest the land become desolate, and the beast of the field multiply against thee.",""
5918,20,0,"By little and little I will drive them out from before thee, until thou be increased, and inherit the land.","By little and little I will drive them out from before thee, until thou be increased, and inherit the land.",""
5919,44,0,"And I will set thy bounds from the Red sea even unto the sea of the Philistines, and from the desert unto the river: for I will deliver the inhabitants of the land into your hand; and thou shalt drive them out before thee.","And I will set thy bounds from the Red sea even unto the sea of the Philistines, and from the desert unto the river: for I will deliver the inhabitants of the land into your hand; and thou shalt drive them out before thee.",""
5920,11,0,"Thou shalt make no covenant with them, nor with their gods.","Thou shalt make no covenant with them, nor with their gods.",""
5921,28,0,"They shall not dwell in thy land, lest they make thee sin against me: for if thou serve their gods, it will surely be a snare unto thee.","They shall not dwell in thy land, lest they make thee sin against me: for if thou serve their gods, it will surely be a snare unto thee.",""
6145,28,0,"And he said unto Moses, Come up unto the LORD, thou, and Aaron, Nadab, and Abihu, and seventy of the elders of Israel; and worship ye afar off.","And he said unto Moses, Come up unto the L<font size=""-1"">ORD</font>, thou, and Aaron, Nadab, and Abihu, and seventy of the elders of Israel; and worship ye afar off.",""
6146,22,0,"And Moses alone shall come near the LORD: but they shall not come nigh; neither shall the people go up with him.","And Moses alone shall come near the L<font size=""-1"">ORD</font>: but they shall not come nigh; neither shall the people go up with him.",""
6147,38,1,"And Moses came and told the people all the words of the LORD, and all the judgments: and all the people answered with one voice, and said, All the words which the LORD hath said will we do.","¶And Moses came and told the people all the words of the L<font size=""-1"">ORD</font>, and all the judgments: and all the people answered with one voice, and said, All the words which the L<font size=""-1"">ORD</font> hath said will we do.",""
6148,33,0,"And Moses wrote all the words of the LORD, and rose up early in the morning, and builded an altar under the hill, and twelve pillars, according to the twelve tribes of Israel.","And Moses wrote all the words of the L<font size=""-1"">ORD</font>, and rose up early in the morning, and builded an altar under the hill, and twelve pillars, according to the twelve tribes of Israel.",""
