ChpVrsNdx,NumWrd,bPilcrow,PText,RText,Footnote
257,22,0,"Now these are the names of the children of Israel, which came into Egypt; every man and his household came with Jacob.","Now these <i>are</i> the names of the children of Israel, which came into Egypt; every man and his household came with Jacob.",""
258,5,0,"Reuben, Simeon, Levi, and Judah,","Reuben, Simeon, Levi, and Judah,",""
259,4,0,"Issachar, Zebulun, and Benjamin,","Issachar, Zebulun, and Benjamin,",""
260,6,0,"Dan, and Naphtali, Gad, and Asher.","Dan, and Naphtali, Gad, and Asher.",""
261,21,0,"And all the souls that came out of the loins of Jacob were seventy souls: for Joseph was in Egypt already.","And all the souls that came out of the loins of Jacob were seventy souls: for Joseph was in Egypt <i>already</i>.",""
262,11,0,"And Joseph died, and all his brethren, and all that generation.","And Joseph died, and all his brethren, and all that generation.",""
263,23,1,"And the children of Israel were fruitful, and increased abundantly, and multiplied, and waxed exceeding mighty; and the land was filled with them.","¶And the children of Israel were fruitful, and increased abundantly, and multiplied, and waxed exceeding mighty; and the land was filled with them.",""
264,13,1,"Now there arose up a new king over Egypt, which knew not Joseph.","¶Now there arose up a new king over Egypt, which knew not Joseph.",""
265,20,0,"And he said unto his people, Behold, the people of the children of Israel are more and mightier than we:","And he said unto his people, Behold, the people of the children of Israel <i>are</i> more and mightier than we:",""
266,42,0,"Come on, let us deal wisely with them; lest they multiply, and it come to pass, that, when there falleth out any war, they join also unto our enemies, and fight against us, and so get them up out of the land.","Come on, let us deal wisely with them; lest they multiply, and it come to pass, that, when there falleth out any war, they join also unto our enemies, and fight against us, and <i>so</i> get them up out of the land.",""
267,23,0,"Therefore they did set over them taskmasters to afflict them with their burdens. And they built for Pharaoh treasure cities, Pithom and Raamses.","Therefore they did set over them taskmasters to afflict them with their burdens. And they built for Pharaoh treasure cities, Pithom and Raamses.",""
268,22,0,"But the more they afflicted them, the more they multiplied and grew. And they were grieved because of the children of Israel.","But the more they afflicted them, the more they multiplied and grew. And they were grieved because of the children of Israel.",""
269,12,0,"And the Egyptians made the children of Israel to serve with rigour:","And the Egyptians made the children of Israel to serve with rigour:",""
270,34,0,"And they made their lives bitter with hard bondage, in morter, and in brick, and in all manner of service in the field: all their service, wherein they made them serve, was with rigour.","And they made their lives bitter with hard bondage, in morter, and in brick, and in all manner of service in the field: all their service, wherein they made them serve, <i>was</i> with rigour.",""
271,26,1,"And the king of Egypt spake to the Hebrew midwives, of which the name of the one was Shiphrah, and the name of the other Puah:","¶And the king of Egypt spake to the Hebrew midwives, of which the name of the one <i>was</i> Shiphrah, and the name of the other Puah:",""
272,41,0,"And he said, When ye do the office of a midwife to the Hebrew women, and see them upon the stools; if it be a son, then ye shall kill him: but if it be a daughter, then she shall live.","And he said, When ye do the office of a midwife to the Hebrew women, and see <i>them</i> upon the stools; if it <i>be</i> a son, then ye shall kill him: but if it <i>be</i> a daughter, then she shall live.",""
273,21,0,"But the midwives feared God, and did not as the king of Egypt commanded them, but saved the men children alive.","But the midwives feared God, and did not as the king of Egypt commanded them, but saved the men children alive.",""
274,26,0,"And the king of Egypt called for the midwives, and said unto them, Why have ye done this thing, and have saved the men children alive?","And the king of Egypt called for the midwives, and said unto them, Why have ye done this thing, and have saved the men children alive?",""
275,30,0,"And the midwives said unto Pharaoh, Because the Hebrew women are not as the Egyptian women; for they are lively, and are delivered ere the midwives come in unto them.","And the midwives said unto Pharaoh, Because the Hebrew women <i>are</i> not as the Egyptian women; for they <i>are</i> lively, and are delivered ere the midwives come in unto them.",""
276,15,0,"Therefore God dealt well with the midwives: and the people multiplied, and waxed very mighty.","Therefore God dealt well with the midwives: and the people multiplied, and waxed very mighty.",""
277,15,0,"And it came to pass, because the midwives feared God, that he made them houses.","And it came to pass, because the midwives feared God, that he made them houses.",""
278,25,0,"And Pharaoh charged all his people, saying, Every son that is born ye shall cast into the river, and every daughter ye shall save alive.","And Pharaoh charged all his people, saying, Every son that is born ye shall cast into the river, and every daughter ye shall save alive.",""
513,18,0,"And there went a man of the house of Levi, and took to wife a daughter of Levi.","And there went a man of the house of Levi, and took <i>to wife</i> a daughter of Levi.",""
514,24,0,"And the woman conceived, and bare a son: and when she saw him that he was a goodly child, she hid him three months.","And the woman conceived, and bare a son: and when she saw him that he <i>was a</i> goodly <i>child</i>, she hid him three months.",""
515,40,0,"And when she could not longer hide him, she took for him an ark of bulrushes, and daubed it with slime and with pitch, and put the child therein; and she laid it in the flags by the river's brink.","And when she could not longer hide him, she took for him an ark of bulrushes, and daubed it with slime and with pitch, and put the child therein; and she laid <i>it</i> in the flags by the river's brink.",""
516,14,0,"And his sister stood afar off, to wit what would be done to him.","And his sister stood afar off, to wit what would be done to him.",""
517,38,1,"And the daughter of Pharaoh came down to wash herself at the river; and her maidens walked along by the river's side; and when she saw the ark among the flags, she sent her maid to fetch it.","¶And the daughter of Pharaoh came down to wash <i>herself</i> at the river; and her maidens walked along by the river's side; and when she saw the ark among the flags, she sent her maid to fetch it.",""
518,30,0,"And when she had opened it, she saw the child: and, behold, the babe wept. And she had compassion on him, and said, This is one of the Hebrews' children.","And when she had opened <i>it</i>, she saw the child: and, behold, the babe wept. And she had compassion on him, and said, This <i>is one</i> of the Hebrews' children.",""
519,28,0,"Then said his sister to Pharaoh's daughter, Shall I go and call to thee a nurse of the Hebrew women, that she may nurse the child for thee?","Then said his sister to Pharaoh's daughter, Shall I go and call to thee a nurse of the Hebrew women, that she may nurse the child for thee?",""
520,16,0,"And Pharaoh's daughter said to her, Go. And the maid went and called the child's mother.","And Pharaoh's daughter said to her, Go. And the maid went and called the child's mother.",""
521,31,0,"And Pharaoh's daughter said unto her, Take this child away, and nurse it for me, and I will give thee thy wages. And the woman took the child, and nursed it.","And Pharaoh's daughter said unto her, Take this child away, and nurse it for me, and I will give <i>thee</i> thy wages. And the woman took the child, and nursed it.",""
522,33,0,"And the child grew, and she brought him unto Pharaoh's daughter, and he became her son. And she called his name Moses: and she said, Because I drew him out of the water.","And the child grew, and she brought him unto Pharaoh's daughter, and he became her son. And she called his name Moses: and she said, Because I drew him out of the water.",""
523,36,1,"And it came to pass in those days, when Moses was grown, that he went out unto his brethren, and looked on their burdens: and he spied an Egyptian smiting an Hebrew, one of his brethren.","¶And it came to pass in those days, when Moses was grown, that he went out unto his brethren, and looked on their burdens: and he spied an Egyptian smiting an Hebrew, one of his brethren.",""
524,27,0,"And he looked this way and that way, and when he saw that there was no man, he slew the Egyptian, and hid him in the sand.","And he looked this way and that way, and when he saw that <i>there was</i> no man, he slew the Egyptian, and hid him in the sand.",""
525,30,0,"And when he went out the second day, behold, two men of the Hebrews strove together: and he said to him that did the wrong, Wherefore smitest thou thy fellow?","And when he went out the second day, behold, two men of the Hebrews strove together: and he said to him that did the wrong, Wherefore smitest thou thy fellow?",""
526,33,0,"And he said, Who made thee a prince and a judge over us? intendest thou to kill me, as thou killedst the Egyptian? And Moses feared, and said, Surely this thing is known.","And he said, Who made thee a prince and a judge over us? intendest thou to kill me, as thou killedst the Egyptian? And Moses feared, and said, Surely this thing is known.",""
527,33,0,"Now when Pharaoh heard this thing, he sought to slay Moses. But Moses fled from the face of Pharaoh, and dwelt in the land of Midian: and he sat down by a well.","Now when Pharaoh heard this thing, he sought to slay Moses. But Moses fled from the face of Pharaoh, and dwelt in the land of Midian: and he sat down by a well.",""
528,23,1,"Now the priest of Midian had seven daughters: and they came and drew water, and filled the troughs to water their father's flock.","¶Now the priest of Midian had seven daughters: and they came and drew <i>water</i>, and filled the troughs to water their father's flock.",""
529,19,0,"And the shepherds came and drove them away: but Moses stood up and helped them, and watered their flock.","And the shepherds came and drove them away: but Moses stood up and helped them, and watered their flock.",""
530,21,0,"And when they came to Reuel their father, he said, How is it that ye are come so soon to day?","And when they came to Reuel their father, he said, How <i>is it that</i> ye are come so soon to day?",""
531,25,0,"And they said, An Egyptian delivered us out of the hand of the shepherds, and also drew water enough for us, and watered the flock.","And they said, An Egyptian delivered us out of the hand of the shepherds, and also drew <i>water</i> enough for us, and watered the flock.",""
532,26,0,"And he said unto his daughters, And where is he? why is it that ye have left the man? call him, that he may eat bread.","And he said unto his daughters, And where <i>is</i> he? why <i>is</i> it <i>that</i> ye have left the man? call him, that he may eat bread.",""
533,16,0,"And Moses was content to dwell with the man: and he gave Moses Zipporah his daughter.","And Moses was content to dwell with the man: and he gave Moses Zipporah his daughter.",""
534,24,0,"And she bare him a son, and he called his name Gershom: for he said, I have been a stranger in a strange land.","And she bare <i>him</i> a son, and he called his name Gershom: for he said, I have been a stranger in a strange land.",""
535,41,1,"And it came to pass in process of time, that the king of Egypt died: and the children of Israel sighed by reason of the bondage, and they cried, and their cry came up unto God by reason of the bondage.","¶And it came to pass in process of time, that the king of Egypt died: and the children of Israel sighed by reason of the bondage, and they cried, and their cry came up unto God by reason of the bondage.",""
536,17,0,"And God heard their groaning, and God remembered his covenant with Abraham, with Isaac, and with Jacob.","And God heard their groaning, and God remembered his covenant with Abraham, with Isaac, and with Jacob.",""
537,14,0,"And God looked upon the children of Israel, and God had respect unto them.","And God looked upon the children of Israel, and God had respect unto <i>them</i>.",""
769,36,0,"Now Moses kept the flock of Jethro his father in law, the priest of Midian: and he led the flock to the backside of the desert, and came to the mountain of God, even to Horeb.","Now Moses kept the flock of Jethro his father in law, the priest of Midian: and he led the flock to the backside of the desert, and came to the mountain of God, <i>even</i> to Horeb.",""
770,37,0,"And the angel of the LORD appeared unto him in a flame of fire out of the midst of a bush: and he looked, and, behold, the bush burned with fire, and the bush was not consumed.","And the angel of the L<font size=""-1"">ORD</font> appeared unto him in a flame of fire out of the midst of a bush: and he looked, and, behold, the bush burned with fire, and the bush <i>was</i> not consumed.",""
771,19,0,"And Moses said, I will now turn aside, and see this great sight, why the bush is not burnt.","And Moses said, I will now turn aside, and see this great sight, why the bush is not burnt.",""
772,32,0,"And when the LORD saw that he turned aside to see, God called unto him out of the midst of the bush, and said, Moses, Moses. And he said, Here am I.","And when the L<font size=""-1"">ORD</font> saw that he turned aside to see, God called unto him out of the midst of the bush, and said, Moses, Moses. And he said, Here <i>am</i> I.",""
773,24,0,"And he said, Draw not nigh hither: put off thy shoes from off thy feet, for the place whereon thou standest is holy ground.","And he said, Draw not nigh hither: put off thy shoes from off thy feet, for the place whereon thou standest <i>is</i> holy ground.",""
774,36,0,"Moreover he said, I am the God of thy father, the God of Abraham, the God of Isaac, and the God of Jacob. And Moses hid his face; for he was afraid to look upon God.","Moreover he said, I <i>am</i> the God of thy father, the God of Abraham, the God of Isaac, and the God of Jacob. And Moses hid his face; for he was afraid to look upon God.",""
775,32,1,"And the LORD said, I have surely seen the affliction of my people which are in Egypt, and have heard their cry by reason of their taskmasters; for I know their sorrows;","¶And the L<font size=""-1"">ORD</font> said, I have surely seen the affliction of my people which <i>are</i> in Egypt, and have heard their cry by reason of their taskmasters; for I know their sorrows;",""
776,60,0,"And I am come down to deliver them out of the hand of the Egyptians, and to bring them up out of that land unto a good land and a large, unto a land flowing with milk and honey; unto the place of the Canaanites, and the Hittites, and the Amorites, and the Perizzites, and the Hivites, and the Jebusites.","And I am come down to deliver them out of the hand of the Egyptians, and to bring them up out of that land unto a good land and a large, unto a land flowing with milk and honey; unto the place of the Canaanites, and the Hittites, and the Amorites, and the Perizzites, and the Hivites, and the Jebusites.",""
777,26,0,"Now therefore, behold, the cry of the children of Israel is come unto me: and I have also seen the oppression wherewith the Egyptians oppress them.","Now therefore, behold, the cry of the children of Israel is come unto me: and I have also seen the oppression wherewith the Egyptians oppress them.",""
778,24,0,"Come now therefore, and I will send thee unto Pharaoh, that thou mayest bring forth my people the children of Israel out of Egypt.","Come now therefore, and I will send thee unto Pharaoh, that thou mayest bring forth my people the children of Israel out of Egypt.",""
779,27,1,"And Moses said unto God, Who am I, that I should go unto Pharaoh, and that I should bring forth the children of Israel out of Egypt?","¶And Moses said unto God, Who <i>am</i> I, that I should go unto Pharaoh, and that I should bring forth the children of Israel out of Egypt?",""
780,39,0,"And he said, Certainly I will be with thee; and this shall be a token unto thee, that I have sent thee: When thou hast brought forth the people out of Egypt, ye shall serve God upon this mountain.","And he said, Certainly I will be with thee; and this <i>shall be</i> a token unto thee, that I have sent thee: When thou hast brought forth the people out of Egypt, ye shall serve God upon this mountain.",""
781,45,0,"And Moses said unto God, Behold, when I come unto the children of Israel, and shall say unto them, The God of your fathers hath sent me unto you; and they shall say to me, What is his name? what shall I say unto them?","And Moses said unto God, Behold, <i>when</i> I come unto the children of Israel, and shall say unto them, The God of your fathers hath sent me unto you; and they shall say to me, What <i>is</i> his name? what shall I say unto them?",""
782,29,0,"And God said unto Moses, I AM THAT I AM: and he said, Thus shalt thou say unto the children of Israel, I AM hath sent me unto you.","And God said unto Moses, I AM THAT I AM: and he said, Thus shalt thou say unto the children of Israel, I AM hath sent me unto you.",""
783,53,0,"And God said moreover unto Moses, Thus shalt thou say unto the children of Israel, The LORD God of your fathers, the God of Abraham, the God of Isaac, and the God of Jacob, hath sent me unto you: this is my name for ever, and this is my memorial unto all generations.","And God said moreover unto Moses, Thus shalt thou say unto the children of Israel, The L<font size=""-1"">ORD</font> God of your fathers, the God of Abraham, the God of Isaac, and the God of Jacob, hath sent me unto you: this <i>is</i> my name for ever, and this <i>is</i> my memorial unto all generations.",""
784,46,1,"Go, and gather the elders of Israel together, and say unto them, The LORD God of your fathers, the God of Abraham, of Isaac, and of Jacob, appeared unto me, saying, I have surely visited you, and seen that which is done to you in Egypt:","¶Go, and gather the elders of Israel together, and say unto them, The L<font size=""-1"">ORD</font> God of your fathers, the God of Abraham, of Isaac, and of Jacob, appeared unto me, saying, I have surely visited you, and <i>seen</i> that which is done to you in Egypt:",""
785,44,0,"And I have said, I will bring you up out of the affliction of Egypt unto the land of the Canaanites, and the Hittites, and the Amorites, and the Perizzites, and the Hivites, and the Jebusites, unto a land flowing with milk and honey.","And I have said, I will bring you up out of the affliction of Egypt unto the land of the Canaanites, and the Hittites, and the Amorites, and the Perizzites, and the Hivites, and the Jebusites, unto a land flowing with milk and honey.",""
786,61,0,"And they shall hearken to thy voice: and thou shalt come, thou and the elders of Israel, unto the king of Egypt, and ye shall say unto him, The LORD God of the Hebrews hath met with us: and now let us go, we beseech thee, three days' journey into the wilderness, that we may sacrifice to the LORD our God.","And they shall hearken to thy voice: and thou shalt come, thou and the elders of Israel, unto the king of Egypt, and ye shall say unto him, The L<font size=""-1"">ORD</font> God of the Hebrews hath met with us: and now let us go, we beseech thee, three days' journey into the wilderness, that we may sacrifice to the L<font size=""-1"">ORD</font> our God.",""
787,20,1,"And I am sure that the king of Egypt will not let you go, no, not by a mighty hand.","¶And I am sure that the king of Egypt will not let you go, no, not by a mighty hand.",""
788,30,0,"And I will stretch out my hand, and smite Egypt with all my wonders which I will do in the midst thereof: and after that he will let you go.","And I will stretch out my hand, and smite Egypt with all my wonders which I will do in the midst thereof: and after that he will let you go.",""
789,28,0,"And I will give this people favour in the sight of the Egyptians: and it shall come to pass, that, when ye go, ye shall not go empty:","And I will give this people favour in the sight of the Egyptians: and it shall come to pass, that, when ye go, ye shall not go empty:",""
790,43,0,"But every woman shall borrow of her neighbour, and of her that sojourneth in her house, jewels of silver, and jewels of gold, and raiment: and ye shall put them upon your sons, and upon your daughters; and ye shall spoil the Egyptians.","But every woman shall borrow of her neighbour, and of her that sojourneth in her house, jewels of silver, and jewels of gold, and raiment: and ye shall put <i>them</i> upon your sons, and upon your daughters; and ye shall spoil the Egyptians.",""
1025,28,0,"And Moses answered and said, But, behold, they will not believe me, nor hearken unto my voice: for they will say, The LORD hath not appeared unto thee.","And Moses answered and said, But, behold, they will not believe me, nor hearken unto my voice: for they will say, The L<font size=""-1"">ORD</font> hath not appeared unto thee.",""
1026,17,0,"And the LORD said unto him, What is that in thine hand? And he said, A rod.","And the L<font size=""-1"">ORD</font> said unto him, What <i>is</i> that in thine hand? And he said, A rod.",""
1027,26,0,"And he said, Cast it on the ground. And he cast it on the ground, and it became a serpent; and Moses fled from before it.","And he said, Cast it on the ground. And he cast it on the ground, and it became a serpent; and Moses fled from before it.",""
1028,33,0,"And the LORD said unto Moses, Put forth thine hand, and take it by the tail. And he put forth his hand, and caught it, and it became a rod in his hand:","And the L<font size=""-1"">ORD</font> said unto Moses, Put forth thine hand, and take it by the tail. And he put forth his hand, and caught it, and it became a rod in his hand:",""
1029,28,0,"That they may believe that the LORD God of their fathers, the God of Abraham, the God of Isaac, and the God of Jacob, hath appeared unto thee.","That they may believe that the L<font size=""-1"">ORD</font> God of their fathers, the God of Abraham, the God of Isaac, and the God of Jacob, hath appeared unto thee.",""
1030,35,1,"And the LORD said furthermore unto him, Put now thine hand into thy bosom. And he put his hand into his bosom: and when he took it out, behold, his hand was leprous as snow.","¶And the L<font size=""-1"">ORD</font> said furthermore unto him, Put now thine hand into thy bosom. And he put his hand into his bosom: and when he took it out, behold, his hand <i>was</i> leprous as snow.",""
1031,36,0,"And he said, Put thine hand into thy bosom again. And he put his hand into his bosom again; and plucked it out of his bosom, and, behold, it was turned again as his other flesh.","And he said, Put thine hand into thy bosom again. And he put his hand into his bosom again; and plucked it out of his bosom, and, behold, it was turned again as his <i>other</i> flesh.",""
1032,31,0,"And it shall come to pass, if they will not believe thee, neither hearken to the voice of the first sign, that they will believe the voice of the latter sign.","And it shall come to pass, if they will not believe thee, neither hearken to the voice of the first sign, that they will believe the voice of the latter sign.",""
1033,54,0,"And it shall come to pass, if they will not believe also these two signs, neither hearken unto thy voice, that thou shalt take of the water of the river, and pour it upon the dry land: and the water which thou takest out of the river shall become blood upon the dry land.","And it shall come to pass, if they will not believe also these two signs, neither hearken unto thy voice, that thou shalt take of the water of the river, and pour <i>it</i> upon the dry <i>land</i>: and the water which thou takest out of the river shall become blood upon the dry <i>land</i>.",""
1034,34,1,"And Moses said unto the LORD, O my Lord, I am not eloquent, neither heretofore, nor since thou hast spoken unto thy servant: but I am slow of speech, and of a slow tongue.","¶And Moses said unto the L<font size=""-1"">ORD</font>, O my Lord, I <i>am</i> not eloquent, neither heretofore, nor since thou hast spoken unto thy servant: but I <i>am</i> slow of speech, and of a slow tongue.",""
1035,29,0,"And the LORD said unto him, Who hath made man's mouth? or who maketh the dumb, or deaf, or the seeing, or the blind? have not I the LORD?","And the L<font size=""-1"">ORD</font> said unto him, Who hath made man's mouth? or who maketh the dumb, or deaf, or the seeing, or the blind? have not I the L<font size=""-1"">ORD</font>?",""
1036,17,0,"Now therefore go, and I will be with thy mouth, and teach thee what thou shalt say.","Now therefore go, and I will be with thy mouth, and teach thee what thou shalt say.",""
1037,19,0,"And he said, O my Lord, send, I pray thee, by the hand of him whom thou wilt send.","And he said, O my Lord, send, I pray thee, by the hand <i>of him whom</i> thou wilt send.",""
