ChpVrsNdx,NumWrd,bPilcrow,PText,RText
4107,32,0,"And the angel of the LORD said unto her, Behold, thou art with child, and shalt bear a son, and shalt call his name Ishmael; because the LORD hath heard thy affliction.","And the angel of the L<font size=""-1"">ORD</font> said unto her, Behold, thou <i>art</i> with child, and shalt bear a son, and shalt call his name Ishmael; because the L<font size=""-1"">ORD</font> hath heard thy affliction."
4108,31,0,"And he will be a wild man; his hand will be against every man, and every man's hand against him; and he shall dwell in the presence of all his brethren.","And he will be a wild man; his hand <i>will be</i> against every man, and every man's hand against him; and he shall dwell in the presence of all his brethren."
4109,29,0,"And she called the name of the LORD that spake unto her, Thou God seest me: for she said, Have I also here looked after him that seeth me?","And she called the name of the L<font size=""-1"">ORD</font> that spake unto her, Thou God seest me: for she said, Have I also here looked after him that seeth me?"
4110,13,0,"Wherefore the well was called Beer-lahai-roi; behold, it is between Kadesh and Bered.","Wherefore the well was called Beer–lahai–roi; behold, <i>it is</i> between Kadesh and Bered."
4111,16,1,"And Hagar bare Abram a son: and Abram called his son's name, which Hagar bare, Ishmael.","¶And Hagar bare Abram a son: and Abram called his son's name, which Hagar bare, Ishmael."
4112,14,0,"And Abram was fourscore and six years old, when Hagar bare Ishmael to Abram.","And Abram <i>was</i> fourscore and six years old, when Hagar bare Ishmael to Abram."
4353,30,0,"And when Abram was ninety years old and nine, the LORD appeared to Abram, and said unto him, I am the Almighty God; walk before me, and be thou perfect.","And when Abram was ninety years old and nine, the L<font size=""-1"">ORD</font> appeared to Abram, and said unto him, I <i>am</i> the Almighty God; walk before me, and be thou perfect."
4354,15,0,"And I will make my covenant between me and thee, and will multiply thee exceedingly.","And I will make my covenant between me and thee, and will multiply thee exceedingly."
4355,12,0,"And Abram fell on his face: and God talked with him, saying,","And Abram fell on his face: and God talked with him, saying,"
4356,18,1,"As for me, behold, my covenant is with thee, and thou shalt be a father of many nations.","¶As for me, behold, my covenant <i>is</i> with thee, and thou shalt be a father of many nations."
4357,25,0,"Neither shall thy name any more be called Abram, but thy name shall be Abraham; for a father of many nations have I made thee.","Neither shall thy name any more be called Abram, but thy name shall be Abraham; for a father of many nations have I made thee."
4358,21,0,"And I will make thee exceeding fruitful, and I will make nations of thee, and kings shall come out of thee.","And I will make thee exceeding fruitful, and I will make nations of thee, and kings shall come out of thee."
4359,34,1,"And I will establish my covenant between me and thee and thy seed after thee in their generations for an everlasting covenant, to be a God unto thee, and to thy seed after thee.","¶And I will establish my covenant between me and thee and thy seed after thee in their generations for an everlasting covenant, to be a God unto thee, and to thy seed after thee."
4360,34,0,"And I will give unto thee, and to thy seed after thee, the land wherein thou art a stranger, all the land of Canaan, for an everlasting possession; and I will be their God.","And I will give unto thee, and to thy seed after thee, the land wherein thou art a stranger, all the land of Canaan, for an everlasting possession; and I will be their God."
4361,20,1,"And God said unto Abraham, Thou shalt keep my covenant therefore, thou, and thy seed after thee in their generations.","¶And God said unto Abraham, Thou shalt keep my covenant therefore, thou, and thy seed after thee in their generations."
4362,25,0,"This is my covenant, which ye shall keep, between me and you and thy seed after thee; Every man child among you shall be circumcised.","This <i>is</i> my covenant, which ye shall keep, between me and you and thy seed after thee; Every man child among you shall be circumcised."
4363,22,0,"And ye shall circumcise the flesh of your foreskin; and it shall be a token of the covenant betwixt me and you.","And ye shall circumcise the flesh of your foreskin; and it shall be a token of the covenant betwixt me and you."
4364,38,0,"And he that is eight days old shall be circumcised among you, every man child in your generations, he that is born in the house, or bought with money of any stranger, which is not of thy seed.","And he that is eight days old shall be circumcised among you, every man child in your generations, he that is born in the house, or bought with money of any stranger, which <i>is</i> not of thy seed."
4365,31,0,"He that is born in thy house, and he that is bought with thy money, must needs be circumcised: and my covenant shall be in your flesh for an everlasting covenant.","He that is born in thy house, and he that is bought with thy money, must needs be circumcised: and my covenant shall be in your flesh for an everlasting covenant."
4366,27,0,"And the uncircumcised man child whose flesh of his foreskin is not circumcised, that soul shall be cut off from his people; he hath broken my covenant.","And the uncircumcised man child whose flesh of his foreskin is not circumcised, that soul shall be cut off from his people; he hath broken my covenant."
4367,23,1,"And God said unto Abraham, As for Sarai thy wife, thou shalt not call her name Sarai, but Sarah shall her name be.","¶And God said unto Abraham, As for Sarai thy wife, thou shalt not call her name Sarai, but Sarah <i>shall</i> her name <i>be</i>."
4368,33,0,"And I will bless her, and give thee a son also of her: yea, I will bless her, and she shall be a mother of nations; kings of people shall be of her.","And I will bless her, and give thee a son also of her: yea, I will bless her, and she shall be <i>a mother</i> of nations; kings of people shall be of her."
4369,35,0,"Then Abraham fell upon his face, and laughed, and said in his heart, Shall a child be born unto him that is an hundred years old? and shall Sarah, that is ninety years old, bear?","Then Abraham fell upon his face, and laughed, and said in his heart, Shall <i>a child</i> be born unto him that is an hundred years old? and shall Sarah, that is ninety years old, bear?"
4370,12,0,"And Abraham said unto God, O that Ishmael might live before thee!","And Abraham said unto God, O that Ishmael might live before thee!"
4371,37,0,"And God said, Sarah thy wife shall bear thee a son indeed; and thou shalt call his name Isaac: and I will establish my covenant with him for an everlasting covenant, and with his seed after him.","And God said, Sarah thy wife shall bear thee a son indeed; and thou shalt call his name Isaac: and I will establish my covenant with him for an everlasting covenant, <i>and</i> with his seed after him."
4372,36,0,"And as for Ishmael, I have heard thee: Behold, I have blessed him, and will make him fruitful, and will multiply him exceedingly; twelve princes shall he beget, and I will make him a great nation.","And as for Ishmael, I have heard thee: Behold, I have blessed him, and will make him fruitful, and will multiply him exceedingly; twelve princes shall he beget, and I will make him a great nation."
4373,22,0,"But my covenant will I establish with Isaac, which Sarah shall bear unto thee at this set time in the next year.","But my covenant will I establish with Isaac, which Sarah shall bear unto thee at this set time in the next year."
4374,13,0,"And he left off talking with him, and God went up from Abraham.","And he left off talking with him, and God went up from Abraham."
4375,47,1,"And Abraham took Ishmael his son, and all that were born in his house, and all that were bought with his money, every male among the men of Abraham's house; and circumcised the flesh of their foreskin in the selfsame day, as God had said unto him.","¶And Abraham took Ishmael his son, and all that were born in his house, and all that were bought with his money, every male among the men of Abraham's house; and circumcised the flesh of their foreskin in the selfsame day, as God had said unto him."
4376,18,0,"And Abraham was ninety years old and nine, when he was circumcised in the flesh of his foreskin.","And Abraham <i>was</i> ninety years old and nine, when he was circumcised in the flesh of his foreskin."
4377,18,0,"And Ishmael his son was thirteen years old, when he was circumcised in the flesh of his foreskin.","And Ishmael his son <i>was</i> thirteen years old, when he was circumcised in the flesh of his foreskin."
4378,11,0,"In the selfsame day was Abraham circumcised, and Ishmael his son.","In the selfsame day was Abraham circumcised, and Ishmael his son."
4379,22,0,"And all the men of his house, born in the house, and bought with money of the stranger, were circumcised with him.","And all the men of his house, born in the house, and bought with money of the stranger, were circumcised with him."
4609,24,0,"And the LORD appeared unto him in the plains of Mamre: and he sat in the tent door in the heat of the day;","And the L<font size=""-1"">ORD</font> appeared unto him in the plains of Mamre: and he sat in the tent door in the heat of the day;"
4610,35,0,"And he lift up his eyes and looked, and, lo, three men stood by him: and when he saw them, he ran to meet them from the tent door, and bowed himself toward the ground,","And he lift up his eyes and looked, and, lo, three men stood by him: and when he saw <i>them</i>, he ran to meet them from the tent door, and bowed himself toward the ground,"
4611,22,0,"And said, My Lord, if now I have found favour in thy sight, pass not away, I pray thee, from thy servant:","And said, My Lord, if now I have found favour in thy sight, pass not away, I pray thee, from thy servant:"
4612,19,0,"Let a little water, I pray you, be fetched, and wash your feet, and rest yourselves under the tree:","Let a little water, I pray you, be fetched, and wash your feet, and rest yourselves under the tree:"
4613,36,0,"And I will fetch a morsel of bread, and comfort ye your hearts; after that ye shall pass on: for therefore are ye come to your servant. And they said, So do, as thou hast said.","And I will fetch a morsel of bread, and comfort ye your hearts; after that ye shall pass on: for therefore are ye come to your servant. And they said, So do, as thou hast said."
4614,26,0,"And Abraham hastened into the tent unto Sarah, and said, Make ready quickly three measures of fine meal, knead it, and make cakes upon the hearth.","And Abraham hastened into the tent unto Sarah, and said, Make ready quickly three measures of fine meal, knead <i>it</i>, and make cakes upon the hearth."
4615,26,0,"And Abraham ran unto the herd, and fetcht a calf tender and good, and gave it unto a young man; and he hasted to dress it.","And Abraham ran unto the herd, and fetcht a calf tender and good, and gave <i>it</i> unto a young man; and he hasted to dress it."
4616,30,0,"And he took butter, and milk, and the calf which he had dressed, and set it before them; and he stood by them under the tree, and they did eat.","And he took butter, and milk, and the calf which he had dressed, and set <i>it</i> before them; and he stood by them under the tree, and they did eat."
4617,17,1,"And they said unto him, Where is Sarah thy wife? And he said, Behold, in the tent.","¶And they said unto him, Where <i>is</i> Sarah thy wife? And he said, Behold, in the tent."
4618,36,0,"And he said, I will certainly return unto thee according to the time of life; and, lo, Sarah thy wife shall have a son. And Sarah heard it in the tent door, which was behind him.","And he said, I will certainly return unto thee according to the time of life; and, lo, Sarah thy wife shall have a son. And Sarah heard <i>it</i> in the tent door, which <i>was</i> behind him."
4619,23,0,"Now Abraham and Sarah were old and well stricken in age; and it ceased to be with Sarah after the manner of women.","Now Abraham and Sarah <i>were</i> old <i>and</i> well stricken in age; <i>and</i> it ceased to be with Sarah after the manner of women."
4620,20,0,"Therefore Sarah laughed within herself, saying, After I am waxed old shall I have pleasure, my lord being old also?","Therefore Sarah laughed within herself, saying, After I am waxed old shall I have pleasure, my lord being old also?"
4621,22,0,"And the LORD said unto Abraham, Wherefore did Sarah laugh, saying, Shall I of a surety bear a child, which am old?","And the L<font size=""-1"">ORD</font> said unto Abraham, Wherefore did Sarah laugh, saying, Shall I of a surety bear a child, which am old?"
4622,29,0,"Is any thing too hard for the LORD? At the time appointed I will return unto thee, according to the time of life, and Sarah shall have a son.","Is any thing too hard for the L<font size=""-1"">ORD</font>? At the time appointed I will return unto thee, according to the time of life, and Sarah shall have a son."
4623,19,0,"Then Sarah denied, saying, I laughed not; for she was afraid. And he said, Nay; but thou didst laugh.","Then Sarah denied, saying, I laughed not; for she was afraid. And he said, Nay; but thou didst laugh."
4624,22,1,"And the men rose up from thence, and looked toward Sodom: and Abraham went with them to bring them on the way.","¶And the men rose up from thence, and looked toward Sodom: and Abraham went with them to bring them on the way."
4625,14,0,"And the LORD said, Shall I hide from Abraham that thing which I do;","And the L<font size=""-1"">ORD</font> said, Shall I hide from Abraham that thing which I do;"
4626,23,0,"Seeing that Abraham shall surely become a great and mighty nation, and all the nations of the earth shall be blessed in him?","Seeing that Abraham shall surely become a great and mighty nation, and all the nations of the earth shall be blessed in him?"
4627,43,0,"For I know him, that he will command his children and his household after him, and they shall keep the way of the LORD, to do justice and judgment; that the LORD may bring upon Abraham that which he hath spoken of him.","For I know him, that he will command his children and his household after him, and they shall keep the way of the L<font size=""-1"">ORD</font>, to do justice and judgment; that the L<font size=""-1"">ORD</font> may bring upon Abraham that which he hath spoken of him."
4628,20,0,"And the LORD said, Because the cry of Sodom and Gomorrah is great, and because their sin is very grievous;","And the L<font size=""-1"">ORD</font> said, Because the cry of Sodom and Gomorrah is great, and because their sin is very grievous;"
4629,29,0,"I will go down now, and see whether they have done altogether according to the cry of it, which is come unto me; and if not, I will know.","I will go down now, and see whether they have done altogether according to the cry of it, which is come unto me; and if not, I will know."
4630,19,0,"And the men turned their faces from thence, and went toward Sodom: but Abraham stood yet before the LORD.","And the men turned their faces from thence, and went toward Sodom: but Abraham stood yet before the L<font size=""-1"">ORD</font>."
4631,15,1,"And Abraham drew near, and said, Wilt thou also destroy the righteous with the wicked?","¶And Abraham drew near, and said, Wilt thou also destroy the righteous with the wicked?"
4632,24,0,"Peradventure there be fifty righteous within the city: wilt thou also destroy and not spare the place for the fifty righteous that are therein?","Peradventure there be fifty righteous within the city: wilt thou also destroy and not spare the place for the fifty righteous that <i>are</i> therein?"
4633,41,0,"That be far from thee to do after this manner, to slay the righteous with the wicked: and that the righteous should be as the wicked, that be far from thee: Shall not the Judge of all the earth do right?","That be far from thee to do after this manner, to slay the righteous with the wicked: and that the righteous should be as the wicked, that be far from thee: Shall not the Judge of all the earth do right?"
4634,24,0,"And the LORD said, If I find in Sodom fifty righteous within the city, then I will spare all the place for their sakes.","And the L<font size=""-1"">ORD</font> said, If I find in Sodom fifty righteous within the city, then I will spare all the place for their sakes."
4635,23,0,"And Abraham answered and said, Behold now, I have taken upon me to speak unto the Lord, which am but dust and ashes:","And Abraham answered and said, Behold now, I have taken upon me to speak unto the Lord, which <i>am but</i> dust and ashes:"
4636,34,0,"Peradventure there shall lack five of the fifty righteous: wilt thou destroy all the city for lack of five? And he said, If I find there forty and five, I will not destroy it.","Peradventure there shall lack five of the fifty righteous: wilt thou destroy all the city for <i>lack of</i> five? And he said, If I find there forty and five, I will not destroy <i>it</i>."
4637,27,0,"And he spake unto him yet again, and said, Peradventure there shall be forty found there. And he said, I will not do it for forty's sake.","And he spake unto him yet again, and said, Peradventure there shall be forty found there. And he said, I will not do <i>it</i> for forty's sake."
4638,36,0,"And he said unto him, Oh let not the Lord be angry, and I will speak: Peradventure there shall thirty be found there. And he said, I will not do it, if I find thirty there.","And he said <i>unto him</i>, Oh let not the Lord be angry, and I will speak: Peradventure there shall thirty be found there. And he said, I will not do <i>it</i>, if I find thirty there."
4639,33,0,"And he said, Behold now, I have taken upon me to speak unto the Lord: Peradventure there shall be twenty found there. And he said, I will not destroy it for twenty's sake.","And he said, Behold now, I have taken upon me to speak unto the Lord: Peradventure there shall be twenty found there. And he said, I will not destroy <i>it</i> for twenty's sake."
4640,35,0,"And he said, Oh let not the Lord be angry, and I will speak yet but this once: Peradventure ten shall be found there. And he said, I will not destroy it for ten's sake.","And he said, Oh let not the Lord be angry, and I will speak yet but this once: Peradventure ten shall be found there. And he said, I will not destroy <i>it</i> for ten's sake."
4641,21,0,"And the LORD went his way, as soon as he had left communing with Abraham: and Abraham returned unto his place.","And the L<font size=""-1"">ORD</font> went his way, as soon as he had left communing with Abraham: and Abraham returned unto his place."
4865,36,0,"And there came two angels to Sodom at even; and Lot sat in the gate of Sodom: and Lot seeing them rose up to meet them; and he bowed himself with his face toward the ground;","And there came two angels to Sodom at even; and Lot sat in the gate of Sodom: and Lot seeing <i>them</i> rose up to meet them; and he bowed himself with his face toward the ground;"
4866,48,0,"And he said, Behold now, my lords, turn in, I pray you, into your servant's house, and tarry all night, and wash your feet, and ye shall rise up early, and go on your ways. And they said, Nay; but we will abide in the street all night.","And he said, Behold now, my lords, turn in, I pray you, into your servant's house, and tarry all night, and wash your feet, and ye shall rise up early, and go on your ways. And they said, Nay; but we will abide in the street all night."
4867,32,0,"And he pressed upon them greatly; and they turned in unto him, and entered into his house; and he made them a feast, and did bake unleavened bread, and they did eat.","And he pressed upon them greatly; and they turned in unto him, and entered into his house; and he made them a feast, and did bake unleavened bread, and they did eat."
4868,29,1,"But before they lay down, the men of the city, even the men of Sodom, compassed the house round, both old and young, all the people from every quarter:","¶But before they lay down, the men of the city, <i>even</i> the men of Sodom, compassed the house round, both old and young, all the people from every quarter:"
4869,30,0,"And they called unto Lot, and said unto him, Where are the men which came in to thee this night? bring them out unto us, that we may know them.","And they called unto Lot, and said unto him, Where <i>are</i> the men which came in to thee this night? bring them out unto us, that we may know them."
4870,15,0,"And Lot went out at the door unto them, and shut the door after him,","And Lot went out at the door unto them, and shut the door after him,"
4871,10,0,"And said, I pray you, brethren, do not so wickedly.","And said, I pray you, brethren, do not so wickedly."
4872,48,0,"Behold now, I have two daughters which have not known man; let me, I pray you, bring them out unto you, and do ye to them as is good in your eyes: only unto these men do nothing; for therefore came they under the shadow of my roof.","Behold now, I have two daughters which have not known man; let me, I pray you, bring them out unto you, and do ye to them as <i>is</i> good in your eyes: only unto these men do nothing; for therefore came they under the shadow of my roof."
4873,49,0,"And they said, Stand back. And they said again, This one fellow came in to sojourn, and he will needs be a judge: now will we deal worse with thee, than with them. And they pressed sore upon the man, even Lot, and came near to break the door.","And they said, Stand back. And they said <i>again</i>, This one <i>fellow</i> came in to sojourn, and he will needs be a judge: now will we deal worse with thee, than with them. And they pressed sore upon the man, <i>even</i> Lot, and came near to break the door."
4874,20,0,"But the men put forth their hand, and pulled Lot into the house to them, and shut to the door.","But the men put forth their hand, and pulled Lot into the house to them, and shut to the door."
4875,28,0,"And they smote the men that were at the door of the house with blindness, both small and great: so that they wearied themselves to find the door.","And they smote the men that <i>were</i> at the door of the house with blindness, both small and great: so that they wearied themselves to find the door."
4876,33,1,"And the men said unto Lot, Hast thou here any besides? son in law, and thy sons, and thy daughters, and whatsoever thou hast in the city, bring them out of this place:","¶And the men said unto Lot, Hast thou here any besides? son in law, and thy sons, and thy daughters, and whatsoever thou hast in the city, bring <i>them</i> out of this place:"
4877,29,0,"For we will destroy this place, because the cry of them is waxen great before the face of the LORD; and the LORD hath sent us to destroy it.","For we will destroy this place, because the cry of them is waxen great before the face of the L<font size=""-1"">ORD</font>; and the L<font size=""-1"">ORD</font> hath sent us to destroy it."
4878,43,0,"And Lot went out, and spake unto his sons in law, which married his daughters, and said, Up, get you out of this place; for the LORD will destroy this city. But he seemed as one that mocked unto his sons in law.","And Lot went out, and spake unto his sons in law, which married his daughters, and said, Up, get you out of this place; for the L<font size=""-1"">ORD</font> will destroy this city. But he seemed as one that mocked unto his sons in law."
4879,32,1,"And when the morning arose, then the angels hastened Lot, saying, Arise, take thy wife, and thy two daughters, which are here; lest thou be consumed in the iniquity of the city.","¶And when the morning arose, then the angels hastened Lot, saying, Arise, take thy wife, and thy two daughters, which are here; lest thou be consumed in the iniquity of the city."
4880,43,0,"And while he lingered, the men laid hold upon his hand, and upon the hand of his wife, and upon the hand of his two daughters; the LORD being merciful unto him: and they brought him forth, and set him without the city.","And while he lingered, the men laid hold upon his hand, and upon the hand of his wife, and upon the hand of his two daughters; the L<font size=""-1"">ORD</font> being merciful unto him: and they brought him forth, and set him without the city."
4881,38,1,"And it came to pass, when they had brought them forth abroad, that he said, Escape for thy life; look not behind thee, neither stay thou in all the plain; escape to the mountain, lest thou be consumed.","¶And it came to pass, when they had brought them forth abroad, that he said, Escape for thy life; look not behind thee, neither stay thou in all the plain; escape to the mountain, lest thou be consumed."
4882,10,0,"And Lot said unto them, Oh, not so, my Lord:","And Lot said unto them, Oh, not so, my Lord:"
4883,41,0,"Behold now, thy servant hath found grace in thy sight, and thou hast magnified thy mercy, which thou hast shewed unto me in saving my life; and I cannot escape to the mountain, lest some evil take me, and I die:","Behold now, thy servant hath found grace in thy sight, and thou hast magnified thy mercy, which thou hast shewed unto me in saving my life; and I cannot escape to the mountain, lest some evil take me, and I die:"
4884,31,0,"Behold now, this city is near to flee unto, and it is a little one: Oh, let me escape thither, (is it not a little one?) and my soul shall live.","Behold now, this city <i>is</i> near to flee unto, and it <i>is</i> a little one: Oh, let me escape thither, (<i>is</i> it not a little one?) and my soul shall live."
