ChpVrsNdx,NumWrd,bPilcrow,PText,RText,Footnote
6686,20,0,"These are the sons of Gilead: of Jeezer, the family of the Jeezerites: of Helek, the family of the Helekites:","These <i>are</i> the sons of Gilead: <i>of</i> Jeezer, the family of the Jeezerites: of Helek, the family of the Helekites:",""
6687,16,0,"And of Asriel, the family of the Asrielites: and of Shechem, the family of the Shechemites:","And <i>of</i> Asriel, the family of the Asrielites: and <i>of</i> Shechem, the family of the Shechemites:",""
6688,16,0,"And of Shemida, the family of the Shemidaites: and of Hepher, the family of the Hepherites.","And <i>of</i> Shemida, the family of the Shemidaites: and <i>of</i> Hepher, the family of the Hepherites.",""
6689,27,1,"And Zelophehad the son of Hepher had no sons, but daughters: and the names of the daughters of Zelophehad were Mahlah, and Noah, Hoglah, Milcah, and Tirzah.","¶And Zelophehad the son of Hepher had no sons, but daughters: and the names of the daughters of Zelophehad <i>were</i> Mahlah, and Noah, Hoglah, Milcah, and Tirzah.",""
6690,20,0,"These are the families of Manasseh, and those that were numbered of them, fifty and two thousand and seven hundred.","These <i>are</i> the families of Manasseh, and those that were numbered of them, fifty and two thousand and seven hundred.",""
6691,30,1,"These are the sons of Ephraim after their families: of Shuthelah, the family of the Shuthalhites: of Becher, the family of the Bachrites: of Tahan, the family of the Tahanites.","¶These <i>are</i> the sons of Ephraim after their families: of Shuthelah, the family of the Shuthalhites: of Becher, the family of the Bachrites: of Tahan, the family of the Tahanites.",""
6692,14,0,"And these are the sons of Shuthelah: of Eran, the family of the Eranites.","And these <i>are</i> the sons of Shuthelah: of Eran, the family of the Eranites.",""
6693,33,0,"These are the families of the sons of Ephraim according to those that were numbered of them, thirty and two thousand and five hundred. These are the sons of Joseph after their families.","These <i>are</i> the families of the sons of Ephraim according to those that were numbered of them, thirty and two thousand and five hundred. These <i>are</i> the sons of Joseph after their families.",""
6694,28,1,"The sons of Benjamin after their families: of Bela, the family of the Belaites: of Ashbel, the family of the Ashbelites: of Ahiram, the family of the Ahiramites:","¶The sons of Benjamin after their families: of Bela, the family of the Belaites: of Ashbel, the family of the Ashbelites: of Ahiram, the family of the Ahiramites:",""
6695,14,0,"Of Shupham, the family of the Shuphamites: of Hupham, the family of the Huphamites.","Of Shupham, the family of the Shuphamites: of Hupham, the family of the Huphamites.",""
6696,24,0,"And the sons of Bela were Ard and Naaman: of Ard, the family of the Ardites: and of Naaman, the family of the Naamites.","And the sons of Bela were Ard and Naaman: <i>of Ard</i>, the family of the Ardites: <i>and</i> of Naaman, the family of the Naamites.",""
6697,24,0,"These are the sons of Benjamin after their families: and they that were numbered of them were forty and five thousand and six hundred.","These <i>are</i> the sons of Benjamin after their families: and they that were numbered of them <i>were</i> forty and five thousand and six hundred.",""
6698,25,1,"These are the sons of Dan after their families: of Shuham, the family of the Shuhamites. These are the families of Dan after their families.","¶These <i>are</i> the sons of Dan after their families: of Shuham, the family of the Shuhamites. These <i>are</i> the families of Dan after their families.",""
6699,22,0,"All the families of the Shuhamites, according to those that were numbered of them, were threescore and four thousand and four hundred.","All the families of the Shuhamites, according to those that were numbered of them, <i>were</i> threescore and four thousand and four hundred.",""
6700,29,1,"Of the children of Asher after their families: of Jimna, the family of the Jimnites: of Jesui, the family of the Jesuites: of Beriah, the family of the Beriites.","¶<i>Of</i> the children of Asher after their families: of Jimna, the family of the Jimnites: of Jesui, the family of the Jesuites: of Beriah, the family of the Beriites.",""
6701,19,0,"Of the sons of Beriah: of Heber, the family of the Heberites: of Malchiel, the family of the Malchielites.","Of the sons of Beriah: of Heber, the family of the Heberites: of Malchiel, the family of the Malchielites.",""
6702,10,0,"And the name of the daughter of Asher was Sarah.","And the name of the daughter of Asher <i>was</i> Sarah.",""
6703,26,0,"These are the families of the sons of Asher according to those that were numbered of them; who were fifty and three thousand and four hundred.","These <i>are</i> the families of the sons of Asher according to those that were numbered of them; <i>who were</i> fifty and three thousand and four hundred.",""
6704,22,1,"Of the sons of Naphtali after their families: of Jahzeel, the family of the Jahzeelites: of Guni, the family of the Gunites:","¶<i>Of</i> the sons of Naphtali after their families: of Jahzeel, the family of the Jahzeelites: of Guni, the family of the Gunites:",""
6705,14,0,"Of Jezer, the family of the Jezerites: of Shillem, the family of the Shillemites.","Of Jezer, the family of the Jezerites: of Shillem, the family of the Shillemites.",""
6706,25,0,"These are the families of Naphtali according to their families: and they that were numbered of them were forty and five thousand and four hundred.","These <i>are</i> the families of Naphtali according to their families: and they that were numbered of them <i>were</i> forty and five thousand and four hundred.",""
6707,19,0,"These were the numbered of the children of Israel, six hundred thousand and a thousand seven hundred and thirty.","These <i>were</i> the numbered of the children of Israel, six hundred thousand and a thousand seven hundred and thirty.",""
6708,7,1,"And the LORD spake unto Moses, saying,","¶And the L<font size=""-1"">ORD</font> spake unto Moses, saying,",""
6709,16,0,"Unto these the land shall be divided for an inheritance according to the number of names.","Unto these the land shall be divided for an inheritance according to the number of names.",""
6710,33,0,"To many thou shalt give the more inheritance, and to few thou shalt give the less inheritance: to every one shall his inheritance be given according to those that were numbered of him.","To many thou shalt give the more inheritance, and to few thou shalt give the less inheritance: to every one shall his inheritance be given according to those that were numbered of him.",""
6711,21,0,"Notwithstanding the land shall be divided by lot: according to the names of the tribes of their fathers they shall inherit.","Notwithstanding the land shall be divided by lot: according to the names of the tribes of their fathers they shall inherit.",""
6712,14,0,"According to the lot shall the possession thereof be divided between many and few.","According to the lot shall the possession thereof be divided between many and few.",""
6713,34,1,"And these are they that were numbered of the Levites after their families: of Gershon, the family of the Gershonites: of Kohath, the family of the Kohathites: of Merari, the family of the Merarites.","¶And these <i>are</i> they that were numbered of the Levites after their families: of Gershon, the family of the Gershonites: of Kohath, the family of the Kohathites: of Merari, the family of the Merarites.",""
6714,36,0,"These are the families of the Levites: the family of the Libnites, the family of the Hebronites, the family of the Mahlites, the family of the Mushites, the family of the Korathites. And Kohath begat Amram.","These <i>are</i> the families of the Levites: the family of the Libnites, the family of the Hebronites, the family of the Mahlites, the family of the Mushites, the family of the Korathites. And Kohath begat Amram.",""
6715,32,0,"And the name of Amram's wife was Jochebed, the daughter of Levi, whom her mother bare to Levi in Egypt: and she bare unto Amram Aaron and Moses, and Miriam their sister.","And the name of Amram's wife <i>was</i> Jochebed, the daughter of Levi, whom <i>her mother</i> bare to Levi in Egypt: and she bare unto Amram Aaron and Moses, and Miriam their sister.",""
6716,11,0,"And unto Aaron was born Nadab, and Abihu, Eleazar, and Ithamar.","And unto Aaron was born Nadab, and Abihu, Eleazar, and Ithamar.",""
6717,13,0,"And Nadab and Abihu died, when they offered strange fire before the LORD.","And Nadab and Abihu died, when they offered strange fire before the L<font size=""-1"">ORD</font>.",""
6718,42,0,"And those that were numbered of them were twenty and three thousand, all males from a month old and upward: for they were not numbered among the children of Israel, because there was no inheritance given them among the children of Israel.","And those that were numbered of them were twenty and three thousand, all males from a month old and upward: for they were not numbered among the children of Israel, because there was no inheritance given them among the children of Israel.",""
6719,27,1,"These are they that were numbered by Moses and Eleazar the priest, who numbered the children of Israel in the plains of Moab by Jordan near Jericho.","¶These <i>are</i> they that were numbered by Moses and Eleazar the priest, who numbered the children of Israel in the plains of Moab by Jordan <i>near</i> Jericho.",""
6720,29,0,"But among these there was not a man of them whom Moses and Aaron the priest numbered, when they numbered the children of Israel in the wilderness of Sinai.","But among these there was not a man of them whom Moses and Aaron the priest numbered, when they numbered the children of Israel in the wilderness of Sinai.",""
6721,35,0,"For the LORD had said of them, They shall surely die in the wilderness. And there was not left a man of them, save Caleb the son of Jephunneh, and Joshua the son of Nun.","For the L<font size=""-1"">ORD</font> had said of them, They shall surely die in the wilderness. And there was not left a man of them, save Caleb the son of Jephunneh, and Joshua the son of Nun.",""
6913,47,0,"Then came the daughters of Zelophehad, the son of Hepher, the son of Gilead, the son of Machir, the son of Manasseh, of the families of Manasseh the son of Joseph: and these are the names of his daughters; Mahlah, Noah, and Hoglah, and Milcah, and Tirzah.","Then came the daughters of Zelophehad, the son of Hepher, the son of Gilead, the son of Machir, the son of Manasseh, of the families of Manasseh the son of Joseph: and these <i>are</i> the names of his daughters; Mahlah, Noah, and Hoglah, and Milcah, and Tirzah.",""
6914,28,0,"And they stood before Moses, and before Eleazar the priest, and before the princes and all the congregation, by the door of the tabernacle of the congregation, saying,","And they stood before Moses, and before Eleazar the priest, and before the princes and all the congregation, <i>by</i> the door of the tabernacle of the congregation, saying,",""
6915,37,0,"Our father died in the wilderness, and he was not in the company of them that gathered themselves together against the LORD in the company of Korah; but died in his own sin, and had no sons.","Our father died in the wilderness, and he was not in the company of them that gathered themselves together against the L<font size=""-1"">ORD</font> in the company of Korah; but died in his own sin, and had no sons.",""
6916,31,0,"Why should the name of our father be done away from among his family, because he hath no son? Give unto us therefore a possession among the brethren of our father.","Why should the name of our father be done away from among his family, because he hath no son? Give unto us <i>therefore</i> a possession among the brethren of our father.",""
6917,8,0,"And Moses brought their cause before the LORD.","And Moses brought their cause before the L<font size=""-1"">ORD</font>.",""
6918,7,1,"And the LORD spake unto Moses, saying,","¶And the L<font size=""-1"">ORD</font> spake unto Moses, saying,",""
6919,33,0,"The daughters of Zelophehad speak right: thou shalt surely give them a possession of an inheritance among their father's brethren; and thou shalt cause the inheritance of their father to pass unto them.","The daughters of Zelophehad speak right: thou shalt surely give them a possession of an inheritance among their father's brethren; and thou shalt cause the inheritance of their father to pass unto them.",""
6920,29,0,"And thou shalt speak unto the children of Israel, saying, If a man die, and have no son, then ye shall cause his inheritance to pass unto his daughter.","And thou shalt speak unto the children of Israel, saying, If a man die, and have no son, then ye shall cause his inheritance to pass unto his daughter.",""
6921,15,0,"And if he have no daughter, then ye shall give his inheritance unto his brethren.","And if he have no daughter, then ye shall give his inheritance unto his brethren.",""
6922,16,0,"And if he have no brethren, then ye shall give his inheritance unto his father's brethren.","And if he have no brethren, then ye shall give his inheritance unto his father's brethren.",""
6923,47,0,"And if his father have no brethren, then ye shall give his inheritance unto his kinsman that is next to him of his family, and he shall possess it: and it shall be unto the children of Israel a statute of judgment, as the LORD commanded Moses.","And if his father have no brethren, then ye shall give his inheritance unto his kinsman that is next to him of his family, and he shall possess it: and it shall be unto the children of Israel a statute of judgment, as the L<font size=""-1"">ORD</font> commanded Moses.",""
6924,26,1,"And the LORD said unto Moses, Get thee up into this mount Abarim, and see the land which I have given unto the children of Israel.","¶And the L<font size=""-1"">ORD</font> said unto Moses, Get thee up into this mount Abarim, and see the land which I have given unto the children of Israel.",""
6925,20,0,"And when thou hast seen it, thou also shalt be gathered unto thy people, as Aaron thy brother was gathered.","And when thou hast seen it, thou also shalt be gathered unto thy people, as Aaron thy brother was gathered.",""
6926,39,0,"For ye rebelled against my commandment in the desert of Zin, in the strife of the congregation, to sanctify me at the water before their eyes: that is the water of Meribah in Kadesh in the wilderness of Zin.","For ye rebelled against my commandment in the desert of Zin, in the strife of the congregation, to sanctify me at the water before their eyes: that <i>is</i> the water of Meribah in Kadesh in the wilderness of Zin.",""
6927,7,1,"And Moses spake unto the LORD, saying,","¶And Moses spake unto the L<font size=""-1"">ORD</font>, saying,",""
6928,17,0,"Let the LORD, the God of the spirits of all flesh, set a man over the congregation,","Let the L<font size=""-1"">ORD</font>, the God of the spirits of all flesh, set a man over the congregation,",""
6929,39,0,"Which may go out before them, and which may go in before them, and which may lead them out, and which may bring them in; that the congregation of the LORD be not as sheep which have no shepherd.","Which may go out before them, and which may go in before them, and which may lead them out, and which may bring them in; that the congregation of the L<font size=""-1"">ORD</font> be not as sheep which have no shepherd.",""
6930,26,1,"And the LORD said unto Moses, Take thee Joshua the son of Nun, a man in whom is the spirit, and lay thine hand upon him;","¶And the L<font size=""-1"">ORD</font> said unto Moses, Take thee Joshua the son of Nun, a man in whom <i>is</i> the spirit, and lay thine hand upon him;",""
6931,20,0,"And set him before Eleazar the priest, and before all the congregation; and give him a charge in their sight.","And set him before Eleazar the priest, and before all the congregation; and give him a charge in their sight.",""
6932,22,0,"And thou shalt put some of thine honour upon him, that all the congregation of the children of Israel may be obedient.","And thou shalt put <i>some</i> of thine honour upon him, that all the congregation of the children of Israel may be obedient.",""
6933,51,0,"And he shall stand before Eleazar the priest, who shall ask counsel for him after the judgment of Urim before the LORD: at his word shall they go out, and at his word they shall come in, both he, and all the children of Israel with him, even all the congregation.","And he shall stand before Eleazar the priest, who shall ask <i>counsel</i> for him after the judgment of Urim before the L<font size=""-1"">ORD</font>: at his word shall they go out, and at his word they shall come in, <i>both</i> he, and all the children of Israel with him, even all the congregation.",""
6934,24,0,"And Moses did as the LORD commanded him: and he took Joshua, and set him before Eleazar the priest, and before all the congregation:","And Moses did as the L<font size=""-1"">ORD</font> commanded him: and he took Joshua, and set him before Eleazar the priest, and before all the congregation:",""
6935,21,0,"And he laid his hands upon him, and gave him a charge, as the LORD commanded by the hand of Moses.","And he laid his hands upon him, and gave him a charge, as the L<font size=""-1"">ORD</font> commanded by the hand of Moses.",""
7169,7,0,"And the LORD spake unto Moses, saying,","And the L<font size=""-1"">ORD</font> spake unto Moses, saying,",""
7170,37,0,"Command the children of Israel, and say unto them, My offering, and my bread for my sacrifices made by fire, for a sweet savour unto me, shall ye observe to offer unto me in their due season.","Command the children of Israel, and say unto them, My offering, <i>and</i> my bread for my sacrifices made by fire, <i>for</i> a sweet savour unto me, shall ye observe to offer unto me in their due season.",""
7171,36,0,"And thou shalt say unto them, This is the offering made by fire which ye shall offer unto the LORD; two lambs of the first year without spot day by day, for a continual burnt offering.","And thou shalt say unto them, This <i>is</i> the offering made by fire which ye shall offer unto the L<font size=""-1"">ORD</font>; two lambs of the first year without spot day by day, <i>for</i> a continual burnt offering.",""
7172,18,0,"The one lamb shalt thou offer in the morning, and the other lamb shalt thou offer at even;","The one lamb shalt thou offer in the morning, and the other lamb shalt thou offer at even;",""
7173,24,0,"And a tenth part of an ephah of flour for a meat offering, mingled with the fourth part of an hin of beaten oil.","And a tenth <i>part</i> of an ephah of flour for a meat offering, mingled with the fourth <i>part</i> of an hin of beaten oil.",""
7174,24,0,"It is a continual burnt offering, which was ordained in mount Sinai for a sweet savour, a sacrifice made by fire unto the LORD.","<i>It is</i> a continual burnt offering, which was ordained in mount Sinai for a sweet savour, a sacrifice made by fire unto the L<font size=""-1"">ORD</font>.",""
7175,37,0,"And the drink offering thereof shall be the fourth part of an hin for the one lamb: in the holy place shalt thou cause the strong wine to be poured unto the LORD for a drink offering.","And the drink offering thereof <i>shall be</i> the fourth <i>part</i> of an hin for the one lamb: in the holy <i>place</i> shalt thou cause the strong wine to be poured unto the L<font size=""-1"">ORD</font> <i>for</i> a drink offering.",""
7176,38,0,"And the other lamb shalt thou offer at even: as the meat offering of the morning, and as the drink offering thereof, thou shalt offer it, a sacrifice made by fire, of a sweet savour unto the LORD.","And the other lamb shalt thou offer at even: as the meat offering of the morning, and as the drink offering thereof, thou shalt offer <i>it</i>, a sacrifice made by fire, of a sweet savour unto the L<font size=""-1"">ORD</font>.",""
7177,31,1,"And on the sabbath day two lambs of the first year without spot, and two tenth deals of flour for a meat offering, mingled with oil, and the drink offering thereof:","¶And on the sabbath day two lambs of the first year without spot, and two tenth deals of flour <i>for</i> a meat offering, mingled with oil, and the drink offering thereof:",""
7178,17,0,"This is the burnt offering of every sabbath, beside the continual burnt offering, and his drink offering.","<i>This is</i> the burnt offering of every sabbath, beside the continual burnt offering, and his drink offering.",""
7179,30,1,"And in the beginnings of your months ye shall offer a burnt offering unto the LORD; two young bullocks, and one ram, seven lambs of the first year without spot;","¶And in the beginnings of your months ye shall offer a burnt offering unto the L<font size=""-1"">ORD</font>; two young bullocks, and one ram, seven lambs of the first year without spot;",""
7180,32,0,"And three tenth deals of flour for a meat offering, mingled with oil, for one bullock; and two tenth deals of flour for a meat offering, mingled with oil, for one ram;","And three tenth deals of flour <i>for</i> a meat offering, mingled with oil, for one bullock; and two tenth deals of flour <i>for</i> a meat offering, mingled with oil, for one ram;",""
7181,33,0,"And a several tenth deal of flour mingled with oil for a meat offering unto one lamb; for a burnt offering of a sweet savour, a sacrifice made by fire unto the LORD.","And a several tenth deal of flour mingled with oil <i>for</i> a meat offering unto one lamb; <i>for</i> a burnt offering of a sweet savour, a sacrifice made by fire unto the L<font size=""-1"">ORD</font>.",""
7182,48,0,"And their drink offerings shall be half an hin of wine unto a bullock, and the third part of an hin unto a ram, and a fourth part of an hin unto a lamb: this is the burnt offering of every month throughout the months of the year.","And their drink offerings shall be half an hin of wine unto a bullock, and the third <i>part</i> of an hin unto a ram, and a fourth <i>part</i> of an hin unto a lamb: this <i>is</i> the burnt offering of every month throughout the months of the year.",""
7183,25,0,"And one kid of the goats for a sin offering unto the LORD shall be offered, beside the continual burnt offering, and his drink offering.","And one kid of the goats for a sin offering unto the L<font size=""-1"">ORD</font> shall be offered, beside the continual burnt offering, and his drink offering.",""
7184,15,1,"And in the fourteenth day of the first month is the passover of the LORD.","¶And in the fourteenth day of the first month <i>is</i> the passover of the L<font size=""-1"">ORD</font>.",""
7185,18,0,"And in the fifteenth day of this month is the feast: seven days shall unleavened bread be eaten.","And in the fifteenth day of this month <i>is</i> the feast: seven days shall unleavened bread be eaten.",""
7186,18,0,"In the first day shall be an holy convocation; ye shall do no manner of servile work therein:","In the first day <i>shall be</i> an holy convocation; ye shall do no manner of servile work <i>therein</i>:",""
7187,36,0,"But ye shall offer a sacrifice made by fire for a burnt offering unto the LORD; two young bullocks, and one ram, and seven lambs of the first year: they shall be unto you without blemish:","But ye shall offer a sacrifice made by fire <i>for</i> a burnt offering unto the L<font size=""-1"">ORD</font>; two young bullocks, and one ram, and seven lambs of the first year: they shall be unto you without blemish:",""
7188,27,0,"And their meat offering shall be of flour mingled with oil: three tenth deals shall ye offer for a bullock, and two tenth deals for a ram;","And their meat offering <i>shall be of</i> flour mingled with oil: three tenth deals shall ye offer for a bullock, and two tenth deals for a ram;",""
7189,14,0,"A several tenth deal shalt thou offer for every lamb, throughout the seven lambs:","A several tenth deal shalt thou offer for every lamb, throughout the seven lambs:",""
7190,13,0,"And one goat for a sin offering, to make an atonement for you.","And one goat <i>for</i> a sin offering, to make an atonement for you.",""
7191,18,0,"Ye shall offer these beside the burnt offering in the morning, which is for a continual burnt offering.","Ye shall offer these beside the burnt offering in the morning, which <i>is</i> for a continual burnt offering.",""
7192,39,0,"After this manner ye shall offer daily, throughout the seven days, the meat of the sacrifice made by fire, of a sweet savour unto the LORD: it shall be offered beside the continual burnt offering, and his drink offering.","After this manner ye shall offer daily, throughout the seven days, the meat of the sacrifice made by fire, of a sweet savour unto the L<font size=""-1"">ORD</font>: it shall be offered beside the continual burnt offering, and his drink offering.",""
7193,17,0,"And on the seventh day ye shall have an holy convocation; ye shall do no servile work.","And on the seventh day ye shall have an holy convocation; ye shall do no servile work.",""
7194,34,1,"Also in the day of the firstfruits, when ye bring a new meat offering unto the LORD, after your weeks be out, ye shall have an holy convocation; ye shall do no servile work:","¶Also in the day of the firstfruits, when ye bring a new meat offering unto the L<font size=""-1"">ORD</font>, after your weeks <i>be out</i>, ye shall have an holy convocation; ye shall do no servile work:",""
