ChpVrsNdx,NumWrd,bPilcrow,PText,RText,Footnote
257,40,0,"And the LORD spake unto Moses in the wilderness of Sinai, in the tabernacle of the congregation, on the first day of the second month, in the second year after they were come out of the land of Egypt, saying,","And the L<font size=""-1"">ORD</font> spake unto Moses in the wilderness of Sinai, in the tabernacle of the congregation, on the first <i>day</i> of the second month, in the second year after they were come out of the land of Egypt, saying,",""
258,33,0,"Take ye the sum of all the congregation of the children of Israel, after their families, by the house of their fathers, with the number of their names, every male by their polls;","Take ye the sum of all the congregation of the children of Israel, after their families, by the house of their fathers, with the number of <i>their</i> names, every male by their polls;",""
259,26,0,"From twenty years old and upward, all that are able to go forth to war in Israel: thou and Aaron shall number them by their armies.","From twenty years old and upward, all that are able to go forth to war in Israel: thou and Aaron shall number them by their armies.",""
260,20,0,"And with you there shall be a man of every tribe; every one head of the house of his fathers.","And with you there shall be a man of every tribe; every one head of the house of his fathers.",""
261,23,1,"And these are the names of the men that shall stand with you: of the tribe of Reuben; Elizur the son of Shedeur.","¶And these <i>are</i> the names of the men that shall stand with you: of <i>the tribe of</i> Reuben; Elizur the son of Shedeur.",""
262,7,0,"Of Simeon; Shelumiel the son of Zurishaddai.","Of Simeon; Shelumiel the son of Zurishaddai.",""
263,7,0,"Of Judah; Nahshon the son of Amminadab.","Of Judah; Nahshon the son of Amminadab.",""
264,7,0,"Of Issachar; Nethaneel the son of Zuar.","Of Issachar; Nethaneel the son of Zuar.",""
265,7,0,"Of Zebulun; Eliab the son of Helon.","Of Zebulun; Eliab the son of Helon.",""
266,19,0,"Of the children of Joseph: of Ephraim; Elishama the son of Ammihud: of Manasseh; Gamaliel the son of Pedahzur.","Of the children of Joseph: of Ephraim; Elishama the son of Ammihud: of Manasseh; Gamaliel the son of Pedahzur.",""
267,7,0,"Of Benjamin; Abidan the son of Gideoni.","Of Benjamin; Abidan the son of Gideoni.",""
268,7,0,"Of Dan; Ahiezer the son of Ammishaddai.","Of Dan; Ahiezer the son of Ammishaddai.",""
269,7,0,"Of Asher; Pagiel the son of Ocran.","Of Asher; Pagiel the son of Ocran.",""
270,7,0,"Of Gad; Eliasaph the son of Deuel.","Of Gad; Eliasaph the son of Deuel.",""
271,7,0,"Of Naphtali; Ahira the son of Enan.","Of Naphtali; Ahira the son of Enan.",""
272,19,0,"These were the renowned of the congregation, princes of the tribes of their fathers, heads of thousands in Israel.","These <i>were</i> the renowned of the congregation, princes of the tribes of their fathers, heads of thousands in Israel.",""
273,13,1,"And Moses and Aaron took these men which are expressed by their names:","¶And Moses and Aaron took these men which are expressed by <i>their</i> names:",""
274,45,0,"And they assembled all the congregation together on the first day of the second month, and they declared their pedigrees after their families, by the house of their fathers, according to the number of the names, from twenty years old and upward, by their polls.","And they assembled all the congregation together on the first <i>day</i> of the second month, and they declared their pedigrees after their families, by the house of their fathers, according to the number of the names, from twenty years old and upward, by their polls.",""
275,14,0,"As the LORD commanded Moses, so he numbered them in the wilderness of Sinai.","As the L<font size=""-1"">ORD</font> commanded Moses, so he numbered them in the wilderness of Sinai.",""
276,47,0,"And the children of Reuben, Israel's eldest son, by their generations, after their families, by the house of their fathers, according to the number of the names, by their polls, every male from twenty years old and upward, all that were able to go forth to war;","And the children of Reuben, Israel's eldest son, by their generations, after their families, by the house of their fathers, according to the number of the names, by their polls, every male from twenty years old and upward, all that were able to go forth to war;",""
277,20,0,"Those that were numbered of them, even of the tribe of Reuben, were forty and six thousand and five hundred.","Those that were numbered of them, <i>even</i> of the tribe of Reuben, <i>were</i> forty and six thousand and five hundred.",""
278,50,1,"Of the children of Simeon, by their generations, after their families, by the house of their fathers, those that were numbered of them, according to the number of the names, by their polls, every male from twenty years old and upward, all that were able to go forth to war;","¶Of the children of Simeon, by their generations, after their families, by the house of their fathers, those that were numbered of them, according to the number of the names, by their polls, every male from twenty years old and upward, all that were able to go forth to war;",""
279,20,0,"Those that were numbered of them, even of the tribe of Simeon, were fifty and nine thousand and three hundred.","Those that were numbered of them, <i>even</i> of the tribe of Simeon, <i>were</i> fifty and nine thousand and three hundred.",""
280,39,1,"Of the children of Gad, by their generations, after their families, by the house of their fathers, according to the number of the names, from twenty years old and upward, all that were able to go forth to war;","¶Of the children of Gad, by their generations, after their families, by the house of their fathers, according to the number of the names, from twenty years old and upward, all that were able to go forth to war;",""
281,21,0,"Those that were numbered of them, even of the tribe of Gad, were forty and five thousand six hundred and fifty.","Those that were numbered of them, <i>even</i> of the tribe of Gad, <i>were</i> forty and five thousand six hundred and fifty.",""
282,39,1,"Of the children of Judah, by their generations, after their families, by the house of their fathers, according to the number of the names, from twenty years old and upward, all that were able to go forth to war;","¶Of the children of Judah, by their generations, after their families, by the house of their fathers, according to the number of the names, from twenty years old and upward, all that were able to go forth to war;",""
283,20,0,"Those that were numbered of them, even of the tribe of Judah, were threescore and fourteen thousand and six hundred.","Those that were numbered of them, <i>even</i> of the tribe of Judah, <i>were</i> threescore and fourteen thousand and six hundred.",""
284,39,1,"Of the children of Issachar, by their generations, after their families, by the house of their fathers, according to the number of the names, from twenty years old and upward, all that were able to go forth to war;","¶Of the children of Issachar, by their generations, after their families, by the house of their fathers, according to the number of the names, from twenty years old and upward, all that were able to go forth to war;",""
285,20,0,"Those that were numbered of them, even of the tribe of Issachar, were fifty and four thousand and four hundred.","Those that were numbered of them, <i>even</i> of the tribe of Issachar, <i>were</i> fifty and four thousand and four hundred.",""
286,39,1,"Of the children of Zebulun, by their generations, after their families, by the house of their fathers, according to the number of the names, from twenty years old and upward, all that were able to go forth to war;","¶Of the children of Zebulun, by their generations, after their families, by the house of their fathers, according to the number of the names, from twenty years old and upward, all that were able to go forth to war;",""
287,20,0,"Those that were numbered of them, even of the tribe of Zebulun, were fifty and seven thousand and four hundred.","Those that were numbered of them, <i>even</i> of the tribe of Zebulun, <i>were</i> fifty and seven thousand and four hundred.",""
288,45,1,"Of the children of Joseph, namely, of the children of Ephraim, by their generations, after their families, by the house of their fathers, according to the number of the names, from twenty years old and upward, all that were able to go forth to war;","¶Of the children of Joseph, <i>namely</i>, of the children of Ephraim, by their generations, after their families, by the house of their fathers, according to the number of the names, from twenty years old and upward, all that were able to go forth to war;",""
289,18,0,"Those that were numbered of them, even of the tribe of Ephraim, were forty thousand and five hundred.","Those that were numbered of them, <i>even</i> of the tribe of Ephraim, <i>were</i> forty thousand and five hundred.",""
290,39,1,"Of the children of Manasseh, by their generations, after their families, by the house of their fathers, according to the number of the names, from twenty years old and upward, all that were able to go forth to war;","¶Of the children of Manasseh, by their generations, after their families, by the house of their fathers, according to the number of the names, from twenty years old and upward, all that were able to go forth to war;",""
291,20,0,"Those that were numbered of them, even of the tribe of Manasseh, were thirty and two thousand and two hundred.","Those that were numbered of them, <i>even</i> of the tribe of Manasseh, <i>were</i> thirty and two thousand and two hundred.",""
292,39,1,"Of the children of Benjamin, by their generations, after their families, by the house of their fathers, according to the number of the names, from twenty years old and upward, all that were able to go forth to war;","¶Of the children of Benjamin, by their generations, after their families, by the house of their fathers, according to the number of the names, from twenty years old and upward, all that were able to go forth to war;",""
293,20,0,"Those that were numbered of them, even of the tribe of Benjamin, were thirty and five thousand and four hundred.","Those that were numbered of them, <i>even</i> of the tribe of Benjamin, <i>were</i> thirty and five thousand and four hundred.",""
294,39,1,"Of the children of Dan, by their generations, after their families, by the house of their fathers, according to the number of the names, from twenty years old and upward, all that were able to go forth to war;","¶Of the children of Dan, by their generations, after their families, by the house of their fathers, according to the number of the names, from twenty years old and upward, all that were able to go forth to war;",""
295,20,0,"Those that were numbered of them, even of the tribe of Dan, were threescore and two thousand and seven hundred.","Those that were numbered of them, <i>even</i> of the tribe of Dan, <i>were</i> threescore and two thousand and seven hundred.",""
296,39,1,"Of the children of Asher, by their generations, after their families, by the house of their fathers, according to the number of the names, from twenty years old and upward, all that were able to go forth to war;","¶Of the children of Asher, by their generations, after their families, by the house of their fathers, according to the number of the names, from twenty years old and upward, all that were able to go forth to war;",""
297,20,0,"Those that were numbered of them, even of the tribe of Asher, were forty and one thousand and five hundred.","Those that were numbered of them, <i>even</i> of the tribe of Asher, <i>were</i> forty and one thousand and five hundred.",""
298,39,1,"Of the children of Naphtali, throughout their generations, after their families, by the house of their fathers, according to the number of the names, from twenty years old and upward, all that were able to go forth to war;","¶Of the children of Naphtali, throughout their generations, after their families, by the house of their fathers, according to the number of the names, from twenty years old and upward, all that were able to go forth to war;",""
299,20,0,"Those that were numbered of them, even of the tribe of Naphtali, were fifty and three thousand and four hundred.","Those that were numbered of them, <i>even</i> of the tribe of Naphtali, <i>were</i> fifty and three thousand and four hundred.",""
300,28,1,"These are those that were numbered, which Moses and Aaron numbered, and the princes of Israel, being twelve men: each one was for the house of his fathers.","¶These <i>are</i> those that were numbered, which Moses and Aaron numbered, and the princes of Israel, <i>being</i> twelve men: each one was for the house of his fathers.",""
301,35,0,"So were all those that were numbered of the children of Israel, by the house of their fathers, from twenty years old and upward, all that were able to go forth to war in Israel;","So were all those that were numbered of the children of Israel, by the house of their fathers, from twenty years old and upward, all that were able to go forth to war in Israel;",""
302,18,0,"Even all they that were numbered were six hundred thousand and three thousand and five hundred and fifty.","Even all they that were numbered were six hundred thousand and three thousand and five hundred and fifty.",""
303,14,1,"But the Levites after the tribe of their fathers were not numbered among them.","¶But the Levites after the tribe of their fathers were not numbered among them.",""
304,8,0,"For the LORD had spoken unto Moses, saying,","For the L<font size=""-1"">ORD</font> had spoken unto Moses, saying,",""
305,20,0,"Only thou shalt not number the tribe of Levi, neither take the sum of them among the children of Israel:","Only thou shalt not number the tribe of Levi, neither take the sum of them among the children of Israel:",""
306,48,0,"But thou shalt appoint the Levites over the tabernacle of testimony, and over all the vessels thereof, and over all things that belong to it: they shall bear the tabernacle, and all the vessels thereof; and they shall minister unto it, and shall encamp round about the tabernacle.","But thou shalt appoint the Levites over the tabernacle of testimony, and over all the vessels thereof, and over all things that <i>belong</i> to it: they shall bear the tabernacle, and all the vessels thereof; and they shall minister unto it, and shall encamp round about the tabernacle.",""
307,37,0,"And when the tabernacle setteth forward, the Levites shall take it down: and when the tabernacle is to be pitched, the Levites shall set it up: and the stranger that cometh nigh shall be put to death.","And when the tabernacle setteth forward, the Levites shall take it down: and when the tabernacle is to be pitched, the Levites shall set it up: and the stranger that cometh nigh shall be put to death.",""
308,25,0,"And the children of Israel shall pitch their tents, every man by his own camp, and every man by his own standard, throughout their hosts.","And the children of Israel shall pitch their tents, every man by his own camp, and every man by his own standard, throughout their hosts.",""
309,36,0,"But the Levites shall pitch round about the tabernacle of testimony, that there be no wrath upon the congregation of the children of Israel: and the Levites shall keep the charge of the tabernacle of testimony.","But the Levites shall pitch round about the tabernacle of testimony, that there be no wrath upon the congregation of the children of Israel: and the Levites shall keep the charge of the tabernacle of testimony.",""
310,17,0,"And the children of Israel did according to all that the LORD commanded Moses, so did they.","And the children of Israel did according to all that the L<font size=""-1"">ORD</font> commanded Moses, so did they.",""
513,10,0,"And the LORD spake unto Moses and unto Aaron, saying,","And the L<font size=""-1"">ORD</font> spake unto Moses and unto Aaron, saying,",""
514,31,0,"Every man of the children of Israel shall pitch by his own standard, with the ensign of their father's house: far off about the tabernacle of the congregation shall they pitch.","Every man of the children of Israel shall pitch by his own standard, with the ensign of their father's house: far off about the tabernacle of the congregation shall they pitch.",""
515,39,1,"And on the east side toward the rising of the sun shall they of the standard of the camp of Judah pitch throughout their armies: and Nahshon the son of Amminadab shall be captain of the children of Judah.","¶And on the east side toward the rising of the sun shall they of the standard of the camp of Judah pitch throughout their armies: and Nahshon the son of Amminadab <i>shall be</i> captain of the children of Judah.",""
516,18,0,"And his host, and those that were numbered of them, were threescore and fourteen thousand and six hundred.","And his host, and those that were numbered of them, <i>were</i> threescore and fourteen thousand and six hundred.",""
517,28,0,"And those that do pitch next unto him shall be the tribe of Issachar: and Nethaneel the son of Zuar shall be captain of the children of Issachar.","And those that do pitch next unto him <i>shall be</i> the tribe of Issachar: and Nethaneel the son of Zuar <i>shall be</i> captain of the children of Issachar.",""
518,17,0,"And his host, and those that were numbered thereof, were fifty and four thousand and four hundred.","And his host, and those that were numbered thereof, <i>were</i> fifty and four thousand and four hundred.",""
519,19,0,"Then the tribe of Zebulun: and Eliab the son of Helon shall be captain of the children of Zebulun.","<i>Then</i> the tribe of Zebulun: and Eliab the son of Helon <i>shall be</i> captain of the children of Zebulun.",""
520,17,0,"And his host, and those that were numbered thereof, were fifty and seven thousand and four hundred.","And his host, and those that were numbered thereof, <i>were</i> fifty and seven thousand and four hundred.",""
521,30,0,"All that were numbered in the camp of Judah were an hundred thousand and fourscore thousand and six thousand and four hundred, throughout their armies. These shall first set forth.","All that were numbered in the camp of Judah <i>were</i> an hundred thousand and fourscore thousand and six thousand and four hundred, throughout their armies. These shall first set forth.",""
522,32,1,"On the south side shall be the standard of the camp of Reuben according to their armies: and the captain of the children of Reuben shall be Elizur the son of Shedeur.","¶On the south side <i>shall be</i> the standard of the camp of Reuben according to their armies: and the captain of the children of Reuben <i>shall be</i> Elizur the son of Shedeur.",""
523,17,0,"And his host, and those that were numbered thereof, were forty and six thousand and five hundred.","And his host, and those that were numbered thereof, <i>were</i> forty and six thousand and five hundred.",""
524,27,0,"And those which pitch by him shall be the tribe of Simeon: and the captain of the children of Simeon shall be Shelumiel the son of Zurishaddai.","And those which pitch by him <i>shall be</i> the tribe of Simeon: and the captain of the children of Simeon <i>shall be</i> Shelumiel the son of Zurishaddai.",""
525,18,0,"And his host, and those that were numbered of them, were fifty and nine thousand and three hundred.","And his host, and those that were numbered of them, <i>were</i> fifty and nine thousand and three hundred.",""
526,20,0,"Then the tribe of Gad: and the captain of the sons of Gad shall be Eliasaph the son of Reuel.","Then the tribe of Gad: and the captain of the sons of Gad <i>shall be</i> Eliasaph the son of Reuel.",""
527,20,0,"And his host, and those that were numbered of them, were forty and five thousand and six hundred and fifty.","And his host, and those that were numbered of them, <i>were</i> forty and five thousand and six hundred and fifty.",""
528,35,0,"All that were numbered in the camp of Reuben were an hundred thousand and fifty and one thousand and four hundred and fifty, throughout their armies. And they shall set forth in the second rank.","All that were numbered in the camp of Reuben <i>were</i> an hundred thousand and fifty and one thousand and four hundred and fifty, throughout their armies. And they shall set forth in the second rank.",""
529,37,1,"Then the tabernacle of the congregation shall set forward with the camp of the Levites in the midst of the camp: as they encamp, so shall they set forward, every man in his place by their standards.","¶Then the tabernacle of the congregation shall set forward with the camp of the Levites in the midst of the camp: as they encamp, so shall they set forward, every man in his place by their standards.",""
530,32,1,"On the west side shall be the standard of the camp of Ephraim according to their armies: and the captain of the sons of Ephraim shall be Elishama the son of Ammihud.","¶On the west side <i>shall be</i> the standard of the camp of Ephraim according to their armies: and the captain of the sons of Ephraim <i>shall be</i> Elishama the son of Ammihud.",""
531,16,0,"And his host, and those that were numbered of them, were forty thousand and five hundred.","And his host, and those that were numbered of them, <i>were</i> forty thousand and five hundred.",""
532,24,0,"And by him shall be the tribe of Manasseh: and the captain of the children of Manasseh shall be Gamaliel the son of Pedahzur.","And by him <i>shall be</i> the tribe of Manasseh: and the captain of the children of Manasseh <i>shall be</i> Gamaliel the son of Pedahzur.",""
533,18,0,"And his host, and those that were numbered of them, were thirty and two thousand and two hundred.","And his host, and those that were numbered of them, <i>were</i> thirty and two thousand and two hundred.",""
534,20,0,"Then the tribe of Benjamin: and the captain of the sons of Benjamin shall be Abidan the son of Gideoni.","Then the tribe of Benjamin: and the captain of the sons of Benjamin <i>shall be</i> Abidan the son of Gideoni.",""
535,18,0,"And his host, and those that were numbered of them, were thirty and five thousand and four hundred.","And his host, and those that were numbered of them, <i>were</i> thirty and five thousand and four hundred.",""
536,31,0,"All that were numbered of the camp of Ephraim were an hundred thousand and eight thousand and an hundred, throughout their armies. And they shall go forward in the third rank.","All that were numbered of the camp of Ephraim <i>were</i> an hundred thousand and eight thousand and an hundred, throughout their armies. And they shall go forward in the third rank.",""
537,31,1,"The standard of the camp of Dan shall be on the north side by their armies: and the captain of the children of Dan shall be Ahiezer the son of Ammishaddai.","¶The standard of the camp of Dan <i>shall be</i> on the north side by their armies: and the captain of the children of Dan <i>shall be</i> Ahiezer the son of Ammishaddai.",""
538,18,0,"And his host, and those that were numbered of them, were threescore and two thousand and seven hundred.","And his host, and those that were numbered of them, <i>were</i> threescore and two thousand and seven hundred.",""
539,27,0,"And those that encamp by him shall be the tribe of Asher: and the captain of the children of Asher shall be Pagiel the son of Ocran.","And those that encamp by him <i>shall be</i> the tribe of Asher: and the captain of the children of Asher <i>shall be</i> Pagiel the son of Ocran.",""
540,18,0,"And his host, and those that were numbered of them, were forty and one thousand and five hundred.","And his host, and those that were numbered of them, <i>were</i> forty and one thousand and five hundred.",""
541,20,1,"Then the tribe of Naphtali: and the captain of the children of Naphtali shall be Ahira the son of Enan.","¶Then the tribe of Naphtali: and the captain of the children of Naphtali <i>shall be</i> Ahira the son of Enan.",""
542,18,0,"And his host, and those that were numbered of them, were fifty and three thousand and four hundred.","And his host, and those that were numbered of them, <i>were</i> fifty and three thousand and four hundred.",""
543,29,0,"All they that were numbered in the camp of Dan were an hundred thousand and fifty and seven thousand and six hundred. They shall go hindmost with their standards.","All they that were numbered in the camp of Dan <i>were</i> an hundred thousand and fifty and seven thousand and six hundred. They shall go hindmost with their standards.",""
544,40,1,"These are those which were numbered of the children of Israel by the house of their fathers: all those that were numbered of the camps throughout their hosts were six hundred thousand and three thousand and five hundred and fifty.","¶These <i>are</i> those which were numbered of the children of Israel by the house of their fathers: all those that were numbered of the camps throughout their hosts <i>were</i> six hundred thousand and three thousand and five hundred and fifty.",""
545,16,0,"But the Levites were not numbered among the children of Israel; as the LORD commanded Moses.","But the Levites were not numbered among the children of Israel; as the L<font size=""-1"">ORD</font> commanded Moses.",""
