ChpVrsNdx,NumWrd,bPilcrow,PText,RText,Footnote
2057,25,0,"And thou shalt bring the Levites before the tabernacle of the congregation: and thou shalt gather the whole assembly of the children of Israel together:","And thou shalt bring the Levites before the tabernacle of the congregation: and thou shalt gather the whole assembly of the children of Israel together:",""
2058,21,0,"And thou shalt bring the Levites before the LORD: and the children of Israel shall put their hands upon the Levites:","And thou shalt bring the Levites before the L<font size=""-1"">ORD</font>: and the children of Israel shall put their hands upon the Levites:",""
2059,26,0,"And Aaron shall offer the Levites before the LORD for an offering of the children of Israel, that they may execute the service of the LORD.","And Aaron shall offer the Levites before the L<font size=""-1"">ORD</font> <i>for</i> an offering of the children of Israel, that they may execute the service of the L<font size=""-1"">ORD</font>.",""
2060,40,0,"And the Levites shall lay their hands upon the heads of the bullocks: and thou shalt offer the one for a sin offering, and the other for a burnt offering, unto the LORD, to make an atonement for the Levites.","And the Levites shall lay their hands upon the heads of the bullocks: and thou shalt offer the one <i>for</i> a sin offering, and the other <i>for</i> a burnt offering, unto the L<font size=""-1"">ORD</font>, to make an atonement for the Levites.",""
2061,21,0,"And thou shalt set the Levites before Aaron, and before his sons, and offer them for an offering unto the LORD.","And thou shalt set the Levites before Aaron, and before his sons, and offer them <i>for</i> an offering unto the L<font size=""-1"">ORD</font>.",""
2062,18,0,"Thus shalt thou separate the Levites from among the children of Israel: and the Levites shall be mine.","Thus shalt thou separate the Levites from among the children of Israel: and the Levites shall be mine.",""
2063,29,0,"And after that shall the Levites go in to do the service of the tabernacle of the congregation: and thou shalt cleanse them, and offer them for an offering.","And after that shall the Levites go in to do the service of the tabernacle of the congregation: and thou shalt cleanse them, and offer them <i>for</i> an offering.",""
2064,37,0,"For they are wholly given unto me from among the children of Israel; instead of such as open every womb, even instead of the firstborn of all the children of Israel, have I taken them unto me.","For they <i>are</i> wholly given unto me from among the children of Israel; instead of such as open every womb, <i>even instead of</i> the firstborn of all the children of Israel, have I taken them unto me.",""
2065,33,0,"For all the firstborn of the children of Israel are mine, both man and beast: on the day that I smote every firstborn in the land of Egypt I sanctified them for myself.","For all the firstborn of the children of Israel <i>are</i> mine, <i>both</i> man and beast: on the day that I smote every firstborn in the land of Egypt I sanctified them for myself.",""
2066,15,0,"And I have taken the Levites for all the firstborn of the children of Israel.","And I have taken the Levites for all the firstborn of the children of Israel.",""
2067,66,0,"And I have given the Levites as a gift to Aaron and to his sons from among the children of Israel, to do the service of the children of Israel in the tabernacle of the congregation, and to make an atonement for the children of Israel: that there be no plague among the children of Israel, when the children of Israel come nigh unto the sanctuary.","And I have given the Levites <i>as</i> a gift to Aaron and to his sons from among the children of Israel, to do the service of the children of Israel in the tabernacle of the congregation, and to make an atonement for the children of Israel: that there be no plague among the children of Israel, when the children of Israel come nigh unto the sanctuary.",""
2068,36,0,"And Moses, and Aaron, and all the congregation of the children of Israel, did to the Levites according unto all that the LORD commanded Moses concerning the Levites, so did the children of Israel unto them.","And Moses, and Aaron, and all the congregation of the children of Israel, did to the Levites according unto all that the L<font size=""-1"">ORD</font> commanded Moses concerning the Levites, so did the children of Israel unto them.",""
2069,30,0,"And the Levites were purified, and they washed their clothes; and Aaron offered them as an offering before the LORD; and Aaron made an atonement for them to cleanse them.","And the Levites were purified, and they washed their clothes; and Aaron offered them <i>as</i> an offering before the L<font size=""-1"">ORD</font>; and Aaron made an atonement for them to cleanse them.",""
2070,37,0,"And after that went the Levites in to do their service in the tabernacle of the congregation before Aaron, and before his sons: as the LORD had commanded Moses concerning the Levites, so did they unto them.","And after that went the Levites in to do their service in the tabernacle of the congregation before Aaron, and before his sons: as the L<font size=""-1"">ORD</font> had commanded Moses concerning the Levites, so did they unto them.",""
2071,7,1,"And the LORD spake unto Moses, saying,","¶And the L<font size=""-1"">ORD</font> spake unto Moses, saying,",""
2072,31,0,"This is it that belongeth unto the Levites: from twenty and five years old and upward they shall go in to wait upon the service of the tabernacle of the congregation:","This <i>is it</i> that <i>belongeth</i> unto the Levites: from twenty and five years old and upward they shall go in to wait upon the service of the tabernacle of the congregation:",""
2073,20,0,"And from the age of fifty years they shall cease waiting upon the service thereof, and shall serve no more:","And from the age of fifty years they shall cease waiting upon the service <i>thereof</i>, and shall serve no more:",""
2074,31,0,"But shall minister with their brethren in the tabernacle of the congregation, to keep the charge, and shall do no service. Thus shalt thou do unto the Levites touching their charge.","But shall minister with their brethren in the tabernacle of the congregation, to keep the charge, and shall do no service. Thus shalt thou do unto the Levites touching their charge.",""
2305,30,0,"And the LORD spake unto Moses in the wilderness of Sinai, in the first month of the second year after they were come out of the land of Egypt, saying,","And the L<font size=""-1"">ORD</font> spake unto Moses in the wilderness of Sinai, in the first month of the second year after they were come out of the land of Egypt, saying,",""
2306,13,0,"Let the children of Israel also keep the passover at his appointed season.","Let the children of Israel also keep the passover at his appointed season.",""
2307,35,0,"In the fourteenth day of this month, at even, ye shall keep it in his appointed season: according to all the rites of it, and according to all the ceremonies thereof, shall ye keep it.","In the fourteenth day of this month, at even, ye shall keep it in his appointed season: according to all the rites of it, and according to all the ceremonies thereof, shall ye keep it.",""
2308,14,0,"And Moses spake unto the children of Israel, that they should keep the passover.","And Moses spake unto the children of Israel, that they should keep the passover.",""
2309,34,0,"And they kept the passover on the fourteenth day of the first month at even in the wilderness of Sinai: according to all that the LORD commanded Moses, so did the children of Israel.","And they kept the passover on the fourteenth day of the first month at even in the wilderness of Sinai: according to all that the L<font size=""-1"">ORD</font> commanded Moses, so did the children of Israel.",""
2310,36,1,"And there were certain men, who were defiled by the dead body of a man, that they could not keep the passover on that day: and they came before Moses and before Aaron on that day:","¶And there were certain men, who were defiled by the dead body of a man, that they could not keep the passover on that day: and they came before Moses and before Aaron on that day:",""
2311,40,0,"And those men said unto him, We are defiled by the dead body of a man: wherefore are we kept back, that we may not offer an offering of the LORD in his appointed season among the children of Israel?","And those men said unto him, We <i>are</i> defiled by the dead body of a man: wherefore are we kept back, that we may not offer an offering of the L<font size=""-1"">ORD</font> in his appointed season among the children of Israel?",""
2312,18,0,"And Moses said unto them, Stand still, and I will hear what the LORD will command concerning you.","And Moses said unto them, Stand still, and I will hear what the L<font size=""-1"">ORD</font> will command concerning you.",""
2313,7,1,"And the LORD spake unto Moses, saying,","¶And the L<font size=""-1"">ORD</font> spake unto Moses, saying,",""
2314,41,0,"Speak unto the children of Israel, saying, If any man of you or of your posterity shall be unclean by reason of a dead body, or be in a journey afar off, yet he shall keep the passover unto the LORD.","Speak unto the children of Israel, saying, If any man of you or of your posterity shall be unclean by reason of a dead body, or <i>be</i> in a journey afar off, yet he shall keep the passover unto the L<font size=""-1"">ORD</font>.",""
2315,22,0,"The fourteenth day of the second month at even they shall keep it, and eat it with unleavened bread and bitter herbs.","The fourteenth day of the second month at even they shall keep it, <i>and</i> eat it with unleavened bread and bitter <i>herbs</i>.",""
2316,27,0,"They shall leave none of it unto the morning, nor break any bone of it: according to all the ordinances of the passover they shall keep it.","They shall leave none of it unto the morning, nor break any bone of it: according to all the ordinances of the passover they shall keep it.",""
2317,49,0,"But the man that is clean, and is not in a journey, and forbeareth to keep the passover, even the same soul shall be cut off from among his people: because he brought not the offering of the LORD in his appointed season, that man shall bear his sin.","But the man that <i>is</i> clean, and is not in a journey, and forbeareth to keep the passover, even the same soul shall be cut off from among his people: because he brought not the offering of the L<font size=""-1"">ORD</font> in his appointed season, that man shall bear his sin.",""
2318,51,0,"And if a stranger shall sojourn among you, and will keep the passover unto the LORD; according to the ordinance of the passover, and according to the manner thereof, so shall he do: ye shall have one ordinance, both for the stranger, and for him that was born in the land.","And if a stranger shall sojourn among you, and will keep the passover unto the L<font size=""-1"">ORD</font>; according to the ordinance of the passover, and according to the manner thereof, so shall he do: ye shall have one ordinance, both for the stranger, and for him that was born in the land.",""
2319,39,1,"And on the day that the tabernacle was reared up the cloud covered the tabernacle, namely, the tent of the testimony: and at even there was upon the tabernacle as it were the appearance of fire, until the morning.","¶And on the day that the tabernacle was reared up the cloud covered the tabernacle, <i>namely</i>, the tent of the testimony: and at even there was upon the tabernacle as it were the appearance of fire, until the morning.",""
2320,17,0,"So it was alway: the cloud covered it by day, and the appearance of fire by night.","So it was alway: the cloud covered it <i>by day</i>, and the appearance of fire by night.",""
2321,34,0,"And when the cloud was taken up from the tabernacle, then after that the children of Israel journeyed: and in the place where the cloud abode, there the children of Israel pitched their tents.","And when the cloud was taken up from the tabernacle, then after that the children of Israel journeyed: and in the place where the cloud abode, there the children of Israel pitched their tents.",""
2322,34,0,"At the commandment of the LORD the children of Israel journeyed, and at the commandment of the LORD they pitched: as long as the cloud abode upon the tabernacle they rested in their tents.","At the commandment of the L<font size=""-1"">ORD</font> the children of Israel journeyed, and at the commandment of the L<font size=""-1"">ORD</font> they pitched: as long as the cloud abode upon the tabernacle they rested in their tents.",""
2323,25,0,"And when the cloud tarried long upon the tabernacle many days, then the children of Israel kept the charge of the LORD, and journeyed not.","And when the cloud tarried long upon the tabernacle many days, then the children of Israel kept the charge of the L<font size=""-1"">ORD</font>, and journeyed not.",""
2324,36,0,"And so it was, when the cloud was a few days upon the tabernacle; according to the commandment of the LORD they abode in their tents, and according to the commandment of the LORD they journeyed.","And <i>so</i> it was, when the cloud was a few days upon the tabernacle; according to the commandment of the L<font size=""-1"">ORD</font> they abode in their tents, and according to the commandment of the L<font size=""-1"">ORD</font> they journeyed.",""
2325,42,0,"And so it was, when the cloud abode from even unto the morning, and that the cloud was taken up in the morning, then they journeyed: whether it was by day or by night that the cloud was taken up, they journeyed.","And <i>so</i> it was, when the cloud abode from even unto the morning, and <i>that</i> the cloud was taken up in the morning, then they journeyed: whether <i>it was</i> by day or by night that the cloud was taken up, they journeyed.",""
2326,40,0,"Or whether it were two days, or a month, or a year, that the cloud tarried upon the tabernacle, remaining thereon, the children of Israel abode in their tents, and journeyed not: but when it was taken up, they journeyed.","Or <i>whether it were</i> two days, or a month, or a year, that the cloud tarried upon the tabernacle, remaining thereon, the children of Israel abode in their tents, and journeyed not: but when it was taken up, they journeyed.",""
2327,38,0,"At the commandment of the LORD they rested in the tents, and at the commandment of the LORD they journeyed: they kept the charge of the LORD, at the commandment of the LORD by the hand of Moses.","At the commandment of the L<font size=""-1"">ORD</font> they rested in the tents, and at the commandment of the L<font size=""-1"">ORD</font> they journeyed: they kept the charge of the L<font size=""-1"">ORD</font>, at the commandment of the L<font size=""-1"">ORD</font> by the hand of Moses.",""
2561,7,0,"And the LORD spake unto Moses, saying,","And the L<font size=""-1"">ORD</font> spake unto Moses, saying,",""
2562,32,0,"Make thee two trumpets of silver; of a whole piece shalt thou make them: that thou mayest use them for the calling of the assembly, and for the journeying of the camps.","Make thee two trumpets of silver; of a whole piece shalt thou make them: that thou mayest use them for the calling of the assembly, and for the journeying of the camps.",""
2563,24,0,"And when they shall blow with them, all the assembly shall assemble themselves to thee at the door of the tabernacle of the congregation.","And when they shall blow with them, all the assembly shall assemble themselves to thee at the door of the tabernacle of the congregation.",""
2564,24,0,"And if they blow but with one trumpet, then the princes, which are heads of the thousands of Israel, shall gather themselves unto thee.","And if they blow <i>but</i> with one <i>trumpet</i>, then the princes, <i>which are</i> heads of the thousands of Israel, shall gather themselves unto thee.",""
2565,17,0,"When ye blow an alarm, then the camps that lie on the east parts shall go forward.","When ye blow an alarm, then the camps that lie on the east parts shall go forward.",""
2566,29,0,"When ye blow an alarm the second time, then the camps that lie on the south side shall take their journey: they shall blow an alarm for their journeys.","When ye blow an alarm the second time, then the camps that lie on the south side shall take their journey: they shall blow an alarm for their journeys.",""
2567,19,0,"But when the congregation is to be gathered together, ye shall blow, but ye shall not sound an alarm.","But when the congregation is to be gathered together, ye shall blow, but ye shall not sound an alarm.",""
2568,26,0,"And the sons of Aaron, the priests, shall blow with the trumpets; and they shall be to you for an ordinance for ever throughout your generations.","And the sons of Aaron, the priests, shall blow with the trumpets; and they shall be to you for an ordinance for ever throughout your generations.",""
2569,42,0,"And if ye go to war in your land against the enemy that oppresseth you, then ye shall blow an alarm with the trumpets; and ye shall be remembered before the LORD your God, and ye shall be saved from your enemies.","And if ye go to war in your land against the enemy that oppresseth you, then ye shall blow an alarm with the trumpets; and ye shall be remembered before the L<font size=""-1"">ORD</font> your God, and ye shall be saved from your enemies.",""
2570,55,0,"Also in the day of your gladness, and in your solemn days, and in the beginnings of your months, ye shall blow with the trumpets over your burnt offerings, and over the sacrifices of your peace offerings; that they may be to you for a memorial before your God: I am the LORD your God.","Also in the day of your gladness, and in your solemn days, and in the beginnings of your months, ye shall blow with the trumpets over your burnt offerings, and over the sacrifices of your peace offerings; that they may be to you for a memorial before your God: I <i>am</i> the L<font size=""-1"">ORD</font> your God.",""
2571,30,1,"And it came to pass on the twentieth day of the second month, in the second year, that the cloud was taken up from off the tabernacle of the testimony.","¶And it came to pass on the twentieth <i>day</i> of the second month, in the second year, that the cloud was taken up from off the tabernacle of the testimony.",""
2572,23,0,"And the children of Israel took their journeys out of the wilderness of Sinai; and the cloud rested in the wilderness of Paran.","And the children of Israel took their journeys out of the wilderness of Sinai; and the cloud rested in the wilderness of Paran.",""
2573,18,0,"And they first took their journey according to the commandment of the LORD by the hand of Moses.","And they first took their journey according to the commandment of the L<font size=""-1"">ORD</font> by the hand of Moses.",""
2574,29,1,"In the first place went the standard of the camp of the children of Judah according to their armies: and over his host was Nahshon the son of Amminadab.","¶In the first <i>place</i> went the standard of the camp of the children of Judah according to their armies: and over his host <i>was</i> Nahshon the son of Amminadab.",""
2575,18,0,"And over the host of the tribe of the children of Issachar was Nethaneel the son of Zuar.","And over the host of the tribe of the children of Issachar <i>was</i> Nethaneel the son of Zuar.",""
2576,18,0,"And over the host of the tribe of the children of Zebulun was Eliab the son of Helon.","And over the host of the tribe of the children of Zebulun <i>was</i> Eliab the son of Helon.",""
2577,21,0,"And the tabernacle was taken down; and the sons of Gershon and the sons of Merari set forward, bearing the tabernacle.","And the tabernacle was taken down; and the sons of Gershon and the sons of Merari set forward, bearing the tabernacle.",""
2578,24,1,"And the standard of the camp of Reuben set forward according to their armies: and over his host was Elizur the son of Shedeur.","¶And the standard of the camp of Reuben set forward according to their armies: and over his host <i>was</i> Elizur the son of Shedeur.",""
2579,18,0,"And over the host of the tribe of the children of Simeon was Shelumiel the son of Zurishaddai.","And over the host of the tribe of the children of Simeon <i>was</i> Shelumiel the son of Zurishaddai.",""
2580,18,0,"And over the host of the tribe of the children of Gad was Eliasaph the son of Deuel.","And over the host of the tribe of the children of Gad <i>was</i> Eliasaph the son of Deuel.",""
2581,19,0,"And the Kohathites set forward, bearing the sanctuary: and the other did set up the tabernacle against they came.","And the Kohathites set forward, bearing the sanctuary: and <i>the other</i> did set up the tabernacle against they came.",""
2582,27,1,"And the standard of the camp of the children of Ephraim set forward according to their armies: and over his host was Elishama the son of Ammihud.","¶And the standard of the camp of the children of Ephraim set forward according to their armies: and over his host <i>was</i> Elishama the son of Ammihud.",""
2583,18,0,"And over the host of the tribe of the children of Manasseh was Gamaliel the son of Pedahzur.","And over the host of the tribe of the children of Manasseh <i>was</i> Gamaliel the son of Pedahzur.",""
2584,18,0,"And over the host of the tribe of the children of Benjamin was Abidan the son of Gideoni.","And over the host of the tribe of the children of Benjamin <i>was</i> Abidan the son of Gideoni.",""
2585,34,1,"And the standard of the camp of the children of Dan set forward, which was the rereward of all the camps throughout their hosts: and over his host was Ahiezer the son of Ammishaddai.","¶And the standard of the camp of the children of Dan set forward, <i>which was</i> the rereward of all the camps throughout their hosts: and over his host <i>was</i> Ahiezer the son of Ammishaddai.",""
2586,18,0,"And over the host of the tribe of the children of Asher was Pagiel the son of Ocran.","And over the host of the tribe of the children of Asher <i>was</i> Pagiel the son of Ocran.",""
2587,18,0,"And over the host of the tribe of the children of Naphtali was Ahira the son of Enan.","And over the host of the tribe of the children of Naphtali <i>was</i> Ahira the son of Enan.",""
2588,17,0,"Thus were the journeyings of the children of Israel according to their armies, when they set forward.","Thus <i>were</i> the journeyings of the children of Israel according to their armies, when they set forward.",""
2589,49,1,"And Moses said unto Hobab, the son of Raguel the Midianite, Moses' father in law, We are journeying unto the place of which the LORD said, I will give it you: come thou with us, and we will do thee good: for the LORD hath spoken good concerning Israel.","¶And Moses said unto Hobab, the son of Raguel the Midianite, Moses' father in law, We are journeying unto the place of which the L<font size=""-1"">ORD</font> said, I will give it you: come thou with us, and we will do thee good: for the L<font size=""-1"">ORD</font> hath spoken good concerning Israel.",""
2590,21,0,"And he said unto him, I will not go; but I will depart to mine own land, and to my kindred.","And he said unto him, I will not go; but I will depart to mine own land, and to my kindred.",""
2591,30,0,"And he said, Leave us not, I pray thee; forasmuch as thou knowest how we are to encamp in the wilderness, and thou mayest be to us instead of eyes.","And he said, Leave us not, I pray thee; forasmuch as thou knowest how we are to encamp in the wilderness, and thou mayest be to us instead of eyes.",""
2592,29,0,"And it shall be, if thou go with us, yea, it shall be, that what goodness the LORD shall do unto us, the same will we do unto thee.","And it shall be, if thou go with us, yea, it shall be, that what goodness the L<font size=""-1"">ORD</font> shall do unto us, the same will we do unto thee.",""
2593,37,1,"And they departed from the mount of the LORD three days' journey: and the ark of the covenant of the LORD went before them in the three days' journey, to search out a resting place for them.","¶And they departed from the mount of the L<font size=""-1"">ORD</font> three days' journey: and the ark of the covenant of the L<font size=""-1"">ORD</font> went before them in the three days' journey, to search out a resting place for them.",""
2594,18,0,"And the cloud of the LORD was upon them by day, when they went out of the camp.","And the cloud of the L<font size=""-1"">ORD</font> <i>was</i> upon them by day, when they went out of the camp.",""
2595,31,0,"And it came to pass, when the ark set forward, that Moses said, Rise up, LORD, and let thine enemies be scattered; and let them that hate thee flee before thee.","And it came to pass, when the ark set forward, that Moses said, Rise up, L<font size=""-1"">ORD</font>, and let thine enemies be scattered; and let them that hate thee flee before thee.",""
2596,15,0,"And when it rested, he said, Return, O LORD, unto the many thousands of Israel.","And when it rested, he said, Return, O L<font size=""-1"">ORD</font>, unto the many thousands of Israel.",""
2817,40,0,"And when the people complained, it displeased the LORD: and the LORD heard it; and his anger was kindled; and the fire of the LORD burnt among them, and consumed them that were in the uttermost parts of the camp.","And <i>when</i> the people complained, it displeased the L<font size=""-1"">ORD</font>: and the L<font size=""-1"">ORD</font> heard <i>it</i>; and his anger was kindled; and the fire of the L<font size=""-1"">ORD</font> burnt among them, and consumed <i>them that were</i> in the uttermost parts of the camp.",""
