ChpVrsNdx,NumWrd,bPilcrow,PText,RText,Footnote
7442,31,0,"And thou shalt burn the whole ram upon the altar: it is a burnt offering unto the LORD: it is a sweet savour, an offering made by fire unto the LORD.","And thou shalt burn the whole ram upon the altar: it <i>is</i> a burnt offering unto the L<font size=""-1"">ORD</font>: it <i>is</i> a sweet savour, an offering made by fire unto the L<font size=""-1"">ORD</font>.",""
7443,22,1,"And thou shalt take the other ram; and Aaron and his sons shall put their hands upon the head of the ram.","¶And thou shalt take the other ram; and Aaron and his sons shall put their hands upon the head of the ram.",""
7444,60,0,"Then shalt thou kill the ram, and take of his blood, and put it upon the tip of the right ear of Aaron, and upon the tip of the right ear of his sons, and upon the thumb of their right hand, and upon the great toe of their right foot, and sprinkle the blood upon the altar round about.","Then shalt thou kill the ram, and take of his blood, and put <i>it</i> upon the tip of the right ear of Aaron, and upon the tip of the right ear of his sons, and upon the thumb of their right hand, and upon the great toe of their right foot, and sprinkle the blood upon the altar round about.",""
7445,56,0,"And thou shalt take of the blood that is upon the altar, and of the anointing oil, and sprinkle it upon Aaron, and upon his garments, and upon his sons, and upon the garments of his sons with him: and he shall be hallowed, and his garments, and his sons, and his sons' garments with him.","And thou shalt take of the blood that <i>is</i> upon the altar, and of the anointing oil, and sprinkle <i>it</i> upon Aaron, and upon his garments, and upon his sons, and upon the garments of his sons with him: and he shall be hallowed, and his garments, and his sons, and his sons' garments with him.",""
7446,47,0,"Also thou shalt take of the ram the fat and the rump, and the fat that covereth the inwards, and the caul above the liver, and the two kidneys, and the fat that is upon them, and the right shoulder; for it is a ram of consecration:","Also thou shalt take of the ram the fat and the rump, and the fat that covereth the inwards, and the caul <i>above</i> the liver, and the two kidneys, and the fat that <i>is</i> upon them, and the right shoulder; for it <i>is</i> a ram of consecration:",""
7447,27,0,"And one loaf of bread, and one cake of oiled bread, and one wafer out of the basket of the unleavened bread that is before the LORD:","And one loaf of bread, and one cake of oiled bread, and one wafer out of the basket of the unleavened bread that <i>is</i> before the L<font size=""-1"">ORD</font>:",""
7448,28,0,"And thou shalt put all in the hands of Aaron, and in the hands of his sons; and shalt wave them for a wave offering before the LORD.","And thou shalt put all in the hands of Aaron, and in the hands of his sons; and shalt wave them <i>for</i> a wave offering before the L<font size=""-1"">ORD</font>.",""
7449,35,0,"And thou shalt receive them of their hands, and burn them upon the altar for a burnt offering, for a sweet savour before the LORD: it is an offering made by fire unto the LORD.","And thou shalt receive them of their hands, and burn <i>them</i> upon the altar for a burnt offering, for a sweet savour before the L<font size=""-1"">ORD</font>: it <i>is</i> an offering made by fire unto the L<font size=""-1"">ORD</font>.",""
7450,28,0,"And thou shalt take the breast of the ram of Aaron's consecration, and wave it for a wave offering before the LORD: and it shall be thy part.","And thou shalt take the breast of the ram of Aaron's consecration, and wave it <i>for</i> a wave offering before the L<font size=""-1"">ORD</font>: and it shall be thy part.",""
7451,46,0,"And thou shalt sanctify the breast of the wave offering, and the shoulder of the heave offering, which is waved, and which is heaved up, of the ram of the consecration, even of that which is for Aaron, and of that which is for his sons:","And thou shalt sanctify the breast of the wave offering, and the shoulder of the heave offering, which is waved, and which is heaved up, of the ram of the consecration, <i>even</i> of <i>that</i> which <i>is</i> for Aaron, and of <i>that</i> which is for his sons:",""
7452,50,0,"And it shall be Aaron's and his sons' by a statute for ever from the children of Israel: for it is an heave offering: and it shall be an heave offering from the children of Israel of the sacrifice of their peace offerings, even their heave offering unto the LORD.","And it shall be Aaron's and his sons' by a statute for ever from the children of Israel: for it <i>is</i> an heave offering: and it shall be an heave offering from the children of Israel of the sacrifice of their peace offerings, <i>even</i> their heave offering unto the L<font size=""-1"">ORD</font>.",""
7453,22,1,"And the holy garments of Aaron shall be his sons' after him, to be anointed therein, and to be consecrated in them.","¶And the holy garments of Aaron shall be his sons' after him, to be anointed therein, and to be consecrated in them.",""
7454,30,0,"And that son that is priest in his stead shall put them on seven days, when he cometh into the tabernacle of the congregation to minister in the holy place.","<i>And</i> that son that is priest in his stead shall put them on seven days, when he cometh into the tabernacle of the congregation to minister in the holy <i>place</i>.",""
7455,17,1,"And thou shalt take the ram of the consecration, and seethe his flesh in the holy place.","¶And thou shalt take the ram of the consecration, and seethe his flesh in the holy place.",""
7456,29,0,"And Aaron and his sons shall eat the flesh of the ram, and the bread that is in the basket, by the door of the tabernacle of the congregation.","And Aaron and his sons shall eat the flesh of the ram, and the bread that <i>is</i> in the basket, <i>by</i> the door of the tabernacle of the congregation.",""
7457,28,0,"And they shall eat those things wherewith the atonement was made, to consecrate and to sanctify them: but a stranger shall not eat thereof, because they are holy.","And they shall eat those things wherewith the atonement was made, to consecrate <i>and</i> to sanctify them: but a stranger shall not eat <i>thereof</i>, because they <i>are</i> holy.",""
7458,34,0,"And if ought of the flesh of the consecrations, or of the bread, remain unto the morning, then thou shalt burn the remainder with fire: it shall not be eaten, because it is holy.","And if ought of the flesh of the consecrations, or of the bread, remain unto the morning, then thou shalt burn the remainder with fire: it shall not be eaten, because it <i>is</i> holy.",""
7459,26,0,"And thus shalt thou do unto Aaron, and to his sons, according to all things which I have commanded thee: seven days shalt thou consecrate them.","And thus shalt thou do unto Aaron, and to his sons, according to all <i>things</i> which I have commanded thee: seven days shalt thou consecrate them.",""
7460,36,0,"And thou shalt offer every day a bullock for a sin offering for atonement: and thou shalt cleanse the altar, when thou hast made an atonement for it, and thou shalt anoint it, to sanctify it.","And thou shalt offer every day a bullock <i>for</i> a sin offering for atonement: and thou shalt cleanse the altar, when thou hast made an atonement for it, and thou shalt anoint it, to sanctify it.",""
7461,28,0,"Seven days thou shalt make an atonement for the altar, and sanctify it; and it shall be an altar most holy: whatsoever toucheth the altar shall be holy.","Seven days thou shalt make an atonement for the altar, and sanctify it; and it shall be an altar most holy: whatsoever toucheth the altar shall be holy.",""
7462,21,1,"Now this is that which thou shalt offer upon the altar; two lambs of the first year day by day continually.","¶Now this <i>is that</i> which thou shalt offer upon the altar; two lambs of the first year day by day continually.",""
7463,18,0,"The one lamb thou shalt offer in the morning; and the other lamb thou shalt offer at even:","The one lamb thou shalt offer in the morning; and the other lamb thou shalt offer at even:",""
7464,34,0,"And with the one lamb a tenth deal of flour mingled with the fourth part of an hin of beaten oil; and the fourth part of an hin of wine for a drink offering.","And with the one lamb a tenth deal of flour mingled with the fourth part of an hin of beaten oil; and the fourth part of an hin of wine <i>for</i> a drink offering.",""
7465,40,0,"And the other lamb thou shalt offer at even, and shalt do thereto according to the meat offering of the morning, and according to the drink offering thereof, for a sweet savour, an offering made by fire unto the LORD.","And the other lamb thou shalt offer at even, and shalt do thereto according to the meat offering of the morning, and according to the drink offering thereof, for a sweet savour, an offering made by fire unto the L<font size=""-1"">ORD</font>.",""
7466,32,0,"This shall be a continual burnt offering throughout your generations at the door of the tabernacle of the congregation before the LORD: where I will meet you, to speak there unto thee.","<i>This shall be</i> a continual burnt offering throughout your generations <i>at</i> the door of the tabernacle of the congregation before the L<font size=""-1"">ORD</font>: where I will meet you, to speak there unto thee.",""
7467,19,0,"And there I will meet with the children of Israel, and the tabernacle shall be sanctified by my glory.","And there I will meet with the children of Israel, and <i>the tabernacle</i> shall be sanctified by my glory.",""
7468,29,0,"And I will sanctify the tabernacle of the congregation, and the altar: I will sanctify also both Aaron and his sons, to minister to me in the priest's office.","And I will sanctify the tabernacle of the congregation, and the altar: I will sanctify also both Aaron and his sons, to minister to me in the priest's office.",""
7469,14,1,"And I will dwell among the children of Israel, and will be their God.","¶And I will dwell among the children of Israel, and will be their God.",""
7470,33,0,"And they shall know that I am the LORD their God, that brought them forth out of the land of Egypt, that I may dwell among them: I am the LORD their God.","And they shall know that I <i>am</i> the L<font size=""-1"">ORD</font> their God, that brought them forth out of the land of Egypt, that I may dwell among them: I <i>am</i> the L<font size=""-1"">ORD</font> their God.",""
7681,17,0,"And thou shalt make an altar to burn incense upon: of shittim wood shalt thou make it.","And thou shalt make an altar to burn incense upon: <i>of</i> shittim wood shalt thou make it.",""
7682,33,0,"A cubit shall be the length thereof, and a cubit the breadth thereof; foursquare shall it be: and two cubits shall be the height thereof: the horns thereof shall be of the same.","A cubit <i>shall be</i> the length thereof, and a cubit the breadth thereof; foursquare shall it be: and two cubits <i>shall be</i> the height thereof: the horns thereof <i>shall be</i> of the same.",""
7683,33,0,"And thou shalt overlay it with pure gold, the top thereof, and the sides thereof round about, and the horns thereof; and thou shalt make unto it a crown of gold round about.","And thou shalt overlay it with pure gold, the top thereof, and the sides thereof round about, and the horns thereof; and thou shalt make unto it a crown of gold round about.",""
7684,42,0,"And two golden rings shalt thou make to it under the crown of it, by the two corners thereof, upon the two sides of it shalt thou make it; and they shall be for places for the staves to bear it withal.","And two golden rings shalt thou make to it under the crown of it, by the two corners thereof, upon the two sides of it shalt thou make <i>it</i>; and they shall be for places for the staves to bear it withal.",""
7685,14,0,"And thou shalt make the staves of shittim wood, and overlay them with gold.","And thou shalt make the staves <i>of</i> shittim wood, and overlay them with gold.",""
7686,31,0,"And thou shalt put it before the vail that is by the ark of the testimony, before the mercy seat that is over the testimony, where I will meet with thee.","And thou shalt put it before the vail that <i>is</i> by the ark of the testimony, before the mercy seat that <i>is</i> over the testimony, where I will meet with thee.",""
7687,20,0,"And Aaron shall burn thereon sweet incense every morning: when he dresseth the lamps, he shall burn incense upon it.","And Aaron shall burn thereon sweet incense every morning: when he dresseth the lamps, he shall burn incense upon it.",""
7688,23,0,"And when Aaron lighteth the lamps at even, he shall burn incense upon it, a perpetual incense before the LORD throughout your generations.","And when Aaron lighteth the lamps at even, he shall burn incense upon it, a perpetual incense before the L<font size=""-1"">ORD</font> throughout your generations.",""
7689,20,0,"Ye shall offer no strange incense thereon, nor burnt sacrifice, nor meat offering; neither shall ye pour drink offering thereon.","Ye shall offer no strange incense thereon, nor burnt sacrifice, nor meat offering; neither shall ye pour drink offering thereon.",""
7690,44,0,"And Aaron shall make an atonement upon the horns of it once in a year with the blood of the sin offering of atonements: once in the year shall he make atonement upon it throughout your generations: it is most holy unto the LORD.","And Aaron shall make an atonement upon the horns of it once in a year with the blood of the sin offering of atonements: once in the year shall he make atonement upon it throughout your generations: it <i>is</i> most holy unto the L<font size=""-1"">ORD</font>.",""
7691,7,1,"And the LORD spake unto Moses, saying,","¶And the L<font size=""-1"">ORD</font> spake unto Moses, saying,",""
7692,42,0,"When thou takest the sum of the children of Israel after their number, then shall they give every man a ransom for his soul unto the LORD, when thou numberest them; that there be no plague among them, when thou numberest them.","When thou takest the sum of the children of Israel after their number, then shall they give every man a ransom for his soul unto the L<font size=""-1"">ORD</font>, when thou numberest them; that there be no plague among them, when <i>thou</i> numberest them.",""
7693,37,0,"This they shall give, every one that passeth among them that are numbered, half a shekel after the shekel of the sanctuary: (a shekel is twenty gerahs:) an half shekel shall be the offering of the LORD.","This they shall give, every one that passeth among them that are numbered, half a shekel after the shekel of the sanctuary: (a shekel <i>is</i> twenty gerahs:) an half shekel <i>shall be</i> the offering of the L<font size=""-1"">ORD</font>.",""
7694,22,0,"Every one that passeth among them that are numbered, from twenty years old and above, shall give an offering unto the LORD.","Every one that passeth among them that are numbered, from twenty years old and above, shall give an offering unto the L<font size=""-1"">ORD</font>.",""
7695,32,0,"The rich shall not give more, and the poor shall not give less than half a shekel, when they give an offering unto the LORD, to make an atonement for your souls.","The rich shall not give more, and the poor shall not give less than half a shekel, when <i>they</i> give an offering unto the L<font size=""-1"">ORD</font>, to make an atonement for your souls.",""
7696,46,0,"And thou shalt take the atonement money of the children of Israel, and shalt appoint it for the service of the tabernacle of the congregation; that it may be a memorial unto the children of Israel before the LORD, to make an atonement for your souls.","And thou shalt take the atonement money of the children of Israel, and shalt appoint it for the service of the tabernacle of the congregation; that it may be a memorial unto the children of Israel before the L<font size=""-1"">ORD</font>, to make an atonement for your souls.",""
7697,7,1,"And the LORD spake unto Moses, saying,","¶And the L<font size=""-1"">ORD</font> spake unto Moses, saying,",""
7698,37,0,"Thou shalt also make a laver of brass, and his foot also of brass, to wash withal: and thou shalt put it between the tabernacle of the congregation and the altar, and thou shalt put water therein.","Thou shalt also make a laver <i>of</i> brass, and his foot <i>also of</i> brass, to wash <i>withal</i>: and thou shalt put it between the tabernacle of the congregation and the altar, and thou shalt put water therein.",""
7699,13,0,"For Aaron and his sons shall wash their hands and their feet thereat:","For Aaron and his sons shall wash their hands and their feet thereat:",""
7700,37,0,"When they go into the tabernacle of the congregation, they shall wash with water, that they die not; or when they come near to the altar to minister, to burn offering made by fire unto the LORD:","When they go into the tabernacle of the congregation, they shall wash with water, that they die not; or when they come near to the altar to minister, to burn offering made by fire unto the L<font size=""-1"">ORD</font>:",""
7701,33,0,"So they shall wash their hands and their feet, that they die not: and it shall be a statute for ever to them, even to him and to his seed throughout their generations.","So they shall wash their hands and their feet, that they die not: and it shall be a statute for ever to them, <i>even</i> to him and to his seed throughout their generations.",""
7702,7,1,"Moreover the LORD spake unto Moses, saying,","¶Moreover the L<font size=""-1"">ORD</font> spake unto Moses, saying,",""
7703,35,0,"Take thou also unto thee principal spices, of pure myrrh five hundred shekels, and of sweet cinnamon half so much, even two hundred and fifty shekels, and of sweet calamus two hundred and fifty shekels,","Take thou also unto thee principal spices, of pure myrrh five hundred <i>shekels</i>, and of sweet cinnamon half so much, <i>even</i> two hundred and fifty <i>shekels</i>, and of sweet calamus two hundred and fifty <i>shekels</i>,",""
7704,18,0,"And of cassia five hundred shekels, after the shekel of the sanctuary, and of oil olive an hin:","And of cassia five hundred <i>shekels</i>, after the shekel of the sanctuary, and of oil olive an hin:",""
7705,26,0,"And thou shalt make it an oil of holy ointment, an ointment compound after the art of the apothecary: it shall be an holy anointing oil.","And thou shalt make it an oil of holy ointment, an ointment compound after the art of the apothecary: it shall be an holy anointing oil.",""
7706,16,0,"And thou shalt anoint the tabernacle of the congregation therewith, and the ark of the testimony,","And thou shalt anoint the tabernacle of the congregation therewith, and the ark of the testimony,",""
7707,18,0,"And the table and all his vessels, and the candlestick and his vessels, and the altar of incense,","And the table and all his vessels, and the candlestick and his vessels, and the altar of incense,",""
7708,16,0,"And the altar of burnt offering with all his vessels, and the laver and his foot.","And the altar of burnt offering with all his vessels, and the laver and his foot.",""
7709,17,0,"And thou shalt sanctify them, that they may be most holy: whatsoever toucheth them shall be holy.","And thou shalt sanctify them, that they may be most holy: whatsoever toucheth them shall be holy.",""
7710,21,0,"And thou shalt anoint Aaron and his sons, and consecrate them, that they may minister unto me in the priest's office.","And thou shalt anoint Aaron and his sons, and consecrate them, that <i>they</i> may minister unto me in the priest's office.",""
7711,22,0,"And thou shalt speak unto the children of Israel, saying, This shall be an holy anointing oil unto me throughout your generations.","And thou shalt speak unto the children of Israel, saying, This shall be an holy anointing oil unto me throughout your generations.",""
7712,31,0,"Upon man's flesh shall it not be poured, neither shall ye make any other like it, after the composition of it: it is holy, and it shall be holy unto you.","Upon man's flesh shall it not be poured, neither shall ye make <i>any other</i> like it, after the composition of it: it <i>is</i> holy, <i>and</i> it shall be holy unto you.",""
7713,22,0,"Whosoever compoundeth any like it, or whosoever putteth any of it upon a stranger, shall even be cut off from his people.","Whosoever compoundeth <i>any</i> like it, or whosoever putteth <i>any</i> of it upon a stranger, shall even be cut off from his people.",""
7714,30,1,"And the LORD said unto Moses, Take unto thee sweet spices, stacte, and onycha, and galbanum; these sweet spices with pure frankincense: of each shall there be a like weight:","¶And the L<font size=""-1"">ORD</font> said unto Moses, Take unto thee sweet spices, stacte, and onycha, and galbanum; <i>these</i> sweet spices with pure frankincense: of each shall there be a like <i>weight</i>:",""
7715,20,0,"And thou shalt make it a perfume, a confection after the art of the apothecary, tempered together, pure and holy:","And thou shalt make it a perfume, a confection after the art of the apothecary, tempered together, pure <i>and</i> holy:",""
7716,35,0,"And thou shalt beat some of it very small, and put of it before the testimony in the tabernacle of the congregation, where I will meet with thee: it shall be unto you most holy.","And thou shalt beat <i>some</i> of it very small, and put of it before the testimony in the tabernacle of the congregation, where I will meet with thee: it shall be unto you most holy.",""
7717,29,0,"And as for the perfume which thou shalt make, ye shall not make to yourselves according to the composition thereof: it shall be unto thee holy for the LORD.","And <i>as for</i> the perfume which thou shalt make, ye shall not make to yourselves according to the composition thereof: it shall be unto thee holy for the L<font size=""-1"">ORD</font>.",""
7718,17,0,"Whosoever shall make like unto that, to smell thereto, shall even be cut off from his people.","Whosoever shall make like unto that, to smell thereto, shall even be cut off from his people.",""
7937,7,0,"And the LORD spake unto Moses, saying,","And the L<font size=""-1"">ORD</font> spake unto Moses, saying,",""
7938,20,0,"See, I have called by name Bezaleel the son of Uri, the son of Hur, of the tribe of Judah:","See, I have called by name Bezaleel the son of Uri, the son of Hur, of the tribe of Judah:",""
7939,24,0,"And I have filled him with the spirit of God, in wisdom, and in understanding, and in knowledge, and in all manner of workmanship,","And I have filled him with the spirit of God, in wisdom, and in understanding, and in knowledge, and in all manner of workmanship,",""
7940,14,0,"To devise cunning works, to work in gold, and in silver, and in brass,","To devise cunning works, to work in gold, and in silver, and in brass,",""
7941,20,0,"And in cutting of stones, to set them, and in carving of timber, to work in all manner of workmanship.","And in cutting of stones, to set <i>them</i>, and in carving of timber, to work in all manner of workmanship.",""
7942,42,0,"And I, behold, I have given with him Aholiab, the son of Ahisamach, of the tribe of Dan: and in the hearts of all that are wise hearted I have put wisdom, that they may make all that I have commanded thee;","And I, behold, I have given with him Aholiab, the son of Ahisamach, of the tribe of Dan: and in the hearts of all that are wise hearted I have put wisdom, that they may make all that I have commanded thee;",""
7943,25,0,"The tabernacle of the congregation, and the ark of the testimony, and the mercy seat that is thereupon, and all the furniture of the tabernacle,","The tabernacle of the congregation, and the ark of the testimony, and the mercy seat that <i>is</i> thereupon, and all the furniture of the tabernacle,",""
7944,19,0,"And the table and his furniture, and the pure candlestick with all his furniture, and the altar of incense,","And the table and his furniture, and the pure candlestick with all his furniture, and the altar of incense,",""
7945,16,0,"And the altar of burnt offering with all his furniture, and the laver and his foot,","And the altar of burnt offering with all his furniture, and the laver and his foot,",""
7946,25,0,"And the cloths of service, and the holy garments for Aaron the priest, and the garments of his sons, to minister in the priest's office,","And the cloths of service, and the holy garments for Aaron the priest, and the garments of his sons, to minister in the priest's office,",""
7947,22,0,"And the anointing oil, and sweet incense for the holy place: according to all that I have commanded thee shall they do.","And the anointing oil, and sweet incense for the holy <i>place</i>: according to all that I have commanded thee shall they do.",""
7948,7,1,"And the LORD spake unto Moses, saying,","¶And the L<font size=""-1"">ORD</font> spake unto Moses, saying,",""
7949,40,0,"Speak thou also unto the children of Israel, saying, Verily my sabbaths ye shall keep: for it is a sign between me and you throughout your generations; that ye may know that I am the LORD that doth sanctify you.","Speak thou also unto the children of Israel, saying, Verily my sabbaths ye shall keep: for it <i>is</i> a sign between me and you throughout your generations; that <i>ye</i> may know that I <i>am</i> the L<font size=""-1"">ORD</font> that doth sanctify you.",""
